Title,Authors,Subjects,Abstract,PDF
Direct Collapse Supermassive Black Holes from Ultralight Dark Matter,"Hao Jiao,Robert Brandenberger,Vahid Kamali",Cosmology and Nongalactic Astrophysics (astro-ph.CO); Astrophysics of Galaxies (astro-ph.GA); General Relativity and Quantum Cosmology (gr-qc); High Energy Physics - Phenomenology (hep-ph); High Energy Physics - Theory (hep-th),We study the possibility that parametric resonant excitation of photons in an ultralight dark matter halo could generate the required flux of Lyman-Werner photons to allow the direct collapse formation of supermassive black hole seeds.,https://arxiv.org/pdf/2503.19414
Dynamical Dark Energy Emerges from Massive Gravity,Juri Smirnov,Cosmology and Nongalactic Astrophysics (astro-ph.CO); General Relativity and Quantum Cosmology (gr-qc); High Energy Physics - Phenomenology (hep-ph); High Energy Physics - Theory (hep-th),"In this work, we demonstrate that a dynamical dark energy component predicted by massive gravity gives rise to a distinctive evolution of the equation of state. This scenario is favoured over the standard $\Lambda$CDM model when confronted with the latest combined datasets from the Dark Energy Spectroscopic Instrument (DESI), the cosmic microwave background (CMB), and supernova observations. The model stands out as a rare example of a healthy, self-consistent theory that accommodates phantom dark energy while maintaining a technically natural, small asymptotic cosmological constant. Our analysis indicates a preferred graviton mass of approximately $4.0 \times 10^{-33} \text{eV}$, suggesting the emergence of a new cosmological length scale. This leads to a maximal deviation of the equation of state around $z \sim 3$, a prediction that will be robustly tested by upcoming, deeper surveys of baryon acoustic oscillations.",https://arxiv.org/pdf/2505.03870
Primordial black hole-star binaries via dynamical friction,Nicolas Esser,High Energy Astrophysical Phenomena (astro-ph.HE); Cosmology and Nongalactic Astrophysics (astro-ph.CO),"We study a new channel for binary system formation involving stars and stellar-mass primordial black holes (PBHs) embedded in dark matter (DM) minihalos. In this scenario, binaries form when a star passes through the DM minihalo surrounding a PBH and loses sufficient energy due to dynamical friction. The continued energy loss induced by this friction is expected to drive the resulting systems to merge rapidly. We estimate their merger rate and explore the implications for two observables: rapidly decaying X-ray binaries in the Milky Way and gravitational waves sourced by compact object mergers. We find that this mechanism naturally produces a population of O(1) currently observable short-lived X-ray binaries. It also leads to a non-negligible gravitational wave event rate of O(0.3) Gpc$^{-3}$ yr$^{-1}$, potentially involving high mass ratios and black holes in the lower or upper mass gap. This dynamical friction channel thus offers a plausible explanation for several unusual observations reported in recent years across both the X-ray and gravitational wave domains.",https://arxiv.org/pdf/2505.05564
Beyond the Power Spectrum: A New Framework for Non-Stationary Fields with Applications to Light-Cone Effects in Line Intensity Mapping,"Mattéo Blamart,Adrian Liu",Cosmology and Nongalactic Astrophysics (astro-ph.CO),"Modern cosmological surveys cover extremely large volumes and map fluctuations on scales reaching gigaparsecs. As a result, it is no longer a valid assumption to ignore cosmological evolution along the line of sight from one end of the survey to the other. When extracting cosmological information, the power spectrum becomes suboptimal because it relies on the assumption of translational invariance of the observed field. For example, during the Epoch of Reionization (EoR), the 21cm brightness temperature field on the nearby (low-redshift) end of a large survey volume exhibits statistical properties that differ significantly from those at far (high-redshift) end. To overcome these limitations, we have developed a eigen decomposition-inspired non-Fourier basis that captures evolution effects. Our work demonstrates that using this new basis integrated in a new summary statistic yields tighter constraints on astrophysical parameters compared to the traditional power spectrum. Additionally, we provide an illustrative example and a practical guide for applying this basis in the context of a realistic forecast for interferometers such as the Hydrogen Epoch of Reionization Array (HERA).",https://arxiv.org/pdf/2505.09674
Scalar-Induced Gravitational Waves in Palatini $f(R)$ Gravity,"Samuel Sánchez López,José Jaime Terente Díaz",Cosmology and Nongalactic Astrophysics (astro-ph.CO); General Relativity and Quantum Cosmology (gr-qc); High Energy Physics - Phenomenology (hep-ph); High Energy Physics - Theory (hep-th),"Primordial scalar perturbations that reenter the horizon after inflation may induce a second-order Gravitational Wave spectrum with information about the primordial Universe on scales inaccessible to Cosmic Microwave Background experiments. In this work, we develop a general framework for the study of Scalar-Induced Gravitational Waves in Palatini $f(R)$ gravity, a theory that was proven to successfully realise inflation and quintessence, and consider the case of the Starobinsky-like model as an example. A regime of radiation domination with a subdominant matter component is assumed, allowing for a well-motivated perturbative approach to the gravity modifications. We calculate the kernel function and the density spectrum numerically and find accurate analytical expressions. The spectral density, which may be tested across a wide range of frequencies by upcoming Gravitational Wave experiments, is shown to differ from the General Relativity and metric $f(R)$ gravity predictions under certain conditions. We comment on previous results in the literature regarding the metric formulation and make special emphasis on the potential of these distinctive features of the spectrum to probe the two formalisms of gravity.",https://arxiv.org/pdf/2505.13420
Direct Detection of Dark Photon Dark Matter with the James Webb Space Telescope,"Haipeng An,Shuailiang Ge,Jia Liu,Zhiyao Lu",High Energy Physics - Phenomenology (hep-ph); Cosmology and Nongalactic Astrophysics (astro-ph.CO); High Energy Astrophysical Phenomena (astro-ph.HE); High Energy Physics - Experiment (hep-ex),"In this study, we propose an investigation into dark photon dark matter (DPDM) within the infrared frequency band, utilizing highly sensitive infrared light detectors commonly integrated into space telescopes, such as the James Webb Space Telescope (JWST). The presence of DPDM induces electron oscillations in both the reflectors and the interior of the detectors. Consequently, these oscillating electrons can emit monochromatic electromagnetic waves with a frequency almost equivalent to the mass of DPDM. By estimating the signal generated by DPDM inside the detector and comparing with observation data, we establish constraints on the kinetic mixing between the photon and dark photon within the range [10, 500] THz. Despite JWST not being optimized for DPDM searches, our findings reveal constraints comparable to those obtained from the XENON1T experiment in the laboratory, as well as astrophysical constraints from solar emission. Additionally, we propose to modify the configuration of JWST optical elements to focus the DPDM induced signal onto the detector. By employing the stationary phase approximation, we can demonstrate that when the size of the reflector significantly exceeds the wavelength of the electromagnetic wave, the contribution to the electromagnetic wave field at a given position primarily stems from the surface unit perpendicular to the relative position vector. This simplification results in the reduction of electromagnetic wave calculations to ray optics. We show that by rearranging the position of reflectors, JWST can achieve a sensitivity stronger than the existing limits by 1 or 2 orders of magnitude.",https://arxiv.org/pdf/2402.17140
Resonant or asymmetric: The status of sub-GeV dark matter,"Sowmiya Balan,Csaba Balázs,Torsten Bringmann,Christopher Cappiello,Riccardo Catena,Timon Emken,Tomás E. Gonzalo,Taylor R. Gray,Will Handley,Quan Huynh,Felix Kahlhoefer,Aaron C. Vincent",High Energy Physics - Phenomenology (hep-ph); Cosmology and Nongalactic Astrophysics (astro-ph.CO),"Sub-GeV dark matter (DM) particles produced via thermal freeze-out evade many of the strong constraints on heavier DM candidates but at the same time face a multitude of new constraints from laboratory experiments, astrophysical observations and cosmological data. In this work we combine all of these constraints in order to perform frequentist and Bayesian global analyses of fermionic and scalar sub-GeV DM coupled to a dark photon with kinetic mixing. For fermionic DM, we find viable parameter regions close to the dark photon resonance, which expand significantly when including a particle-antiparticle asymmetry. For scalar DM, the velocity-dependent annihilation cross section evades the strongest constraints even in the symmetric case. Using Bayesian model comparison, we show that both asymmetric fermionic DM and symmetric scalar DM are preferred over symmetric fermionic DM due to the reduced fine-tuning penalty. Finally, we explore the discovery prospects of near-future experiments both in the full parameter space and for specific benchmark points. We find that the most commonly used benchmark scenarios are already in tension with existing constraints and propose a new benchmark point that can be targeted with future searches.",https://arxiv.org/pdf/2405.17548
Cosmology of Quasi-Dilaton Massive Gravity with Non-minimal Kinetic Coupling,"Sobhan Kazempour,Amin Rezaei Akbarieh,Sichun Sun,Chengye Yu",General Relativity and Quantum Cosmology (gr-qc); Cosmology and Nongalactic Astrophysics (astro-ph.CO); High Energy Physics - Phenomenology (hep-ph),"In this study, we introduce an extension of the quasi-dilaton massive gravity theory and derive the field equations by varying the action with respect to the metric. This extension elucidates the dynamics of the system and demonstrates how it can encompass and recover previous cosmological models through different parameter values. We present the cosmological background equations to analyze self-accelerating solutions that can explain the late-time accelerated expansion of the Universe, driven by an effective cosmological constant arising from massive gravity. Besides, we apply the quasi-dilaton massive gravity theory with non-minimal kinetic coupling to a Type Ia Supernovae (SNIa) data set to test its viability. Our findings indicate that the theory is able to account for the observed acceleration of the expansion of the universe without invoking dark energy. In addition, we carry out a comprehensive perturbation analysis examining tensor, vector, and scalar perturbations independently. We derive the dispersion relation of gravitational waves in a Friedman-Lemaitre-Robertson-Walker (FLRW) cosmology and determine the stability conditions of the system. Such an analysis results in a sharper quasi-dilaton massive gravity theory with non-minimal kinetic coupling by ensuring the stability conditions of the system are maintained and that strong constraints on theory parameters are provided.",https://arxiv.org/pdf/2410.17915
Elementary considerations on possible entropy-driven cosmological evolutions,"Jamy-Jayme Thézier,Aurélien Barrau,Killian Martineau",General Relativity and Quantum Cosmology (gr-qc); Cosmology and Nongalactic Astrophysics (astro-ph.CO); High Energy Physics - Phenomenology (hep-ph),"For several independent reasons, the idea that notorious sources of entropy could exist in the Universe has been recently revived. Taking advantage of a new framework accounting for non-equilibrium processes in cosmology, we explicitly investigate the cosmological dynamics as a function of the entropy production, focusing on the stability of the system. An exhaustive investigation is performed. As the main physical conclusion, we show that for a wide class of entropy source terms, the fluid dynamics converges towards an effective cosmological constant. Constraints on the associated entropic force are also obtained.",https://arxiv.org/pdf/2501.15146
Primordial black holes as cosmic expansion accelerators,"Konstantinos Dialektopoulos,Theodoros Papanikolaou,Vasilios Zarikas",General Relativity and Quantum Cosmology (gr-qc); Cosmology and Nongalactic Astrophysics (astro-ph.CO); High Energy Physics - Phenomenology (hep-ph),"We propose a novel and natural mechanism for cosmic acceleration driven by primordial black holes (PBHs) exhibiting repulsive behavior. Using a new ``Swiss Cheese'' cosmological approach, we demonstrate that this cosmic acceleration mechanism is a general phenomenon by examining three regular black hole spacetimes - namely the Hayward, Bardeen and Dymnikova spacetimes - as well as the singular de Sitter-Schwarzschild spacetime. Interestingly, by matching these black hole spacetimes with an isotropic and homogeneous expanding Universe, we obtain a phase of cosmic acceleration that ends at an energy scale characteristic to the black hole parameters or due to black hole evaporation. This cosmic acceleration mechanism can be relevant either to an inflationary phase with a graceful exit and reheating or to an early dark energy type of contribution pertinent to the Hubble tension. Remarkably, we find that ultra-light PBHs with masses $m<5\times 10^8\mathrm{g}$ dominating the energy content of the Univese before Big Bang Nucleosynthesis, can drive a successful inflationary expansion era without the use of an inflaton field. Additionally, PBHs with masses $m \sim 10^{12}\mathrm{g}$ and abundances $0.107 < \Omega^\mathrm{eq}_\mathrm{PBH}< 0.5$, slightly before matter-radiation equality, can produce a substantial amount of early dark energy, helping to alleviate the $H_0$ tension.",https://arxiv.org/pdf/2502.18352
Consistency relations between multimessenger and large scale structure observations,Antonio Enea Romano,General Relativity and Quantum Cosmology (gr-qc); Cosmology and Nongalactic Astrophysics (astro-ph.CO),"The effective field theory (EFT) of dark energy provides a unified model independent theoretical framework to study the effects of dark energy and modified gravity. We show that applying the EFT to Horndeski theories it is possible to derive consistency relations (CR) between physically observable quantities, valid for different classes of theories defined by the brading parameter behavior, while leaving the other property functions free. As expected, the CRs are also valid for general relativity, and relate the effective gravitational constant, the slip parameter, the gravitational and electromagnetic luminosity distances and the speed of gravitational waves (GW). We apply the CRs to map the large scale structure observational constraints on the effective gravitational constant and the slip parameter to GW-EMW distance ratio constraints. The CRs allow to probe the value of the effective gravitational constant and the slip parameter with multimessenger observations, independently from large scale structure observations.",https://arxiv.org/pdf/2504.04574
Curvature corrections to Starobinsky inflation can explain the ACT results,"Andrea Addazi,Yermek Aldabergenov,Sergei V. Ketov",General Relativity and Quantum Cosmology (gr-qc); Cosmology and Nongalactic Astrophysics (astro-ph.CO); High Energy Physics - Theory (hep-th),"We investigate the impact of curvature corrections to Starobinsky inflation in light of the latest observational results from the Atacama Cosmology Telescope (ACT). While the pure Starobinsky model remains a compelling candidate for cosmic inflation, we explore how the higher-order curvature terms $R^3$, $R^{4}$ and $R^{3/2}$ modify the inflationary predictions. Using the scalar-tensor formulation of $f(R)$ gravity, we derive the effective scalar potentials and compute the resulting scalar tilt $n_s$, its running index $\alpha_s$ and the tensor-to-scalar ratio $r$. We show that those curvature corrections can shift the predictions to align better with the ACT data, thus providing a possible resolution to a minor discrepancy between the standard Starobinsky model and ACT observations. Our findings suggest that the modified Starobinsky models with the higher-order curvature terms offer a viable pathway to reconciling inflationary predictions with precision cosmological measurements. At the same time, measuring or constraining primordial tensor modes can help to discriminate between these corrections.",https://arxiv.org/pdf/2505.10305
