Heading,Title,Authors,Subjects,Abstract,PDF
Cross submissions,Addressing the $H_0$ tension through matter with pressure and no early dark energy,"Youri Carloni,Orlando Luongo,Marco Muccino",Cosmology and Nongalactic Astrophysics (astro-ph.CO); General Relativity and Quantum Cosmology (gr-qc),"We propose that the Hubble tension arises due to an unaccounted additional component, that behaves as \emph{matter with pressure}. We demonstrate that this fluid remains subdominant compared to both dust and radiation throughout nearly the entire universe expansion history. Specifically, the additional fluid satisfies the Zel'dovic limit with a constant equation of state, $\omega_s > 0$, and a quite small normalized energy density, $\Omega_s$. Accordingly, this component modifies both the sound horizon and the background expansion rate, \emph{acting quite differently from early dark energy models}, without significantly affecting the other cosmological parameters. To show this, we perform a Monte Carlo Markov chain analysis of our model, hereafter dubbed $\Lambda_{\omega_s}$CDM paradigm, using the publicly available \texttt{CLASS} Boltzmann code. Our results confirm the presence of this fluid, with properties that closely resemble those of radiation. We find best-fit values that satisfy $\omega_s \lesssim \omega_\gamma$ and a relative energy density $\Omega_s / \Omega_\gamma = 0.45$, with $\omega_r$ and $\Omega_r$ the equation of state and density of photons, respectively. The effective fluid may be associated with generalized K-essence models or, alternatively, with Proca-type vector fields, albeit we do not exclude \emph{a priori} more exotic possibilities, i.e., dark radiation, axions, and so on. Physical implications of our results are analyzed in detail, indicating a statistical preference for the $\Lambda_{\omega_s}$CDM scenario over the conventional $\Lambda$CDM background.",
Cross submissions,Numerical analysis of quasiperiodic oscillations in the Hartle-Thorne spacetime,"K. Boshkayev,T. Konysbayev,Ye. Kurmanov,M. Muccino,H. Quevedo",High Energy Astrophysical Phenomena (astro-ph.HE); General Relativity and Quantum Cosmology (gr-qc),"We numerically analyze quasiperiodic oscillations (QPOs) using a well-established spacetime model with neutron star sources. Within the framework of general relativity, we present expressions for the fundamental frequencies of test particles in the gravitational field of a slowly rotating and slightly deformed compact object defined by the Hartle-Thorne (HT) metric. Using the Relativistic Precession Model (RPM) formulated by Stella and Morinsk, we examine quasiperiodic oscillation data from eight neutron stars in low-mass X-ray binary systems. Employing Markov Chain Monte Carlo analyses with the Metropolis-Hastings algorithm, we estimate 1-$\sigma$ and 2-$\sigma$ error bars. Finally, we compare our results with predictions from the Schwarzschild, Lense-Thirring, and Kerr metrics, demonstrating that three of the eight sources can be well explained within the Hartle-Thorne model.",
Cross submissions,Reconstruction of dark energy and late-time cosmic expansion using the Weighted Function Regression method,"Alex González-Fuentes,Adrià Gómez-Valent",Cosmology and Nongalactic Astrophysics (astro-ph.CO); General Relativity and Quantum Cosmology (gr-qc),"Recent data from multiple supernova catalogs and DESI, when combined with CMB, suggest a non-trivial evolution of dark energy (DE) at the $2.5-4\sigma$ CL. This evidence is typically quantified using the CPL parametrization of the DE equation-of-state parameter which corresponds to a first-order Taylor expansion around $a = 1$. However, this truncation is to some extent arbitrary and may bias our interpretation of the data, potentially leading us to mistake spurious features of the best-fit CPL model for genuine physical properties of DE. In this work, we apply the Weighted Function Regression (WFR) method to eliminate the subjectivity associated with the choice of truncation order. We assign Bayesian weights to the various orders and compute weighted posterior distributions of the quantities of interest. Using this model-agnostic approach, we reconstruct some of the most relevant background quantities, examining the robustness of our results against variations in the CMB and SNIa likelihoods. Furthermore, we extend our analysis by allowing for negative DE. Our results corroborate previous indications of dynamical DE, now confirmed for the first time using the WFR method. The combined analysis of CMB, BAO, and SNIa data favors a DE component that transitions from phantom to quintessence at redshift $z_{\rm cross}\sim 0.4$. The probability of phantom crossing lies between 96.21% and 99.97%, depending on the SNIa data set used, and hence a simple monotonic evolution of the DE density is excluded at the $\sim 2-4\sigma$ CL. Moreover, we find no significant evidence for a negative dark energy density below $z\sim 2.5-3$. Our reconstructions do not address the Hubble tension, yielding values of $H_0$ consistent with the Planck/$\Lambda$CDM range. If SH0ES measurements are not affected by systematic biases, the evidence for dynamical dark energy may need to be reassessed.",
Cross submissions,"Soft Photon, Gluon and Graviton Theorems in (A)dS from Conformal Invariance","Jiajie Mei,Yuyu Mo",High Energy Physics - Theory (hep-th); General Relativity and Quantum Cosmology (gr-qc),"We present new soft theorems for photon, gluon, and graviton correlators at tree level in (Anti)-de Sitter space. The results are derived by applying conformal Ward identities to constrain the structure of Witten diagrams.",
Cross submissions,Superluminal Quantum Reference Frames,"Amrapali Sen,Matthias Salzger,Łukasz Rudnicki",Quantum Physics (quant-ph); General Relativity and Quantum Cosmology (gr-qc),"While particles cannot travel faster than the speed of light, nor can information, this assumption has over the years been frequently questioned. Most recently, it has been argued [New J. Phys. 22, 033038 (2020)] that in a world with superluminal observers local determinism is impossible, linking the two pillars of physics-quantum theory and relativity-suggesting that the latter serves as the foundation for the former. Motivated by this approach, in this work, we extend the framework of quantum reference frames to incorporate superluminal Lorentz transformations. We apply this conceptual result to examine an apparent paradox where particles acquire negative energies after undergoing a superluminal Lorentz boost and propose a resolution within our framework. We also discuss Bell experiments under superluminal quantum reference frame transformations, showing that involved probabilities remain conserved.",
Cross submissions,Ultra-Slow-Roll Inflation on the Lattice II: Nonperturbative Curvature Perturbation,"Angelo Caravano,Gabriele Franciolini,Sébastien Renaux-Petel",Cosmology and Nongalactic Astrophysics (astro-ph.CO); General Relativity and Quantum Cosmology (gr-qc); High Energy Physics - Theory (hep-th),"Building on the recent lattice simulations of ultra-slow-roll (USR) dynamics presented inarXiv:2410.23942, we investigate the role of the nonlinear relation between the inflaton field configuration and the curvature perturbation $\zeta$, the key observable after inflation. Using a nonperturbative $\delta N$ approach applied to the lattice output, we generate fully nonlinear three-dimensional maps of $\zeta$. This calculation captures both the non-Gaussianity arising from the nonlinear mapping between $\phi$ and $\zeta$, and the intrinsic non-Gaussianity generated around Hubble crossing by the nonlinear field dynamics, which is neglected in stochastic approaches. We find that the nonlinear mapping has a profound impact on the statistics, significantly enhancing the positive tail of the $\zeta$ probability distribution, with important implications for observable quantities. A central part of this work is the comparison with the standard perturbative treatment based on a gauge transformation, which allows us to quantify when and how the perturbative picture breaks down as fluctuations grow large. Together witharXiv:2410.23942, this work sets the basis for robust, nonperturbative predictions of primordial black hole production and scalar-induced gravitational wave emission from inflation using lattice simulations.",
Cross submissions,InflationEasy: A C++ Lattice Code for Inflation,Angelo Caravano,Cosmology and Nongalactic Astrophysics (astro-ph.CO); General Relativity and Quantum Cosmology (gr-qc); High Energy Physics - Lattice (hep-lat); High Energy Physics - Phenomenology (hep-ph),"InflationEasy is the first lattice code specifically developed for cosmological inflation. It simulates the nonlinear dynamics of a scalar field on a three-dimensional lattice in an expanding FLRW universe, using finite-difference spatial derivatives and a staggered leapfrog integrator for time evolution. Based in part on the well-known LATTICEEASY, it incorporates several improvements tailored to inflationary applications. Among other features, InflationEasy implements a nonperturbative $\delta N$ method to compute the curvature perturbation at the end of inflation $\zeta$ directly from the lattice, enabling fully nonlinear studies of scenarios with large fluctuations or nonperturbative non-Gaussianities. The code supports a broad range of inflationary models, including those relevant for primordial black hole formation, gravitational wave production, and large-scale structure. This makes InflationEasy a versatile and lightweight tool for studying inflationary dynamics beyond the reach of perturbation theory.",
Cross submissions,The Central Emission Vertex of two gravitons,"Damiano Barcaro,Vittorio Del Duca",High Energy Physics - Theory (hep-th); General Relativity and Quantum Cosmology (gr-qc),"It has recently been shown that there exists an $s$-channel sequence of classical corrections to the $H$ diagram computed long ago by Amati, Ciafaloni and Veneziano. At leading logarithmic accuracy, those corrections feature the gravity BFKL kernel as a crucial element, and may be computed through either rapidity renormalisation group equations or amplitudes built through $s$-channel unitarity cuts. In this paper, we evaluate six-graviton amplitudes in next-to-multi-Regge kinematics, and compute for the first time the Central Emission Vertex for the emission of two gravitons, which is relevant to evaluate the corrections to the gravity BFKL kernel, and thus to go beyond the leading logarithmic accuracy.",
Cross submissions,On the Gravitational Origin of the QCD Axion,"Georgios K. Karananas,Mikhail Shaposhnikov,Sebastian Zell",High Energy Physics - Theory (hep-th); General Relativity and Quantum Cosmology (gr-qc); High Energy Physics - Phenomenology (hep-ph),"Gravity can give rise to (pseudo)scalar fields, for instance due to torsion. In particular, axions of gravitational origin have been proposed as a minimal and compelling solution to the strong CP problem. In this work, we critically examine the feasibility of this approach. We demonstrate that models in which the scalar field couples to fermionic currents only through derivatives do not yield a satisfactory axion. Moreover, we identify the necessary conditions for generating a gravitational axion through quantum effects, highlighting Weyl-invariant Einstein-Cartan gravity as a promising theoretical setting.",
Cross submissions,The Volume-Renormalized Mass from a Hamiltonian Perspective,"Mattias Dahl,Klaus Kroencke,Stephen McCormick",Differential Geometry (math.DG); General Relativity and Quantum Cosmology (gr-qc),"We demonstrate that the volume-renormalized mass for asymptotically hyperbolic manifolds recently introduced by the authors can be deduced from a reduced Hamiltonian perspective. In order to do this, we first use Michel's formalism of mass invariants to extend the definition of the volume-renormalized mass to initial data sets.We consider spacetimes that are foliated by asymptotically Poincaré--Einstein Riemannian manifolds in the spirit of the Milne model of cosmology and reduce the ADM Hamiltonian to an unconstrained Hamiltonian system, analogous to the work of Fischer and Moncrief for spatially compact spacetimes. We find that the reduced Hamiltonian in this case recovers the volume-renormalized mass. We then analyze the first and second variation of the reduced Hamiltonian and demonstrate that it is non-increasing over the evolution and constant only for self-similar spacetimes.",
Cross submissions,Progress in Einstein-Cartan gravity,Mikhail Shaposhnikov,High Energy Physics - Theory (hep-th); General Relativity and Quantum Cosmology (gr-qc); High Energy Physics - Phenomenology (hep-ph),"It is well-known that the gravitational force can be obtained by gauging the Lorentz group, which puts gravity on the same footing as the Standard Model fields. The resulting theory - Einstein-Cartan gravity - has several crucial advantages. I will overview the construction of the Weyl-invariant version of this theory and discuss its applications in particle physics and cosmology, in particular for inflation and the strong CP problem.",
Cross submissions,On the prospects of thermalization of axion-SU(2) inflation,"Sukannya Bhattacharya,Matteo Fasiello,Alexandros Papageorgiou,Ema Dimastrogiovanni",Cosmology and Nongalactic Astrophysics (astro-ph.CO); General Relativity and Quantum Cosmology (gr-qc); High Energy Physics - Phenomenology (hep-ph); High Energy Physics - Theory (hep-th),"Axion inflation models coupled to a gauge sector via a Chern-Simons term exhibit an array of interesting phenomenology including a chiral gravitational wave spectrum and primordial black hole production. They may also provide a useful mechanism for generating lepton asymmetry. The possibility to embed this class of models in UV-finite theories and their intriguing, testable, signatures make for a compelling candidate for early acceleration. Due to the Chern-Simons coupling, gauge modes may undergo a finite tachyonic growth during which non-linearities become important. Naturally, this raises the question of whether such (self) interactions can lead to thermalization during inflation. We provide a set of conservative criteria for sustained thermalization in an axion-$SU(2)$ model and chart the parameter space of the model accordingly. We find that the cold inflation regime constitutes a very significant fraction of the parameter space. Our analysis accounts for a initially vanishing as well as non-zero gauge field vacuum expectation value (VEV). We also consider the possibility of a dynamically generated VEV.",
Cross submissions,Acoustically driven dark matter freeze-out,"Iason Baldes,Ryusuke Jinno",High Energy Physics - Phenomenology (hep-ph); Cosmology and Nongalactic Astrophysics (astro-ph.CO); General Relativity and Quantum Cosmology (gr-qc),"We extend the study of the effect of density perturbations to the well known thermal dark matter freeze-out scenario. We find $\sim 10 \, \%$ enhancements in the cross section are required to match onto the observed relic abundance for primordial curvature perturbations $\sim 0.2$ at length scales $\sim 1/$Hubble at freeze-out. Such corrections may be of importance in scenarios in which such perturbations are present and observational signals, such as the indirect detection rate, depend sensitively on the DM mass and freeze-out cross section, e.g. near resonances associated with DM bound states.",
Cross submissions,Special Functions and Geometries in Scattering Amplitudes: From Particle Physics to Gravity,Roger Morales,High Energy Physics - Theory (hep-th); General Relativity and Quantum Cosmology (gr-qc),"This thesis focuses on the fields of scattering amplitudes and Feynman integrals, with an emphasis on the geometries and special functions that they involve, and is devoted to two distinct research directions. In the first half of the thesis, we explore elliptic Feynman integrals in maximally supersymmetric Yang-Mills (N = 4 SYM) theory. In particular, we study elliptic generalizations of ladder diagrams, identifying the first two families of Feynman integrals involving the same elliptic curve to all loop orders, which provide a great testing ground for developing mathematical tools that can facilitate the calculation of elliptic integrals. In this direction, we initiate the symbol bootstrap for elliptic Feynman integrals, for which we generalize the so-called Schubert analysis to predict elliptic symbol letters. As a proof of principle, we obtain for the first time the symbol of the two-loop twelve-point elliptic double-box integral, resulting in a compact, one-line formula. In the second half of the thesis, we pioneer a systematic investigation of the Feynman integral geometries that are relevant to the study of gravitational waves emitted during the inspiral phase of black-hole mergers within the post-Minkowskian expansion of classical gravity. Specifically, we classify the geometries and special functions appearing in the expansion up to four loops. Among other findings, we identify the first Calabi-Yau three-dimensional geometry relevant to gravitational-wave physics. Subsequently, we study the Feynman integral giving rise to this Calabi-Yau geometry in more detail, and solve it by bringing its differential equation into canonical form - a step that required developing a new method that accommodates for apparent singularities.",
