Heading,Title,Authors,Subjects,Abstract,PDF
Cross submissions,Pseudodifferential Weyl calculus on vector bundles,"Lars Andersson,Benjamin Moser,Marius A. Oancea,Claudio F. Paganini,Gabriel Schmid",Mathematical Physics (math-ph); General Relativity and Quantum Cosmology (gr-qc); Analysis of PDEs (math.AP); Differential Geometry (math.DG),"We develop a geometric framework for Weyl quantization on pseudo-Riemannian manifolds, in which pseudodifferential operators act on sections of vector bundles equipped with arbitrary connections. We construct the associated star product and compute its semiclassical expansion up to third order in the expansion parameter. A central feature of our approach is a one-to-one correspondence between formally self-adjoint symbols and formally self-adjoint operators, extending known results from flat space to curved geometries. In addition, we analyze the Moyal equation satisfied by the Wigner function in this setting and provide explicit computations of Weyl symbols for several physically significant operators, including the Dirac, Maxwell, linearized Yang-Mills, and linearized Einstein operators. Our results lay the foundation for future developments in quantum field theory on curved spacetimes, semiclassical analysis, and chiral kinetic theory.",
Cross submissions,Torsion induced current-scalaron coupling in Einstein-Cartan gravity,"Minxi He,Muzi Hong,Kyohei Mukaida",High Energy Physics - Phenomenology (hep-ph); Cosmology and Nongalactic Astrophysics (astro-ph.CO); General Relativity and Quantum Cosmology (gr-qc),"We investigate the matter current couplings with the scalar degrees of freedom originated from the torsion in Einstein-Cartan (EC) gravity. It has been shown in previous studies that the presence of the operators consisting of torsion components up to dimension four can naturally induce a (pseudo-)scalar degree of freedom, the scalaron. In this work, we consider the couplings between torsion and matter currents in this framework, and show that they can lead to couplings between these currents and the scalaron in the equivalent metric theory. We consider both gauge-invariant and gauge-dependent currents, showing general results and several concrete examples. These results are useful for the discussion of particle production processes after inflation in the EC framework, such as reheating and baryogenesis, and show the connection to the QCD $\theta$ term.",
Cross submissions,Cosmic Cartography II: completing galaxy catalogs for gravitational-wave cosmology,"Konstantin Leyde,Tessa Baker,Wolfgang Enzi",Cosmology and Nongalactic Astrophysics (astro-ph.CO); Instrumentation and Methods for Astrophysics (astro-ph.IM); General Relativity and Quantum Cosmology (gr-qc),"The dark siren method exploits the complementarity between gravitational-wave binary coalescence signals and galaxy catalogs originating from the same regions of space. However, all galaxy catalogs are incomplete, i.e. they only include a subset of all galaxies, typically being biased towards the bright end of the luminosity distribution. This sub-selection systematically affects the dark siren inference of the Hubble constant $H_0$, so a completeness relation has to be introduced that accounts for the missing objects. In the literature it is standard to assume that the missing galaxies are uniformly distributed across the sky and that the galaxy magnitude distribution is known. In this work we develop a novel method which improves upon these assumptions and reconstructs the underlying true galaxy field, respecting the spatial correlation of galaxies on large scales. In our method the true magnitude distribution of galaxies is inferred alongside the spatial galaxy distribution. Our method results in an improved three-dimensional prior in redshift and sky position for the host galaxy of a GW event, which is expected to make the resulting $H_0$ posterior more robust. Building on our previous work, we make a number of improvements, and validate our method on simulated data based on the Millennium simulation.",
Cross submissions,Quantum estimation of cosmological parameters,"Michał Piotrak,Thomas Colas,Ana Alonso-Serrano,Alessio Serafini",Cosmology and Nongalactic Astrophysics (astro-ph.CO); General Relativity and Quantum Cosmology (gr-qc); Quantum Physics (quant-ph),"Understanding how well future cosmological experiments can reconstruct the mechanism that generated primordial inhomogeneities is key to assessing the extent to which cosmology can inform fundamental physics. In this work, we apply a quantum metrology tool - the quantum Fisher information - to the squeezed quantum state describing cosmological perturbations at the end of inflation. This quantifies the ultimate precision achievable in parameter estimation, assuming ideal access to early-universe information. By comparing the quantum Fisher information to its classical counterpart - derived from measurements of the curvature perturbation power spectrum alone (homodyne measurement) - we evaluate how close current observations come to this quantum limit. Focusing on the tensor-to-scalar ratio as a case study, we find that the gap between classical and quantum Fisher information grows exponentially with the number of e-folds a mode spends outside the horizon. This suggests the existence of a highly efficient (but presently inaccessible) optimal measurement. Conversely, we show that accessing the decaying mode of inflationary perturbations is a necessary (but not sufficient) condition for exponentially improving the inference of the tensor-to-scalar ratio.",
Cross submissions,Exterior Generalised Geometry,"Vicente Cortés,Oskar Schiller",Differential Geometry (math.DG); General Relativity and Quantum Cosmology (gr-qc),"It is the aim of this paper to transfer to generalised geometry tools employed in the study of semi-Riemannian immersions, specializing at times to semi-Riemannian hypersurfaces.Given an exact Courant algebroid $E \to M$ and an immersion $\iota\colon N \hookrightarrow M$, there is a well-known construction of an exact Courant algebroid $\iota^! E \to N$, the pullback of $E$. This paper explains the pullback of generalised metrics and divergence operators. Assuming $N$ is a hypersurface, it develops the notion of generalised exterior curvature, introducing the generalised second fundamental form and the generalised mean curvature. Generalised versions of the Gauß-Codazzi equations are obtained. As an application, the constraint equations for the initial value formulation of the generalised Einstein equations are established in the formalism of generalised geometry. Further applications include a generalised geometry version of the fundamental theorem for hypersurfaces and the result that generalised Kähler and hyper-Kähler structures restrict to submanifolds compatible with the generalised almost complex structure. In particular, we characterise exact semi-Riemannian Courant algebroids which are flat with respect to the canonical generalised connection. These play the role of the ambient space in the fundamental theorem mentioned above.",
Cross submissions,Bulk viscosity and $n$-component fluids,Saga Säppi,High Energy Physics - Phenomenology (hep-ph); General Relativity and Quantum Cosmology (gr-qc); High Energy Physics - Theory (hep-th); Nuclear Theory (nucl-th),"Understanding the hydrodynamics of out-of-equilibrium dense viscous fluids is of key importance to accurate descriptions of physical systems such as compact stars, particularly their mergers. We consider a near-equilibrium relativistic fluid with $n$ independent and small chemical potentials restoring the system back towards equilibrium. By diagonalising the evolution equation for the out-of-equilibrium chemical potentials, we construct an explicit evolution equation for the bulk scalar of the system in second-order hydrodynamics in terms of equilibrium quantities. We find expressions for the $2n$ transport quantities and show that in the rest frame of the fluid, the system admits a Green's function corresponding to an $n$-component fluid.",
Cross submissions,All-sky search for short gravitational-wave bursts in the first part of the fourth LIGO-Virgo-KAGRA observing run,"LIGO Scientific Collaboration,Virgo Collaboration,KAGRA Collaboration",High Energy Astrophysical Phenomena (astro-ph.HE); General Relativity and Quantum Cosmology (gr-qc),"We present a search for short-duration gravitational-wave transients in data from the first eight months of Advanced LIGO-Virgo-KAGRA's fourth observing run, denoted O4a. We use four analyses which are sensitive to a wide range of potential signals lasting up to a few seconds in the 16-4096 Hz band. Excluding binary black hole merger candidates that were already identified by low-latency analyses, we find no statistically significant evidence for other gravitational-wave transients. We measure the sensitivity of the search for representative signals, including sine-Gaussians, Gaussian pulses, and white-noise bursts with different frequencies and durations, adopting a false alarm rate of 1 per 100 years as detection threshold. Depending on signal type, we find improvements over previous searches by factors of 2 to 10 in terms of sensitivity to strain amplitude and of 90% confidence upper limit on the rate density of sources. We also evaluate a variety of core-collapse supernova models and find that, for some models, the search could have detected gravitational waves from stellar core-collapse throughout the Milky Way. Finally, we consider neutron star f-modes associated with pulsar glitches and find that, assuming a source similar to the Vela Pulsar, the search could have detected a gravitational-wave signal from a glitch with fractional frequency change as small as $\sim 2$ to $6 \times 10^{-5}$ depending on the neutron star mass.",
Cross submissions,The BAO-CMB Tension and Implications for Inflation,"Elisa G. M. Ferreira,Evan McDonough,Lennart Balkenhol,Renata Kallosh,Lloyd Knox,Andrei Linde",Cosmology and Nongalactic Astrophysics (astro-ph.CO); General Relativity and Quantum Cosmology (gr-qc); High Energy Physics - Phenomenology (hep-ph); High Energy Physics - Theory (hep-th),"The scalar spectral index $n_s$ is a powerful test of inflationary models. The tightest constraint on $n_s$ to date derives from the combination of cosmic microwave background (CMB) data with baryon acoustic oscillation (BAO) data. The resulting $n_s$ constraint is shifted significantly upward relative to the constraint from CMB alone, with the consequence that previously preferred inflationary models are seemingly disfavored by $\gtrsim 2 \sigma$. Here we show that this shift in $n_s$ is the combined effect of a degeneracy between $n_s$ and BAO parameters exhibited by CMB data and the tension between CMB datasets and DESI BAO data under the assumption of the standard cosmological model. Given the crucial role of $n_s$ in discriminating between inflationary models, we urge caution in interpreting CMB+BAO constraints on $n_s$ until the BAO-CMB tension is resolved.",
