Heading,Title,Authors,Subjects,Abstract,PDF
New submissions,"Cosmological Analysis of $f(R,Σ, T)$ Gravity via $O_m(z)$ Reconstruction: Implications into Dark Energy Dynamics","S. H. Shekh,Anil Kumar Yadav,Anirudh Pradhan,N. Myrzakulov",General Relativity and Quantum Cosmology (gr-qc),"This study investigates the cosmological implications of $f(R,\Sigma,T)$ gravity by reconstructing the Hubble parameter from a logarithmic parameterization of the $O_m(z)$ diagnostic. Our approach offers a model-independent way to probe the nature of dark energy and differentiate it from a cosmological constant. We derive the field equations for $f(R,\Sigma,T) = R + \Sigma + 2\pi\eta T$ within the homogeneous, isotropic, and spatially flat Friedmann-Robertson-Walker (FRW) metric. A comprehensive analysis of key physical parameters, including the equation of state (EoS) parameter $\omega(z)$, the $(\omega-\omega')$-plane, the squared sound speed $\vartheta^2$, and various energy conditions (Null, Dominant, Strong), is presented. Our findings reveal a dynamic EoS parameter that consistently remains within the quintessence regime ($-1 < \omega < -1/3$), approaching $\omega = -1$ in the far future, thereby avoiding phantom behavior and maintaining the weak energy condition. The model successfully reproduces the cosmic transition from deceleration to acceleration, as indicated by the deceleration parameter $q(z)$ crossing zero. While the model aligns well with observational data for cosmic expansion, the analysis of $\vartheta^2$ indicates classical instability, a point requiring further theoretical refinement. Overall, this work demonstrates the viability of $f(R,\Sigma,T)$ gravity as a framework capable of describing the universe's accelerated expansion, consistent with current cosmological observations, while offering a dynamic alternative to the $\Lambda$CDM model.",
New submissions,Lorentz violation signatures in the low-energy sector of Hořava gravity from black hole shadow observations,"Wentao Liu,Hongxia Huang,Di Wu,Jieci Wang",General Relativity and Quantum Cosmology (gr-qc); High Energy Physics - Theory (hep-th),"In this paper, we use the Hořava gravity model and EHT observations of supermassive black holes (BHs) to investigate signatures of Lorentz violation in real astrophysical environments. The Lorentz violation in the rotating Hořava BH spacetime are confined to the strong gravitational field region, being induced by the BH's rotation. Due to the non-separability of the photon motion equations in this spacetime, we employed a numerical backward ray-tracing method to generate shadow images for various BH parameters. Subsequently, we extracted coordinate positions characterizing the shadow shape from high-pixel images to evaluate the parameter space of the BH. When evaluating M87*, Lorentz violation can occur with arbitrary strength. However, for Sgr A*, we can impose certain parameter constraints on Lorentz violation. These constraints depend on the BH's spin. If future observations confirm Sgr A*'s spin parameter less than 0.81 at maximum inclination, current EHT results would challenge general relativity and support Lorentz violation in low-energy regimes.",
New submissions,Microphysical Origins of Gravitational Potentials in Astrophysical Systems,Meir Shimon,General Relativity and Quantum Cosmology (gr-qc); Cosmology and Nongalactic Astrophysics (astro-ph.CO),"Most astrophysical systems (except for very compact objects such as, e.g., black holes and neutron stars) in our universe are characterized by shallow gravitational potentials, with dimensionless compactness parameter. While the existence and characteristic scales of such virialized systems depend on gravity, we demonstrate that the value of the compactness -- and thus the non-relativistic nature of most astrophysical objects -- arises from microphysical parameters, specifically the fine structure constant and the electron-to-proton mass ratio, and is fundamentally independent of the gravitational constant G. It then follows that large-scale astrophysical velocities and escape velocities associated with virialized systems are determined by electromagnetic and atomic physics, not by gravitation, and that the compactness is always set by microphysical scales -- even for the most compact objects, such as neutron stars, where the compactness is determined by quantities like the pion-to-proton mass ratio. This observation, largely overlooked in the literature, explains why the universe is not dominated by relativistic, compact objects and connects the low entropy of the observable universe to underlying microphysics. Our results emphasize the central but underappreciated role played by dimensionless microphysical constants in shaping the macroscopic gravitational landscape of the universe. In particular, we clarify that this independence of compactness from G applies specifically to entire, virialized, naturally formed astrophysical systems -- such as stars, galaxies, and planets -- that have reached equilibrium through self-gravity and microphysical processes. In contrast, arbitrary non-virialized subsystems (e.g., a piece cut from a planet) do not exhibit this property.",
New submissions,Regular Power-Maxwell Black Holes,"Yi-bo Liang,Hong-Rong Li",General Relativity and Quantum Cosmology (gr-qc),"We present a new class of regular, spherically symmetric spacetimes in nonlinear electrodynamics that are asymptotically dynamical but not de Sitter, exhibiting power-law Maxwell behavior at infinity. Starting from magnetic solutions, we demonstrate that the weak energy condition is satisfied, while the dominant energy condition is also fulfilled. These configurations are extended to include regular black holes, with their existence conditions and global structures analyzed via novel Penrose diagrams. Through FP duality, we obtain corresponding electric solutions and establish uniqueness criteria. However, in square-root--Maxwell theory, electric duals are absent; we address this by introducing an auxiliary scalar field formulation that restores duality and yields a generalized transformation. We further investigate the effective metric governing light propagation, finding that it remains regular for some magnetic cases (in the absence of black holes) but becomes singular for electric ones. Furthermore, we identify spacelike photon trajectories in these spacetimes, signaling the existence of causality issues. Finally, we derive the first law and Smarr formula, showing the existence of thermodynamically stable black holes with positive heat capacity.",
Cross submissions,Gravitational Waves from Spectator Scalar Fields,"Marcos A. G. Garcia,Sarunas Verner",High Energy Physics - Phenomenology (hep-ph); Cosmology and Nongalactic Astrophysics (astro-ph.CO); General Relativity and Quantum Cosmology (gr-qc),"We propose a novel mechanism for gravitational wave (GW) production sourced by spectator scalar fields during inflation. These fields, while not driving cosmic expansion, generate blue-tilted isocurvature fluctuations that naturally satisfy current CMB constraints at large scales while producing enhanced power spectra at smaller scales accessible to GW detectors. The resulting GW spectrum spans an exceptionally broad frequency range from $10^{-20}$ to $1$ Hz, with amplitudes ranging from $\Omega_{\text{GW}}h^2 \sim 10^{-20}$ to $10^{-12}$ depending on the reheating temperature and spectator field mass. For heavy spectator fields with effective masses near the inflationary Hubble scale $H_I$, the mechanism produces observable signals across multiple detector bands accessible to pulsar timing arrays, space-based interferometers, and ground-based detectors. Our analysis reveals multiple complementary constraints on spectator field parameters. GW-induced limits on the effective number of relativistic species ($\Delta N_{\text{eff}}$) require $m_\chi \gtrsim 0.61 H_I$, stronger than CMB isocurvature bounds alone ($m_\chi \gtrsim 0.54 H_I$). The non-observation of primordial B-modes by \textit{Planck} provides stronger constraints $m_\chi \gtrsim 0.66 H_I$, with projected LiteBIRD sensitivity potentially reaching $m_\chi \gtrsim 0.70 H_I$. This mechanism enables a unique multi-messenger probe of beyond the Standard Model physics during inflation, providing simultaneous constraints on inflationary dynamics, dark matter production, and reheating through current and next-generation GW experiments.",
Cross submissions,"Algebras, Entanglement Islands, and Observers","Hao Geng,Yikun Jiang,Jiuci Xu",High Energy Physics - Theory (hep-th); General Relativity and Quantum Cosmology (gr-qc),"Some recent work has postulated the existence of an ""observer"" for a consistent definition of subregion algebras in gravitational universes. The subregion algebras consist of operators dressed to this ""observer"" and are typically Type II von Neumann algebras. Nevertheless, as opposed to standard physical systems, such an ""observer"" was postulated to have a Hamiltonian $\hat{H}_{\text{obs}}$ linear in phase space variable. This linear form suggests that the complete dynamics of such an ""observer"" should also be controlled by an external system or some underlying degrees of freedom within the system. In this paper, we show that this is exactly the case in the island model. In the island model, we have a gravitational asymptotically anti-de Sitter (AdS) spacetime coupled with a non-gravitational bath, and the diffeomorphism symmetries in the gravitational AdS are spontaneously broken due to the bath coupling. In this setup, the ""observer"" is constructed using the Goldstone vector field associated with the spontaneously broken diffeomorphism symmetry, and the external system that also controls the dynamics of the ""observer"" is the non-gravitational bath. The basic consistency of the entanglement wedge reconstruction requires operators in the entanglement island to be dressed to this ""observer"". Thus, we establish the result that entanglement islands correspond to emergent Type II$_{\infty}$ von Neumann algebras from the holographic dual perspective. This result relies on assuming the geometric modular flow conjecture. Our study also raises a question for earlier constructions of Type II$_{1}$ von Neumann algebras.",
Cross submissions,Constraining the Mass of a Hypothetical Secondary Black Hole in M87 with the NANOGrav 15-Year Data Set,"Motoki Kino,Masahiro Nagashima,Hyunwook Ro,Yuzhu Cui,Kazuhiro Hada,Jongho Park",High Energy Astrophysical Phenomena (astro-ph.HE); Astrophysics of Galaxies (astro-ph.GA); General Relativity and Quantum Cosmology (gr-qc),"Galaxy mergers, each hosting a supermassive black hole (SMBH), are thought to form SMBH binaries. Motivated by recent observations from the East Asian VLBI Network (EAVN) showing periodic behavior in the M87 jet, a precession of about 11 years and a transverse oscillation of about 0.9 years, we constrain the mass of a hypothetical secondary black hole orbiting the primary SMBH in M87. To constrain the mass ratio between the primary SMBH ($M_{1}$) and the secondary black hole ($M_{2}$) defined as $q \equiv M_{2}/M_{1} \leq 1$, and the length of the semimajor axis of the binary system ($a$), we impose the following three constraints: (i) the lower limit of $a$, below which the SMBH binary is expected to merge. (ii) the strain amplitude of the gravitational wave background (GWB) at nanohertz frequencies shown in the NANOGrav 15-year dataset. (iii) a finite length of the semimajor axis of $M_{1}$, that can induce periodic behavior in the jet. By combining these constraints, we obtain the allowed parameter space for $q$ and $a$. If either of the EAVN-detected periods ($T$) corresponds to the binary's orbital period, the allowed range of $q$ is $6.9 \times 10^{-3} \le q \le 4.2 \times 10^{-2}$ for $T \approx 11$ years, and $3.7\times 10^{-2} \le q \le 1$ for $T \approx 0.9$ years. VLBI astrometric monitoring of the jet base of M87 is essential to explore the allowed parameter space for $q$ and $a$.",
Cross submissions,Inflationary attractors and radiative corrections in light of ACT,William J. Wolf,Cosmology and Nongalactic Astrophysics (astro-ph.CO); General Relativity and Quantum Cosmology (gr-qc); High Energy Physics - Phenomenology (hep-ph); High Energy Physics - Theory (hep-th),"In light of the recent results from the Atacama Cosmology Telescope (ACT), which have provided a notable shift in the constraints on $(n_s, r)$ and placed several otherwise viable models of inflation in tension with the latest data, we investigate the possible effects that radiative corrections can have on $\xi$-attractor and $\alpha$-attractor models of inflation. These models, which share much in common with Starobinsky-Higgs inflation, have likewise been put under pressure by these results. We find that percent (and even sub-percent) level radiative corrections can easily shift both of these classes of inflation models comfortably into the regions of parameter space favoured by the most recent constraints. However, the flexibility under such corrections (which one can argue should be generally expected) calls into question to what extent it is possible to precisely pin down model-specific predictions for important cosmological observables.",
Cross submissions,Can Non-Relativistic Strings Propagate Without Geometric Baggage?,"Partha Nandi,Sk. Moinuddin,Abdus Sattar",High Energy Physics - Theory (hep-th); General Relativity and Quantum Cosmology (gr-qc),"We present a minimal and dynamically consistent formulation of non-relativistic bosonic string theory in a Newton-Cartan (NC) background. Starting from a reparametrization-invariant Nambu-Goto action, we develop the Hamiltonian framework and perform a complete Dirac constraint analysis. The resulting structure exhibits first-class constraints that generate worldsheet diffeomorphisms, confirming the internal gauge consistency of the model. Using an interpolating Lagrangian, we derive a Polyakov-type action that enables a direct comparison with symmetry-based constructions known as gauging the algebra (GTA) approaches, which promote non-relativistic symmetry algebras to local symmetries. In contrast to GTA formulations, which require additional background fields to achieve algebraic closure, our model derives all necessary geometric data dynamically from the string evolution itself. This establishes that standard Newton-Cartan geometry is sufficient to support consistent non-relativistic string dynamics. Our results provide a conceptually transparent and technically robust foundation for future studies of non-relativistic string theory in curved backgrounds.",
Cross submissions,Multi-parameter isospectral Fokker-Planck equations,Choon-Lin Ho,Mathematical Physics (math-ph); Statistical Mechanics (cond-mat.stat-mech); General Relativity and Quantum Cosmology (gr-qc); Quantum Physics (quant-ph),"From a given Fokker-Planck equation, a multi-parameter deformed partner Fokker-Planck equation is constructed. This is done by first deleting a set of eigenstates of the original FPE by the multi-step Darboux-Crum transformation, and then reinstating the eigen-energy levels by the reverse Darboux-Crum transformation. Extension to fractional Fokker-Planck equation is briefly discussed. A recent study of the one-parameter isospectral FPE applied to black hole in the thermal potential approach is commented.",
Cross submissions,Emergent quantum field theories on curved spacetimes in spinor Bose-Einstein condensates: from scalar to Proca fields,"Simon Brunner,Christian F. Schmidt,Stefan Floerchinger",Quantum Gases (cond-mat.quant-gas); General Relativity and Quantum Cosmology (gr-qc); High Energy Physics - Theory (hep-th),"We consider excitations of a spin-1 Bose-Einstein-condensate (BEC) in the vicinity of different mean-field configurations and derive mappings to emergent relativistic scalar field theories minimally coupled to curved acoustic spacetimes. The quantum fields are typically identified with Nambu-Goldstone bosons, such that the structure of the analogue quantum field theories on curved spacetimes depends on the (spontaneous) symmetry breaking pattern of the respective ground-state. The emergent spacetime geometries are independent of each other and exhibit bi-metricity in the polar and antiferromagnetic phase, whereas one has tri-metricity in the ferromagnetic phase. Compared to scalar BECs, the spinor degrees of freedom allow to investigate massive vector and scalar fields where the former is a spin-nematic rotation mode in the polar phase which can be cast into a Proca field that is minimally coupled to a curved spacetime that emerges on length scales larger than the spin-healing length. Finally, we specify the Zeeman couplings and the condensate trap to be spacetime-dependent such that a cosmological FLRW-metric can be achieved. This work enables a pathway towards quantum-simulating cosmological particle production of Proca quanta via quenching the quadratic Zeeman-coefficient or via magnetic field ramps, which both result in the creation of spin-nematic squeezed states.",
Cross submissions,Revisiting $Λ$CDM extensions in light of re-analyzed CMB data,"Jacobo Asorey,Javier de Cruz Pérez",Cosmology and Nongalactic Astrophysics (astro-ph.CO); General Relativity and Quantum Cosmology (gr-qc),"In the last years with the increasing precision in cosmological observations we have been able to establish an standard model of cosmology, the so-called $\Lambda$CDM, but also find some tensions between cosmological probes that are difficult to explain within the context of this model. We tested several phenomenological extensions of the $\Lambda$CDM with the newest datasets from the chain CMB+BAO+SNIa, to see whether they are able to alleviate the aforementioned tensions. We find that when the updated version of the Planck CMB likelihood (PR4 LoLLiPoP and HiLLiPoP), with respect to the more used likelihoods (PR4 CamSpec and PR3), is considered, the lensing anomaly is reduced, and the preference for $A_L>1$ and $\Omega_k<0$ is less significant. From the CMB+BAO+SNIa dataset, in the context of the parameterization $w_0w_a$CDM we find a preference for a time-evoling dark energy over the rigid cosmological constant which is consistent with the most recent results from DESI collaboration.",
