Heading,Title,Authors,Subjects,Abstract,PDF
Cross submissions,"From Fluctuation to Polarization: Imprints of $O(1-10)\, \mathrm{Mpc}^{-1}$ Curvature Perturbations in CMB B-modes from Scalar-Induced Gravitational Waves","Aurora Ireland,Kuver Sinha,Tao Xu",High Energy Physics - Phenomenology (hep-ph); Cosmology and Nongalactic Astrophysics (astro-ph.CO); General Relativity and Quantum Cosmology (gr-qc),"Probing primordial curvature perturbations on small scales, beyond those accessible using cosmic microwave background (CMB) primary anisotropies and Lyman-$\alpha$ forest data, remains a major open challenge. Current constraints on the scalar power spectrum at these scales are either weak or rely heavily on model-dependent assumptions about small-scale structure. In this work, we propose a novel method to probe the small-scale primordial power spectrum using scalar-induced tensor perturbations, which are inevitably sourced by curvature perturbations at second order in cosmological perturbation theory. While induced tensor modes have traditionally been studied in the context of the stochastic gravitational wave background, we highlight a complementary observable: the distinctive pattern of B-mode polarization they imprint on the CMB. We compute the angular spectrum of these B-modes arising from enhanced scalar perturbations and show that the resulting signal can be competitive with inflationary predictions for values of the tensor-to-scalar ratio targeted in upcoming CMB experiments, most notably CMB-Stage 4. We map the region of the scalar power spectrum to which these future B-mode experiments will be sensitive and compare with existing constraints, finding it to exceed current sensitivities at $k \sim O(1-10)\, \mathrm{Mpc}^{-1}$. In addition to providing a new CMB-based probe of the small-scale power spectrum, this work also motivates dedicated B-mode searches at higher multipoles ($\ell \gtrsim 100$).",
Cross submissions,ACT-Inspired Kaehler-Based Inflationary Attractors,C. Pallis,High Energy Physics - Phenomenology (hep-ph); Cosmology and Nongalactic Astrophysics (astro-ph.CO); High Energy Physics - Theory (hep-th),"We develop a new class of cosmological attractors which are compatible with the recent ACT results. They are based on two types of fractional Kaehler potentials, K, for a gauge-singlet inflaton phi which reduce, along the inflationary path, to the form N/(1-phi^qM)^p with qM=1, 2 and 0.1< p<10. The combination of these K's with the chaotic potentials phi^n (where n=2, 4) within a non-linear sigma model leads to inflationary observables which are consistent with the current data and largely independent from qM and n. Endowing these K's with a shift symmetry we also offer a supergravity realization of our models introducing two chiral superfields and a monomial superpotential, linear with respect to the inflaton-accompanying field. The attainment of inflation with subplanckian inflaton values and the large values for the tensor-to-scalar ratio, which increases with N, are two additional attractive features of our proposal.",
Cross submissions,Inflation Model Based on Virasoro Squeezing,"Kenji Ebata,So Katagiri,Yoshiki Matsuoka,Takaaki Sehara,Akio Sugamoto",High Energy Physics - Theory (hep-th); Cosmology and Nongalactic Astrophysics (astro-ph.CO),"We propose a novel mechanism for realizing slow-roll inflation that is fully consistent with observational data, based on conformal transformations acting exclusively on a complex scalar field -- without coupling to the gravitational sector. These transformations generically produce a plateau in the inflaton potential, as guaranteed by the maximum modulus theorem, thereby naturally satisfying the slow-roll conditions.Our framework utilizes squeezing operations generated by the Virasoro algebra without central extension, as developed in our earlier work. The resulting inflationary potentials depend on the Virasoro mode $n$, the power $m$ of the original potential, and the squeezing parameter $\theta$.We present approximate analytical expressions at leading order for the special case $n=-2$, and perform numerical analyses for both $n=-2$ and other values of $n$. These reveal parameter regimes in which the predicted cosmological observables $(n_{s},r)$ align remarkably well with current CMB measurements.",
Cross submissions,Primordial regular black holes as all the dark matter. III. Covariant canonical quantum gravity models,"Marco Calzà,Davide Pedrotti,Guan-Wen Yuan,Sunny Vagnozzi",General Relativity and Quantum Cosmology (gr-qc); Cosmology and Nongalactic Astrophysics (astro-ph.CO); High Energy Physics - Phenomenology (hep-ph); High Energy Physics - Theory (hep-th),"In earlier companion papers, we showed that non-singular primordial black holes (PBHs) could account for all the dark matter (DM) over a significantly wider mass range compared to Schwarzschild PBHs. Those studies, mostly based on phenomenological metrics, are now extended by considering the quantum-corrected space-time recently proposed by Zhang, Lewandowski, Ma and Yang (ZLMY), derived from an effective canonical (loop) quantum gravity approach explicitly enforcing general covariance. Unlike the BHs considered earlier, ZLMY BHs are free from Cauchy horizons, and are hotter than their Schwarzschild counterparts. We show that this higher temperature boosts the evaporation spectra of ZLMY PBHs, tightening limits on their abundance relative to Schwarzschild PBHs and shrinking the asteroid mass window where they can constitute all the DM, a result which reverses the earlier trend, but rests on firmer theoretical ground. While stressing the potential key role of quantum gravity effects in addressing the singularity and DM problems, our study shows that working within a consistent theoretical framework can strongly affect observational predictions.",
Cross submissions,COSINUS -- a model-independent challenge of the DAMA/LIBRA dark matter claim with cryogenic NaI detectors operated in a new low-background facility,"G. Angloher,M. R. Bharadwaj,A. Böhmer,M. Cababie,I. Colantoni,I. Dafinei,N. Di Marco,C. Dittmar,L. Einfalt,F. Ferella,F. Ferroni,S. Fichtinger,A. Filipponi,M. Friedl,L. Gai,M. Gapp,M. Heikinheimo,K. Heim,M. N. Hughes,K. Huitu,M. Kellermann,R. Maji,M. Mancuso,L. Pagnanini,F. Petricca,S. Pirro,F. Pröbst,G. Profeta,A. Puiu,F. Reindl,K. Schäffner,J. Schieck,P. Schreiner,C. Schwertner,K. Shera,M. Stahlberg,A. Stendahl,M. Stukel,C. Tresca,S. Yue,V. Zema,Y. Zhu,N. Zimmermann(The COSINUS Collaboration)",Instrumentation and Detectors (physics.ins-det); Cosmology and Nongalactic Astrophysics (astro-ph.CO); High Energy Physics - Experiment (hep-ex),"Low-temperature detectors are a powerful technology for dark matter search, offering excellent energy resolution and low energy thresholds. COSINUS is the only experiment that combines scintillating sodium iodide (NaI) crystals with an additional phonon readout at cryogenic temperatures, using superconducting sensors (remoTES), alongside the conventional scintillation light signal. Via the simultaneous phonon and scintillation light detection, a unique event-by-event particle identification is enabled. This dual-channel approach allows for a model-independent cross-check of the long-standing DAMA/LIBRA signal with a moderate exposure of a few hundred kg d, while completely avoiding key systematic uncertainties inherent to scintillation-only NaI-based searches. COSINUS built and commissioned a dedicated low-background cryogenic facility at the LNGS underground laboratories. Data taking with eight NaI detector modules (COSINUS1$\pi$ Run1) is planned to begin in late 2025.",
Cross submissions,Primordial black hole formation in k-inflation models,"Neven Bilić,Dragoljub D. Dimitrijević,Goran S. Djordjević,Milan Milošević,Marko Stojanović",General Relativity and Quantum Cosmology (gr-qc); Cosmology and Nongalactic Astrophysics (astro-ph.CO),"The local primordial density fluctuations caused by quantum vacuum fluctuations during inflation grow into stars and galaxies in the late universe and, if they are large enough, also produce primordial black holes. We study the formation of the primordial black holes in $k$-essence inflation models with a potential characterized by an inflection point. The background and perturbation equations are integrated numerically for two specific models. Using the critical collapse and peaks formalism, we calculate the abundance of primordial black holes today.",
Cross submissions,Dipolar dark matter theory based on a non-Abelian Yang-Mills field,"Luc Blanchet,Emeric Seraille",General Relativity and Quantum Cosmology (gr-qc); Cosmology and Nongalactic Astrophysics (astro-ph.CO); High Energy Physics - Theory (hep-th),"Most theories that attempt to reproduce the Modified Newtonian Dynamics (MOND) phenomenology for dark matter at galactic scales rely on ad hoc free functions, preventing them from being regarded as fundamental. In this work, we present a new theory that reproduces MOND, built on a supposed to be fundamental Yang-Mills gauge field based on SU(2), with a gravitational coupling constant, and emerging in a low-acceleration regime, below the MOND acceleration scale. The gauge field plays the role of the internal force in the dipolar dark matter (DDM) model. We discuss how certain solutions of this theory recover the deep MOND regime without introducing arbitrary functions in the action. Within this framework, the MOND phenomenology appears to be due to the existence of a new sector of particle physics.",
Cross submissions,Gravitational Waves from Gauge Quanta Produced during Inflation,"Kai-Ge Zhang,Jian-Feng He,Chengjie Fu,Zong-Kuan Guo",High Energy Physics - Phenomenology (hep-ph); Cosmology and Nongalactic Astrophysics (astro-ph.CO); General Relativity and Quantum Cosmology (gr-qc),"A fast-rolling axion can transfer its kinetic energy to a gauge field via the Chern-Simons coupling, leading to copious production of gauge quanta, which can act as a source of gravitational waves (GWs) with potentially observable amplitudes. In this work, we investigate GW production in a spectator axion model when strong backreaction is taken into account. We find that decreasing the decay constant of the axion enhances GW production. Since the initial value of the axion is larger than its quantum fluctuations, such a condition imposes a lower bound on the axion dacay constant, which sets an upper bound on the amplitude of the energy spectrum of GWs. As a result, the amplitude of the predicted GW energy spectrum is lower than $10^{-10}$ in the nHz to mHz frequency range.",
Cross submissions,Classification of $f(R)$ Theories Of Inflation And The Uniqueness of Starobinsky Model,Marco Piva,High Energy Physics - Theory (hep-th); Cosmology and Nongalactic Astrophysics (astro-ph.CO); General Relativity and Quantum Cosmology (gr-qc),"We classify $f(R)$ theories using a mathematical analogy between slow-roll inflation and the renormalization-group flow. We derive the power spectra and spectral indices class by class and compare them with the latest data. The framework used for the classification allows us to determine the general structure of the $f(R)$ functions that belong to each class. Our main result is that only two classes survive. Moreover, we show that the Starobinsky model is the only polynomial $f(R)$ that can realize slow-roll inflation. In fact, all other polynomials belong to a special class that can only realize constant-roll inflation, at least far enough in the past. We point out some of the issues involved in considering a smooth transition between constant-roll and slow-roll inflation in this class of models. Finally, we derive the map that transforms the results from the Jordan frame to the Einstein frame.",
Cross submissions,Cosmological constraints from UV/IR mixing,"Niccolò Cribiori,Flavio Tonioni",High Energy Physics - Theory (hep-th); Cosmology and Nongalactic Astrophysics (astro-ph.CO); High Energy Physics - Phenomenology (hep-ph),"Holography and entropy bounds suggest that the ultraviolet (UV) and infrared (IR) cutoffs of gravitational effective theories are related to one another as a form of UV/IR mixing. Motivated by this, we derive a bound on the allowed scalar field range in theories with cosmic horizons. We show how this bound challenges several inflationary scenarios, such as $\alpha$-attractors and modular-invariant inflation. Besides, we find a relation between the number of extra spatial dimensions and the tensor-to-scalar ratio.",
