Heading,Title,Authors,Subjects,Abstract,PDF
New submissions,Gravitational waves from axion inflation in the gradient expansion formalism II: Fermionic axion inflation,"Richard von Eckardstein,Kai Schmitz,Oleksandr Sobol",Cosmology and Nongalactic Astrophysics (astro-ph.CO); General Relativity and Quantum Cosmology (gr-qc); High Energy Physics - Phenomenology (hep-ph),"Axion inflation represents an intriguing source of gravitational waves (GWs) from the early Universe. In a companion paperarXiv:2508.00798, we previously leveraged the gradient expansion formalism (GEF) to investigate pure axion inflation (PAI), i.e., axion inflaton coupled to a pure gauge sector. In this paper, we extend our analysis to fermionic axion inflation (FAI), i.e., we allow for the presence of fermions in the gauge sector. PAI predicts a strongly blue-tilted GW spectrum; in our GEF benchmark study, all parameter regions leading to observable GWs turned out to violate the upper limit on the number of extra relativistic degrees of freedom, $\Delta N_{\rm eff}$. As we demonstrate in this paper, the situation is different for FAI: Schwinger pair creation of the charged fermions results in a damping of the gauge-field production, which attenuates the GW signal. As a result, the GW signal from FAI can fall into the sensitivity reach of LISA and ET without violating the upper limit on $\Delta N_{\rm eff}$. This result notably applies to the arguably most realistic variant of Abelian axion inflation, in which the axion couples to the hypercharge sector of the Standard Model. Besides, we discuss GW emission from the fermion gas, which may further enhance the total GW signal but which also requires a more quantitative investigation in future work. Additionally, we identify a new backreaction regime in which fermion production moderates the axion--vector dynamics. In this regime, the axion velocity and all energy-density components exhibit oscillations analogous to the strong backreaction in PAI, but here, the oscillations occur around the slow-roll trajectory and are damped by the presence of charged fermions. These observations define again an interesting GEF benchmark for future lattice studies.",
New submissions,Extended mass distribution of PBHs during QCD phase transition: SGWB and mini-EMRIs,"Nilanjandev Bhaumik,Huai-Ke Guo,Si-Jiang Liu",Cosmology and Nongalactic Astrophysics (astro-ph.CO); General Relativity and Quantum Cosmology (gr-qc); High Energy Physics - Phenomenology (hep-ph),"Primordial black holes (PBHs) are one of the most important tracers of cosmic history. In this work, we investigate the formation of PBHs around the time of the QCD phase transition from a broadly peaked inflationary scalar power spectrum, which naturally produces an extended PBH mass function. This scenario yields two distinct stochastic gravitational wave backgrounds (SGWB): (i) scalar-induced, second-order tensor perturbations generated at PBH formation, and (ii) a merger-driven SGWB from the subsequent PBH binary population. Using Bayesian analysis, we examine both SGWB channels with the data from the NANOGrav 15-year dataset and the first three observing runs of LVK. We also forecast continuous-wave signals from mini extreme mass ratio inspirals (mini-EMRIs) for direct comparison with NANOGrav and LVK constraints. Our parameter scans identify regions of the parameter space where the combined SGWB is detectable in future ground-based and space-based detectors. A broad PBH mass distribution naturally gives rise to mini-EMRIs, which future ground-based observatories, such as LVK A+, ET, and CE, can detect. For a large part of the PBH parameter space, the SGWB of astrophysical origin masks the primordial SGWB in the frequency band of ground-based detectors. Thus, for extended PBH mass distributions, we find that the detection of mini-EMRIs is a more robust channel for probing the PBH parameter space than the corresponding SGWB.",
New submissions,From Dark Radiation to Dark Energy: Unified Cosmological Evolution in K-essence Models,"Eladio Moreno,Josue De-Santiago",Cosmology and Nongalactic Astrophysics (astro-ph.CO); General Relativity and Quantum Cosmology (gr-qc),"We study a class of Unified Dark Matter (UDM) models based on generalized K-essence, where a single scalar field with non-canonical kinetic terms accounts for dark radiation, dark matter, and dark energy. Starting from the purely kinetic Lagrangian proposed by Scherrer (2004), we extend the analysis to quadratic and exponential scalar potentials and explore their phenomenology. All models are implemented in a modified version of \texttt{Hi\_CLASS} and confronted with data from \textit{Planck} 2018, DESI DR1, and Big Bang Nucleosynthesis. The scenarios reproduce the full sequence of cosmic epochs: an early radiation-like phase, a matter-dominated era, and late-time accelerated expansion. The new models predict slightly higher values of the Hubble constant compared to $\Lambda$CDM, thereby partially alleviating the respective tensions from $\sim 4.4 \sigma$ to $\sim 3.4 \sigma$. The quadratic potential requires an ultralight mass that makes it effectively indistinguishable from the Scherrer solution. Overall, generalized K-essence provides a minimal and observationally viable realization of UDM, offering a unified description of the dark sector with distinctive signatures in both early- and late-time cosmology.",
New submissions,gCAMB: A GPU-accelerated Boltzmann solver for next-generation cosmological surveys,"L. Storchi,P. Campeti,M. Lattanzi,N. Antonini,E. Calore,P. Lubrano",Cosmology and Nongalactic Astrophysics (astro-ph.CO); Instrumentation and Methods for Astrophysics (astro-ph.IM); Computational Physics (physics.comp-ph),"Inferring cosmological parameters from Cosmic Microwave Background (CMB) data requires repeated and computationally expensive calculations of theoretical angular power spectra using Boltzmann solvers like CAMB. This creates a significant bottleneck, particularly for non-standard cosmological models and the high-accuracy demands of future surveys. While emulators based on deep neural networks can accelerate this process by several orders of magnitude, they first require large, pre-computed training datasets, which are costly to generate and model-specific. To address this challenge, we introduce gCAMB, a version of the CAMB code ported to GPUs, which preserves all the features of the original CPU-only code. By offloading the most computationally intensive modules to the GPU, gCAMB significantly accelerates the generation of power spectra, saving massive computational time, halving the power consumption in high-accuracy settings and, among other purposes, facilitating the creation of extensive training sets needed for robust cosmological analyses. We make the gCAMB software available to the community atthis https URL.",
New submissions,Non-linear infusion of intrinsic alignment and source clustering: impact on non-Gaussian cosmic shear statistics,"J. Harnois-Déraps,N. Šarčević,L. Medina Varela,J. Armijo,C. T. Davies,N. van Alfen,J. Blazek,L. Castiblanco,A. Halder,K. Heitmann,P. Larsen,L. Linke,J. Liu,C. MacMahon-Gellér,L. Porth,S. Rangel,C. Uhlemann, theLSST Dark Energy Science Collaboration",Cosmology and Nongalactic Astrophysics (astro-ph.CO),"Intrinsic alignments (IA) of galaxies is one of the key secondary signals to cosmic shear measurements, and must be modeled to interpret weak lensing data and infer the correct cosmology. There are large uncertainties in the physical description of IA, and analytical calculations are often out of reach for weak lensing statistics beyond two-point functions. We present here a set of six flexible IA models infused directly into weak lensing simulations, constructed from the mass shells, the projected tidal fields and, optionally, dark matter halo catalogues. We start with the non-linear linear alignment (NLA) and progressively sophisticate the galaxy bias and the tidal coupling models, including the commonly-used extended NLA (also known as the e-NLA or $\delta$-NLA) and the tidal torque (TT) models. We validate our methods with MCMC analyses from two-point shear statistics, then compute the impact on non-Gaussian cosmic shear probes from these catalogues as well as from reconstructed convergence maps. We find that the $\delta$-NLA model has by far the largest impact on most probes, at times more than twice the strength of the NLA. We also observe large differences between the IA models in under-dense regions, which makes minima, void profiles and lensing PDF the best probes for model rejection. Furthermore, our bias models allow us to separately study the source-clustering term for each of these probes, finding good agreement with the existing literature, and extending the results to these new probes. The third-order aperture mass statistics ($M^3_{ap}$) and the integrated three-point functions are particularly sensitive to this when including low-redshift data, often exceeding a 20% impact on the data vector. Our IA models are straightforward to implement and rescale from a single simulated IA-infused galaxy catalogue, allowing for fast model exploration.",
New submissions,V\textit{z}$-$GAL: Probing Cold Molecular Gas in Dusty Star-forming Galaxies at $\bf \textit{z}=1-6$,"Prachi Prajapati,Dominik Riechers,Pierre Cox,Axel Weiss,Amélie Saintonge,Bethany Jones,Tom J. L. C. Bakx,Stefano Berta,Paul van der Werf,Roberto Neri,Kirsty M. Butler,Asantha Cooray,Diana Ismail,Andrew Baker,Edoardo Borsato,Andrew Harris,Rob Ivison,Matthew Lehnert,Lucia Marchetti,Hugo Messias,Alain Omont,Catherine Vlahakis,Chentao Yang",Astrophysics of Galaxies (astro-ph.GA); Cosmology and Nongalactic Astrophysics (astro-ph.CO),"We present the first results of V\textit{z}-GAL, a high-redshift CO(\textit{J} = 1 $-$ 0) large survey with the Karl G. Jansky Very Large Array, targeting 92 \textit{Herschel}-selected, infrared-luminous, dusty star-forming galaxies (DSFGs). This flux density-limited sample includes 106 DSFGs in total, along with 14 galaxies from a recent pilot study -- altogether doubling the to-date available high-redshift \coonezero observations. These sources cover redshifts 1 to 6 with available mid/high-\textit{J} CO transitions from the Northern Extended Millimeter Array \zgal survey. We detect \coonezero emission in 90/92 targets above signal-to-noise ratio of 2, while two DSFGs remain undetected. \vzgal also covers additional \cotwoone emission lines in 10 of these sources. We find gas masses of the entire \vzgal sample to be $\rm (\alpha_{CO}/{4.0}) \mu {M}_{\rm H_2}$ = $(2-20) \times {10}^{11}~\mathrm{M_{\odot}}$, calibrated using \coonezero line luminosities. We confirm that these DSFGs -- with derived gas depletion timescales of $(50-600)$ Myr -- represent a heterogeneous population, potentially comprising both main-sequence galaxies and starbursts in the early Universe. Using \coonezero luminosities as an anchor, we robustly derive the CO brightness temperature ratios with a good statistical significance up to \textit{J} = 6. Our measurements reveal a broad range of gas excitation conditions across the \vzgal DSFGs. We also explore [CI](1$-$0)/CO(1$-$0) ratios in 23 \vzgal galaxies that have existing detections of atomic carbon ground-state emission, [CI](1$-$0), from the \zgal survey. Our results show similar [CI]/CO ratio values across cosmic time for starbursts and local star-forming galaxy populations, supporting the use of \cionezero as an alternative cold gas tracer.",
Cross submissions,Constraining inhomogeneous energy injection from annihilating dark matter and primordial black holes with 21-cm cosmology,"Yitian Sun,Joshua W. Foster,Julian B. Muñoz",High Energy Physics - Phenomenology (hep-ph); Cosmology and Nongalactic Astrophysics (astro-ph.CO),"The cosmic dawn 21-cm signal is a highly sensitive probe of any process which injects energy into the intergalactic medium, enabling novel searches for anomalous energy injection by through dark matter interactions. In addition to modifying the global 21-cm signal, these processes would leave distinct imprints on the frequency-resolved 21-cm power spectrum with a morphology jointly set by the time- and spatial-dependence of energy emission and absorption. In this work, we extend the DM21cm code package, which models the effects of spatially inhomogeneous energy emission and deposition on 21-cm cosmology, to study three well-motivated scenarios which 21-cm measurements are particularly well-suited to probe: dark matter annihilation through $p$-wave processes, the Hawking radiation of light primordial black holes, and energetic emission from accreting solar-mass primordial black holes. We project sensitivities to each of these scenarios, demonstrating that leading or near leading sensitivity to each can be achieved through 21-cm probes. We also make public our updates to the DM21cm code package that enable it to accommodate energy injection processes for general continuum spectra with arbitrary spatial and temporal dependence in an accompanying release.",
Cross submissions,BBN bounds on neutrinophilic ultralight Dark Matter,"Toni Bertólez-Martínez,Justo López-Sarrión,Jordi Salvado",High Energy Physics - Phenomenology (hep-ph); Cosmology and Nongalactic Astrophysics (astro-ph.CO),"The high densities in the early Universe provide a unique laboratory to constrain couplings between feebly interacting particles, such as dark matter and neutrinos. In this article, we study how Big Bang Nucleosynthesis can constrain models of Ultra-Light Dark Matter diagonally coupled to neutrinos. We follow an adiabatic formalism which allows to average-out the rapid oscillations of the Dark Matter field and consistently take into account the feedback between the neutrino and the Dark Matter fields. This feedback alters the early Universe dynamics, causing the Dark Matter energy density to scale as radiation, while the neutrino mass scales as $a^{-1}$. These two effects modify primordial element abundances by modifying interaction rates and the expansion rate during nucleosynthesis. Then, we use primordial abundances to obtain leading cosmological bounds on the coupling in the range $m_\phi/{\rm eV}\in (10^{-22},10^{-17})$, namely $g\lesssim 0.13(m_\phi/{\rm eV})$ for $m_\phi \gtrsim 3\times 10^{-20}\,\rm eV$ and $g\lesssim 1.8\times 10^{-11}\sqrt{m_\phi/\rm eV}$ for $m_\phi \lesssim 3\times 10^{-20}\,\rm eV$. This consistent cosmological treatment emphasizes that, in the mass interval where its physical assumptions hold, neutrino masses cannot be generated refractively by a direct coupling with an Ultra-Light Dark Matter field.",
Cross submissions,Vector Horndeski black holes in nonlinear electrodynamics,"Che-Yu Chen,Antonio De Felice,Shinji Tsujikawa,Taishi Sano",General Relativity and Quantum Cosmology (gr-qc); Cosmology and Nongalactic Astrophysics (astro-ph.CO); High Energy Physics - Phenomenology (hep-ph); High Energy Physics - Theory (hep-th),"On a spherically symmetric and static background, we study the existence of linearly stable black hole (BH) solutions in nonlinear electrodynamics (NED) with a Horndeski vector-tensor (HVT) coupling, with and without curvature singularities at the center ($r=0$). Incorporating the electric charge $q_E$ and the magnetic charge $q_M$, we first show that nonsingular BHs can exist only if $q_M = 0$. We then study the stability of purely electric BHs by analyzing the behavior of perturbations in the metric and the vector field. Nonsingular electric BHs are unstable due to a Laplacian instability in the vector perturbation near the regular center. In the absence of the HVT coupling ($\beta=0$), singular BHs in power-law NED theories can be consistent with all linear stability conditions, while Born-Infeld BHs encounter strong coupling due to a vanishing propagation speed as $r \to 0$. In power-law NED and Born-Infeld theories with $\beta \neq 0$, the electric fields for singular BHs are regular near $r=0$, while the metric functions behave as $\propto r^{-1}$. Nevertheless, we show that Laplacian instabilities occur for regions inside the outer horizon $r_h$, unless the HVT coupling constant $\beta$ is significantly smaller than $r_h^2$. For $\beta \neq 0$, we also reconstruct the NED Lagrangian so that one of the metric functions takes the Reissner-Nordström form. In this case, there exists a branch where all squared propagation speeds are positive, but the ghost and strong coupling problems are present around the BH center. Thus, the dominance of the HVT coupling generally leads to BH instability in the high-curvature regime.",
Cross submissions,Complete Classification of Domain Wall Solutions in the $\mathbb{Z}_2$-symmetric 2HDM,"Richard A. Battye,Steven J. Cotterill,Adam K. Thomasson",High Energy Physics - Phenomenology (hep-ph); Cosmology and Nongalactic Astrophysics (astro-ph.CO); High Energy Physics - Theory (hep-th),"We present a complete classification of domain wall solutions in the two-Higgs Doublet Model (2HDM) with a global $\mathbb{Z}_2$ symmetry, categorised as superconducting, CP-violating, or neither, depending on the scalar particle masses and the ratio of the two Higgs doublets' vacuum expectation values. We demonstrate that any domain wall solution can be reduced to depend on only six of the eight general field components, with further field reductions possible within different regions of the parameter space. Furthermore, we show that the superconducting solutions can be used to construct stable, current-carrying domain walls in two spatial dimensions. Similarly, the CP-violating solutions allow for two-dimensional configurations where CP symmetry is locally broken on the $\mathbb{Z}_2$-symmetric wall, which could provide an out-of-equilibrium environment for CP-violating processes to occur.",
Cross submissions,A non-inflationary solution to the monopole problem,Daniele Perri,High Energy Physics - Phenomenology (hep-ph); Cosmology and Nongalactic Astrophysics (astro-ph.CO); High Energy Physics - Theory (hep-th),"Magnetic monopoles are a long-standing prediction of Grand Unified Theories, yet their efficient production in early universe phase transitions would lead to a monopole abundance that far exceeds observational limits. The standard solution of the problem invokes inflation occurring after monopole production, diluting their density to undetectable levels and eliminating any possibility of present-day observation. Here, we propose an alternative solution based on the breaking, in the early universe prior to Big Bang Nucleosynthesis, of the Weyl conformal symmetry of the gauge kinetic sector of the Lagrangian. This mechanism enhances monopole annihilation, thereby reducing their abundance to acceptable levels without requiring inflation. This scenario also predicts a residual flux of GUT monopoles potentially within the sensitivity of current and upcoming cosmic ray detectors, making their discovery possible in the near future.",
Cross submissions,Revisiting constraints on magnetogenesis from baryon asymmetry,"Yuta Hamada,Kyohei Mukaida,Fumio Uchida",High Energy Physics - Phenomenology (hep-ph); Cosmology and Nongalactic Astrophysics (astro-ph.CO),"Magnetic fields in the universe potentially serve as a messenger of primordial physics. The observationally suggested intergalactic magnetic fields may be a relic of helical primordial $\mathrm{U}(1)_Y$ magnetic fields, which may also explain the origin of the baryon asymmetry of the universe. This scenario has been considered to be not viable, which we revisit as well as the baryon isocurvature problem for non-helical primordial $\mathrm{U}(1)_Y$ magnetic fields, based on the recent discussion on the hot electroweak theory. We find that maximally helical fields can be the origin of both the intergalactic magnetic fields and the baryon asymmetry of the universe and that there can be a window for non-helical fields to explain the origin of the intergalactic magnetic fields if the Higgs dynamics during the electroweak crossover compensate the helicity decay with a $\lesssim10^{-9\text{--}-10}$ precision.",
Cross submissions,Inflation from entropy,"Udaykrishna Thattarampilly,Yunlong Zheng",General Relativity and Quantum Cosmology (gr-qc); Cosmology and Nongalactic Astrophysics (astro-ph.CO); High Energy Physics - Theory (hep-th),"We investigate cosmological solutions for the modified gravity theory obtained from quantum relative entropy between the metric of spacetime and the metric induced by the geometry and matter fields. The vacuum equations admit inflationary solutions, hinting at an entropic origin for inflation. Equations also admit a regime of phantom like behavior. Assuming that the relation between slow roll parameters and CMB observables holds for entropic gravity, the theory predicts a viable spectrum.",
Cross submissions,A Five-dimensional Kaluza-Klein Approach to Unimodular Gravity,"Júlio C. Fabris,Richard Kerner",General Relativity and Quantum Cosmology (gr-qc); Cosmology and Nongalactic Astrophysics (astro-ph.CO); High Energy Physics - Theory (hep-th),"In this article we present a possibility of imposing the unimodular condition within the 5-dimensional Kaluza-Klein theory including the scalar field. Unimodular gravity became an object of increasing interest in the late 80-ties; and was recently used in primordial Universe modeling with cosmological constant, in the context of the Brans-Dicke gravity including scalar field. A generalization of the unimodularity principle to the 5-dimensional Kaluza-Klein model was discussed in our recent paper, in which variational principle is formulated in 5 dimensions first, and dimensional reduction is applied to the resulting set of equations. A cosmological model based on these equations was then presented and discussed. Here we present further developments of this approach, focussing our attention at perturbative aspects and stability of solutions.",
Cross submissions,Understanding the Nature of Scalar-Induced Gravitational Waves,"A.J. Iovino,G. Perna,D. Perrone,D. Racco,A. Riotto",General Relativity and Quantum Cosmology (gr-qc); Cosmology and Nongalactic Astrophysics (astro-ph.CO),"We offer a physical interpretation of the origin of the scalar-induced gravitational wave background, showing that it is mainly produced around the peaks of the scalar perturbations. We also provide a compact expression to estimate the amount of scalar-induced gravitational waves generated by peaks.",
Cross submissions,Dynamical Prevention of Topological Defect Formation,"Junseok Lee,Kai Murai,Kazunori Nakayama,Fuminobu Takahashi",High Energy Physics - Phenomenology (hep-ph); Cosmology and Nongalactic Astrophysics (astro-ph.CO),"Topological defects can have significant cosmological consequences, so their production must be examined carefully. It is usually assumed that topological defects are produced if the temperature becomes sufficiently high, but in reality their formation depends on the post-inflationary dynamics of a symmetry-breaking scalar. We analyze the dynamics of a symmetry-breaking scalar field in the early universe within models that provide an effective negative mass term at the origin, and show that the symmetry can remain broken so that topological defects are never formed. In particular, we demonstrate that nonthermally produced particles (such as the Standard Model Higgs) during preheating can generate such an effective negative mass term, allowing the scalar field to follow a time-dependent minimum even in renormalizable models with a quartic coupling. We also discuss the implications of this result for the Peccei-Quinn scalar in axion models.",
Cross submissions,High Reheating Temperature without Axion Domain Walls,"Shota Nakagawa,Yuichiro Nakai,Yu-Cheng Qiu,Lingyun Wang,Yaoduo Wang",High Energy Physics - Phenomenology (hep-ph); Cosmology and Nongalactic Astrophysics (astro-ph.CO); High Energy Physics - Theory (hep-th),"We investigate a cosmological scenario in which the Peccei-Quinn (PQ) symmetry remains broken in the entire history of the Universe, thereby avoiding the formation of axion strings and domain walls. Contrary to the conventional expectation, it is demonstrated that appropriately chosen scalar interactions are able to keep the PQ symmetry broken at arbitrarily high temperatures. We carefully examine the finite-temperature effective potential in a model with two PQ breaking scalar fields. The existence of flat directions plays a vital role in suppressing axion isocurvature perturbations during inflation by stabilizing a PQ field at a large field value. The viable parameter space consistent with theoretical and observational constraints is identified. Our scenario provides a minimal path for PQ symmetry breaking that addresses both the axion domain wall and isocurvature problems while permitting arbitrarily high reheating temperatures accommodating high-scale baryogenesis scenarios such as thermal leptogenesis.",
