Heading,Title,Authors,Subjects,Abstract,PDF
Cross submissions,Entanglement measures for causally connected subregions and holography,"XiangKun Gong,Wu-zhong Guo,Jin Xu",High Energy Physics - Theory (hep-th); General Relativity and Quantum Cosmology (gr-qc); Quantum Physics (quant-ph),"In this paper, we investigate entanglement for causally connected subregions $A$ and $B$ in quantum field theory and holography. Recent developments have established that a transition operator $T_{AB}$ can be well-defined for such subregions, which is generally non-Hermitian. By employing the Schwinger-Keldysh formalism and the real-time replica method, we show how to construct $T_{AB}$ and compute associated entanglement measures. In certain configurations, this leads to a notion of timelike entanglement entropy, for which we provide explicit quantum field theory computations and propose a holographic dual via analytic continuation from the Euclidean setup. Both analytical and numerical results are compared and found consistent.If entanglement between causally connected subregions is to be meaningful, it should also be able to define other entanglement measures. Motivated by the spacelike case, we propose a timelike extension of the entanglement wedge cross section, though we do not expect it to carry the same physical interpretation. In AdS$_3$/CFT$_2$, we compute explicit examples and find that the timelike entanglement wedge cross section is generally positive. Furthermore, we show that the reflected entropy for timelike intervals -- obtained via analytic continuation of twist correlators -- coincides with twice the timelike entanglement wedge cross section at leading order in $G$, supporting a holographic duality in the timelike case. We also discuss the extension of other entanglement measures, such as logarithmic negativity, to timelike separated regions using replica methods. We highlight conceptual challenges in defining reflected entropy via canonical purification for non-Hermitian operators.",
Cross submissions,Explorations of Universality in the Entropy and Hawking Radiation of Non-Extremal Kerr AdS$_4$ Black Holes,"Jun Nian,Leopoldo A. Pando Zayas,Wenni Zheng",High Energy Physics - Theory (hep-th); General Relativity and Quantum Cosmology (gr-qc),"We comprehensively discuss various microscopic approaches to the Bekenstein-Hawking entropy for rotating, electrically charged, asymptotically AdS$_4$ non-extremal black holes in gauged supergravity. We apply the covariant phase space formalism to the near-horizon region to obtain a Cardy-formula-based microscopic explanation for the entropy, consistent with the Kerr/CFT correspondence. From the dual boundary CFT point of view, we estimate the free partition function in the matrix model approximation in the high-temperature regime and find qualitative agreement with the supergravity answer. All these different approaches match in the appropriate limits and support the universality of AdS black hole entropy even at high temperatures, far away from extremality. Prompted by the consistency of the results of statistical explanations for the AdS$_4$ black hole entropy, we discuss aspects of the rate of Hawking radiation at high temperatures from the CFT$_2$ perspective and found it to be universally proportional to the horizon area.",
Cross submissions,Violating Weak Cosmic Censorship in AdS$_3$ via Gedanken Experiment,Masaya Amo,High Energy Physics - Theory (hep-th); General Relativity and Quantum Cosmology (gr-qc),"The weak cosmic censorship conjecture (wCCC) might not be as robust as one would expect. We present a potential counterexample to the wCCC in a rotating three-dimensional anti-de Sitter (AdS$_3$) spacetime. We extend the parameter range of the quantum corrected BTZ (qBTZ) black hole. We examine the infall of test particles with large orbital angular momentum into an extremal black hole. Our findings indicate that, under certain conditions -- such as neglecting the self-force effects -- the event horizon can be destroyed, leading to a violation of the wCCC. The results suggest that this solution should either be excluded from the applicability of the wCCC or should be examined with self-force effects incorporated.",
Cross submissions,"Cosmic string gravitational wave backgrounds at LISA: I. Signal survey, template reconstruction, and model comparison","Androniki Dimitriou,Daniel G. Figueroa,Peera Simakachorn,Bryan Zaldivar",Cosmology and Nongalactic Astrophysics (astro-ph.CO); General Relativity and Quantum Cosmology (gr-qc); High Energy Physics - Phenomenology (hep-ph),"We present a catalog of gravitational wave background (GWB) signal templates from cosmic-string networks, based on relevant models proposed in the literature. We classify templates as conventional, based on standard cosmology and Nambu-Goto results (VOS and BOS), and beyond conventional, based on modifications of a) the loop number density (LRS, super, metastable, current-carrying strings), b) the expansion history (non-standard cosmologies, extra degrees of freedom, either thermal or secluded), or c) the loop properties (birth length, power emission). Using the SBI package $\texttt{GWBackFinder}$, we quantify the reconstruction precision of each signal by LISA, scanning over their parameter space, and performing model comparisons. For conventional signals, LISA reconstructs the tension $G\mu$ with an error $\lesssim 10\%$ for $G\mu \gtrsim 5\cdot 10^{-15}$, which decreases down to $2-3\%$ for $G\mu \gtrsim 10^{-12}$. BOS and VOS modelings become distinguishable confidently for $G\mu \gtrsim 5\cdot 10^{-13}$. For beyond-conventional signals, we identify SNR and error-threshold intervals for each parameter, and determine (for few examples) the regions where they can be distinguished from conventional signals. Analogous quality reconstruction studies of cosmic-string GWBs, superimposed over leading astrophysical foregrounds in the LISA window, will be presented in a series of upcoming papers.",
Cross submissions,Constraints on DBI dark energy with chameleon mechanism,"Burin Gumjudpai,Nandan Roy,John Ward",Cosmology and Nongalactic Astrophysics (astro-ph.CO); General Relativity and Quantum Cosmology (gr-qc),"In this work, we investigate the Dirac Born Infeld chameleon scalar field model in light of the latest cosmological observations, analyzing the model both with the incorporation of the chameleon mechanism and without it. Results from current cosmological observations, such as Pantheon Plus, DES Y5, DESI DR2, and the compressed Planck likelihood, are used to constrain the model. We consider the AdS throat in the form of $f(\phi) = \lambda / \phi^4$ and a potential $V(\phi) = m_0^2 \phi^2 + m_1^2 \phi^4$ .One interesting finding from our analysis is that, without the chameleon mechanism, the mean value of $m_1 \simeq 0$ indicates the self-interaction of the DBI field could potentially be negligible. Constraints on the potential parameters do not appear when considering the chameleon mechanism, but the warp parameter and chameleon coupling parameter are forced to satisfy $\eta \geq 0$ and $\beta \leq 0$. Different choices of $\beta$ render the same background cosmological parameters. The equation of state $w_{\rm DE}$ resides more in the quintessence region in the past. There is no phantom crossing in this model under our assumption of the warp throat and potential. By computing the $\Delta \text{AIC}$ relative to the $\Lambda$CDM model, we study statistical model comparison. The model as a candidate of dynamical dark energy is observationally viable at the cosmological background level.",
