Heading,Title,Authors,Subjects,Abstract,PDF
New submissions,Searching for continuous gravitational waves in the Parkes Pulsar Timing Array DR3,"Shi-Yi Zhao,Zu-Cheng Chen,Jacob Cardinal Tremblay,Boris Goncharov,Xing-Jiang Zhu,N. D. Ramesh Bhat,Małgorzata Curyło,Shi Dai,Valentina Di Marco,Hao Ding,George Hobbs,Agastya Kapur,Wenhua Ling,Tao Liu,Rami Mandow,Saurav Mishra,Daniel J. Reardon,Christopher J Russell,Ryan M. Shannon,Shuangqiang Wang,Lei Zhang,Andrew Zic",General Relativity and Quantum Cosmology (gr-qc); Cosmology and Nongalactic Astrophysics (astro-ph.CO); High Energy Astrophysical Phenomena (astro-ph.HE),"We present results from an all-sky search for continuous gravitational waves from individual supermassive binary black holes using the third data release (DR3) of the Parkes Pulsar Timing Array (PPTA). Even though we recover a common-spectrum stochastic process, potentially induced by a nanohertz gravitational wave background, we find no evidence of continuous waves. Therefore, we place upper limits on the gravitational-wave strain amplitude: in the most sensitive frequency range around 10 nHz, we obtain a sky-averaged 95\% credibility upper limit of $\approx 7 \times 10^{-15}$. Our search is sensitive to supermassive binary black holes with a chirp mass of $\geq 10^9M_{\odot}$ up to a luminosity distance of 50 Mpc for our least sensitive sky direction and 200 Mpc for the most sensitive direction. This work provides at least 4 times better sensitivity in the 1-200 nHz frequency band than our last search based on the PPTA's first data release. We expect that PPTA will continue to play a key role in detecting continuous gravitational waves in the exciting era of nanohertz gravitational wave astronomy.",
New submissions,Parameter constraints on Horndeski rotating black hole through quasiperiodic oscillations,"Meng-He Wu,Hong Guo,Xiao-Mei Kuang",General Relativity and Quantum Cosmology (gr-qc),"In this paper, we perform small perturbations around the circular timelike orbit in the equatorial plane of the Horndeski rotating black hole, and analyze the effects of Horndeski hair on the three fundamental frequencies of the epicyclic oscillations. Since this operation can model the quasiperiodic oscillations (QPOs) phenomena of the surrounding accretion disc, we then employ the MCMC simulation to fit the theoretical results with three QPO events, including GRO J1655-40, XTE J1859+226 and H1743-322, and constrain the characteristic radius $r$, black hole mass $M$ and spinning parameter $a$, and the Horndeski hair parameter $h$. Our constraint on the Horndeski hair parameter is much tighter than QPOs simulation from the existed accretion models, suggesting slight deviation from classical Kerr black hole.",
Cross submissions,Semi-analytic studies of accretion disk and magnetic field geometry in M87*,"Saurabh,Maciek Wielgus,Arman Tursunov,Andrei P. Lobanov,Razieh Emami",High Energy Astrophysical Phenomena (astro-ph.HE); General Relativity and Quantum Cosmology (gr-qc),"Context: Magnetic fields play a pivotal role in dynamics of black hole accretion flows and formation of relativistic jets. Observations by the Event Horizon Telescope (EHT) provided unprecedented insights into accretion structures near black holes. Interpreting these observations requires a theoretical framework linking polarized emission to underlying system properties and magnetic field geometries. Aims: We investigate how system properties, particularly magnetic field geometry in the event horizon scale region, influence the structure of the observable synchrotron emission in M87*. Specifically, we aim to quantify the sensitivity of observables used by the EHT to black hole spin, plasma dynamics, accretion disk thickness, and magnetic field geometry. Methods: We adopt a semi-analytic radiatively inefficient accretion flow model in Kerr spacetime. We vary magnetic field geometry, black hole spin, accretion disk dynamics, and geometric thickness of the disk. We perform general relativistic ray tracing with a full polarized radiative transfer to obtain synthetic images of M87*. We extract EHT observables, such as disk diameter, asymmetry, and polarimetric metrics from synthetic models. We also consider a number of general relativistic magnetohydrodynamics simulations and compare them with the semi-analytical models. Results: We see limited impact of the disk thickness on observables. On the other hand, toroidal field dominated and poloidal field dominated magnetic configurations can be distinguished reliably. The flow dynamics, in particular presence of radial inflow, also significantly impacts the EHT observables. Conclusions: The M87* system is most consistent with a poloidal magnetic field dominated flow with partially radial inflow. While the spin remain elusive, moderate or large positive values are preferred.",
Cross submissions,Quantum geometric phase with initial state index dependent on space-time curvature,Jose Alberto Pereira Frugone,Quantum Physics (quant-ph); General Relativity and Quantum Cosmology (gr-qc),We introduce a new way of generating the quantum geometric phase by making the initial base state index dependent on space-time curvature. We prove that the resulting Schrödinger equation is identical to the trace form of the Einstein gravitational field equations when we are in the adiabatic approximation. This particular initial condition was proposed in a previous work by the author.,
Cross submissions,From Wide Triples to UCXBs: Multimessenger Detection of Dynamically-formed Black Hole-White Dwarf Systems with LISA,"Zeyuan Xuan,Cheyanne Shariat,Smadar Naoz",High Energy Astrophysical Phenomena (astro-ph.HE); Astrophysics of Galaxies (astro-ph.GA); General Relativity and Quantum Cosmology (gr-qc),"Ultracompact X-ray binaries (UCXBs) are a subclass of low-mass X-ray binaries characterized by tight orbits and degenerate donors, which pose significant challenges to our understanding of their formation. Recent discoveries of black hole (BH) candidates with main-sequence (MS) or red giant (RG) companions suggest that BH-white dwarf (BH-WD) binaries are common in the Galactic field. Motivated by these observations and the fact that most massive stars are born in triples, we show that wide BH-WD systems can naturally form UCXBs through the eccentric Kozai-Lidov (EKL) mechanism. Notably, EKL-driven eccentricity excitations combined with gravitational wave (GW) emission and WD dynamical tides can effectively shrink and circularize the orbit, leading to mass-transferring BH-WD binaries. These systems represent promising multimessenger sources in both X-ray and GW observations. Specifically, we predict that the wide triple channel can produce $\sim5-45$ ($\sim1-8$) detectable UCXBs in the Milky Way (Andromeda galaxy), including $\sim1$ system observable by the mHz GW detection of LISA. If the final WD mass can reach sufficiently small values, this channel could contribute up to $\sim 10^3$ UCXBs in the Galaxy. Furthermore, the identification of tertiary companions in observed UCXBs would provide direct evidence for this formation pathway and yield unique insights into their dynamical origins.",
Cross submissions,"Triples as Links between Binary Black Hole Mergers, their Electromagnetic Counterparts, and Galactic Black Holes","Smadar Naoz,Zoltan Haiman,Eliot Quataert,Liz Holzknecht",High Energy Astrophysical Phenomena (astro-ph.HE); Astrophysics of Galaxies (astro-ph.GA); Solar and Stellar Astrophysics (astro-ph.SR); General Relativity and Quantum Cosmology (gr-qc),"We propose a formation pathway linking black holes (BHs) observed in gravitational-wave (GW) mergers, wide BH-stellar systems uncovered by Gaia, and accreting low-mass X-ray binaries (LMXBs). In this scenario, a stellar-mass BH binary undergoes isolated binary evolution and merges while hosting a distant, dynamically unimportant tertiary stellar companion. The tertiary becomes relevant only after the merger, when the remnant BH receives a GW recoil kick. Depending on the kick velocity and system configuration, the outcome can be: (i) a bright electromagnetic (EM) counterpart to the GW merger; (ii) an LMXB; (iii) a wide BH-stellar companion resembling the Gaia BH population; or (iv) an unbound, isolated BH. Modeling the three-body dynamics, we find that $\sim 0.02\%$ of LIGO-Virgo-KAGRA (LVK) mergers may be followed by an EM counterpart within $\sim$10 days, produced by tidal disruption of the star by the BH. The flare is likely brightest in the optical-UV and lasts days to weeks; in some cases, partial disruption causes recurring flares with a period of $\sim$2 months. We further estimate that this channel can produce $\sim 1-10\%$ of Gaia BH systems in the Milky Way. This scenario provides the first physically motivated link between GW sources, Gaia BHs, and some X-ray binaries, and predicts a rare but robust pathway for EM counterparts to binary BH mergers, potentially detectable in LVK's O5 run.",
Cross submissions,Algebraic traversable wormholes,Eyoab Bahiru,High Energy Physics - Theory (hep-th); General Relativity and Quantum Cosmology (gr-qc),"We propose a new large $N$ limit which at the extreme limit is dual in the bulk to a back-reacted traversable wormhole, by making use if a novel definition of algebra at infinity, an algebra familiar in the literature from the study of quasi-local algebras. We also compute, from a purely algebraic perspective, the effects registered by a left universe observer due to a unitary fluctuation on the right universe of the traversable wormhole, and reproduce a result from an earlier computation by Maldacena, Stanford and Yang \cite{Maldacena:2017axo}.",
Cross submissions,HBAR entropy in causal diamond geometry: A near-horizon perspective,"Nada Eissa,Carlos R. Ordóñez,Gustavo Valdivia-Mera",High Energy Physics - Theory (hep-th); General Relativity and Quantum Cosmology (gr-qc); Quantum Physics (quant-ph),"In this article we extend the Horizon Brightened Acceleration Radiation (HBAR) framework to the causal diamond (CD) spacetime. We study a cloud of two-level atoms, injected at random times in the asymptotic past of the CD, freely falling toward its causal horizon and emitting scalar radiation via a weak dipole coupling to a quantum field. In the near-horizon region, an emergent conformal symmetry-captured by conformal quantum mechanics (CQM)-governs the field dynamics and allows analytic control of the emission process. We find that the radiation spectrum is thermal, with temperature $T_D = 1/(\pi\alpha)$, and that the associated von Neumann entropy flux reproduces the entropy production of the radiation field. These results demonstrate that the causal horizons of the CD spacetime effectively act as a topological thermal reservoir, with thermal properties arising entirely from the global causal structure rather than from underlying microscopic degrees of freedom, highlighting that the validity of the HBAR framework is fundamentally tied to the existence of causal horizons, independent of the presence of a black hole.",
Cross submissions,Fabrication of nano-diamonds with a single NV center: Towards matter-wave interferometry with massive objects,"Menachem Givon,Yaniv Bar-Haim,David Groswasser,Asi Solodar,Nadav Aharon,Michael Belman,Amit Yosefi,Erez Golan,Jurgen Jopp,Ron Folman",Quantum Physics (quant-ph); General Relativity and Quantum Cosmology (gr-qc); Atomic Physics (physics.atom-ph),"Quantum mechanics (QM) and General relativity (GR), also known as the theory of gravity, are the two pillars of modern physics. A matter-wave interferometer with a massive particle can test numerous fundamental ideas, including the spatial superposition principle - a foundational concept in QM - in previously unexplored regimes. It also opens the possibility of probing the interface between QM and GR, such as testing the quantization of gravity. Consequently, there exists an intensive effort to realize such an interferometer. While several approaches are being explored, we focus on utilizing nanodiamonds with embedded spins as test particles which, in combination with Stern-Gerlach forces, enable the realization of a closed-loop matter-wave interferometer in space-time. There is a growing community of groups pursuing this path [1]. We are posting this technical note (as part of a series of seven such notes), to highlight our plans and solutions concerning various challenges in this ambitious endeavor, hoping this will support this growing community. Here we discuss the design considerations for a high-precision enhanced-coherence nanodiamond source, review the fabrication processes used to produce nanodiamond pillars measuring 40 x 65 x 80 nm, summarize the characterization work completed to date, and conclude with an outlook on the remaining steps needed to finalize the source fabrication. We would be happy to make available more details upon request.",
Cross submissions,Parametric feedback cooling of librations of a nanodiamond in a Paul trap: Towards matter-wave interferometry with massive objects,"Maria Muretova,Yonathan Japha,Marko Toros,Ron Folman",Quantum Physics (quant-ph); General Relativity and Quantum Cosmology (gr-qc),"Quantum mechanics (QM) and General relativity (GR), also known as the theory of gravity, are the two pillars of modern physics. A matter-wave interferometer with a massive particle can test numerous fundamental ideas, including the spatial superposition principle - a foundational concept in QM - in completely new regimes, as well as the interface between QM and GR, e.g., testing the quantization of gravity. Consequently, there exists an intensive effort to realize such an interferometer. While several paths are being pursued, we focus on utilizing nanodiamonds (NDs) as our particle, and a spin embedded in the ND together with Stern-Gerlach forces, to achieve a closed loop in space-time. There is a growing community of groups pursuing this path [1]. We are posting this technical note (as part of a series of seven such notes) to highlight our plans and solutions concerning various challenges in this ambitious endeavor, hoping this will support this growing community. Here, we present a theoretical study concerning the impact of rotations of the ND on the interferometric contrast. We have previously shown that for a first-generation Stern-Gerlach interferometer with an ND composed of 10^7 atoms, it is sufficient to cool the center of mass to milli-Kelvin temperatures. In this work, we similarly show that rotation does not have to be cooled to the ground state, and cooling to hundreds of rotational phonons is good enough. We describe and simulate parametric feedback cooling of librational modes of a charged ND levitated in a Paul trap. The cooling is performed by modulating the electric field of the trap. We examine the dependence of the efficiency of cooling on the electric potential and the shape of the object. We show that the required libration temperatures should be within reach in the very near future. We would be happy to make more details available upon request.",
Cross submissions,Lense-Thirring precession of accretion flows: relativistic versus classical precession,"Gabriel Török,Martin Urbanec,Monika Matuszková,Gabriela Urbancová,Kateřina Klimovičová,Debora Lančová,Eva Šrámková,Jiří Horák",High Energy Astrophysical Phenomena (astro-ph.HE); General Relativity and Quantum Cosmology (gr-qc),"The vertical (Lense-Thirring) precession of the innermost accretion flows has been discussed as a sensitive indicator of the rotational properties of neutron stars (NSs) and their equation of state because it vanishes for a non-rotating star. In this work, we apply the Hartle-Thorne spacetimes to study the frequencies of the precession for both geodesic and non-geodesic (fluid) flows. We build on previous findings on the effect of the NS quadrupole moment, which revealed the importance of the interplay between the relativistic and classical precession. Because of this interplay, the widely used Lense-Thirring metric, linear in the NS angular momentum, is insufficient to calculate the behaviour of the precession frequency across an astrophysically relevant range of NS angular momentum values. We find that even for a moderately oblate NSs, the dependencies of the precession frequency on the NS angular momentum at radii within the innermost accretion region have maxima that occur at relatively low values of the NS angular momentum. We conclude that very different groups of accreting NSs, slow and fast rotators, can display the same precession frequencies. This may explain the lack of evidence for a correlation between the frequencies of the observed low-frequency quasiperiodic oscillations and the NS spin. In our work, we provide a full, general description of precession behaviour, and also examples that assume specific NS and quark star (MIT bag) equation of state. Our calculations are reproducible using the associated Wolfram Mathematica notebook.",
Cross submissions,Foliations by critical surfaces of the Hawking energy in asymptotically flat initial data sets,Alejandro Peñuela Diaz,Differential Geometry (math.DG); General Relativity and Quantum Cosmology (gr-qc),"Area-constrained critical surfaces for the Hawking quasi-local energy (""Hawking surfaces"") provide a natural setting for that energy: they enjoy positivity and rigidity properties. We construct large-scale foliations at infinity by Hawking surfaces in asymptotically Schwarzschild initial data sets. Using a Lyapunov-Schmidt reduction within a Willmore-foliation framework, we prove existence and uniqueness of the foliation and study its coordinate center. Under the dominant energy condition, we show that along the leaves of the foliation, the Hawking energy is positive and converges to the ADM energy in the large-sphere limit; moreover, subject to an explicit integral constraint, it is monotone along the foliation. Under weaker assumptions we construct an on-center family of Hawking surfaces that, while not necessarily a foliation, still enjoys positivity and the large-sphere limit. Finally, we obtain a rigidity statement and verify that our hypotheses hold in a broad class of data, initial data sets with harmonic or York asymptotics, thereby demonstrating the robustness of Hawking surfaces as a quasi-local energy tool in dynamical spacetimes.",
Cross submissions,A Satellite $N=2$ Superparticle in Extra Dimensions,"F. E. A. de Souza,M. O. Tahim,R. I. O. Junior,I. M. Macedo",High Energy Physics - Theory (hep-th); General Relativity and Quantum Cosmology (gr-qc),"In this work we discuss the issue of localization of $N=2$ spinning particles. More specifically, we show that we can not confine the spinning particle within the Randall-Sundrum scenario. We argue that this result directly affects studies related to localization of $p$-form fields. We show that, due to the non confinement of the superparticle, we can not localize $p$-forms on the membrane.",
Cross submissions,Regular AdS$_3$ black holes from regularized Gauss-Bonnet coupling,"Gokhan Alkac,Murat Mesta,Gonul Unal",High Energy Physics - Theory (hep-th); General Relativity and Quantum Cosmology (gr-qc),"We obtain a three-dimensional bi-vector-tensor theory of the generalized Proca class by regularizing the Gauss-Bonnet invariant within the Weyl geometry. We show that the theory admits a regular AdS$_3$ black hole solution with primary hairs. Introducing a deformation in the theory, a different regular AdS$_3$ black hole solution is obtained. Charged generalizations of these solutions are given by coupling to Born-Infeld electrodynamics.",
