Heading,Title,Authors,Subjects,Abstract,PDF
Cross submissions,Collider probes of baryogenesis with maximal CP asymmetry,"Debasish Borah,Kun Cheng,Arnab Dasgupta,Tao Han,Keping Xie",High Energy Physics - Phenomenology (hep-ph); Cosmology and Nongalactic Astrophysics (astro-ph.CO); High Energy Physics - Experiment (hep-ex),"We propose a novel collider probe of baryogenesis at TeV scale by measuring decay asymmetries into particle and anti-particle final states. Motivated by the idea of Dirac leptogenesis, we consider an extension of the standard model with new colored and $SU(2)_L$ singlet particles in such a way that the out-of-equilibrium decay of heavy colored fermions creates equal and opposite CP asymmetries in two sectors, prevented from equilibrating with each other. While the TeV scale viability of this mechanism requires a resonantly enhanced CP asymmetry, the latter also plays a crucial role leading to observable decay asymmetries in colliders. In addition to discussing conventional signatures of such heavy colored particles, namely, mono-jet plus missing transverse energy, displaced vertex, colored track at hadron colliders, we also show the unique possibility of measuring decay asymmetries via forward-backward and charge asymmetries at future muon colliders. In addition to being a verifiable TeV-scale baryogenesis scenario, the model also predicts a singlet scalar dark matter candidate consistent with the required thermal dark matter properties near the Higgs resonance.",
Cross submissions,Scalaron dark matter dynamics: effects of Higgs non-minimal coupling to gravity,"Shibendu Gupta Choudhury,Koushik Dutta,Deep Ghosh",High Energy Physics - Phenomenology (hep-ph); Cosmology and Nongalactic Astrophysics (astro-ph.CO); General Relativity and Quantum Cosmology (gr-qc),"One of the key features of the $R^2$-gravity is the embedding of a scalar field, scalaron, into the gravity sector. The scalaron interacts with the Standard Model (SM) matter fields through Planck-suppressed couplings. If the scalaron serves as a viable dark matter (DM) candidate, it can account for the lack of evidence of DM interactions beyond gravity in experimental and observational probes to date. The realization of the scalaron, as a cold DM candidate, depends on an induced trilinear interaction with the SM Higgs, despite its suppressed coupling strength. Here, we introduce a Higgs non-minimal coupling to gravity that additionally contributes to the induced trilinear interaction with its existing competing part, originated from the $R^2$-gravity. We study the interplay between these two contributions in the early universe, which determines both the initial conditions and evolution of the scalaron, leading to cold DM behavior at a later epoch. The trilinear interaction vanish identically for certain combinations of the Higgs non-minimal coupling and the scalaron mass, thereby setting the scalaron density through misalignment mechanism, similar to axions. Consequently, we find that the observed DM relic density is obtained for a scalaron mass between $1.38$ keV and $0.7$ MeV. The lower limit on the mass stems from the LHC constraints on the Higgs non-minimal coupling, whereas the upper bound arises from INTEGRAL/SPI limits on the excess gamma-ray flux from possible scalaron decays to two photons.",
Cross submissions,Gravitational waves from two scalar fields unifying the dark sector with inflation,"Orlando Luongo,Tommaso Mengoni,Paulo M. Sá",General Relativity and Quantum Cosmology (gr-qc); Cosmology and Nongalactic Astrophysics (astro-ph.CO),"We investigate the gravitational-wave background predicted by a two-scalar-field cosmological model that aims to unify primordial inflation with the dark sector, namely late-time dark energy and dark matter, in a single and self-consistent theoretical framework. The model is constructed from an action inspired by several extensions of general relativity and string-inspired scenarios and features a non-minimal interaction between the two scalar fields, while both remain minimally coupled to gravity. In this context, we derive the gravitational-wave energy spectrum over wavelengths ranging from today's Hubble horizon to those at the end of inflation. We employ the continuous Bogoliubov coefficient formalism, originally introduced to describe particle creation in an expanding Universe, in analogy to the well-established mechanism of gravitational particle production and, in particular, generalized to gravitons. Using this method, which enables an accurate description of graviton creation across all cosmological epochs, we find that inflation provides the dominant gravitational-wave contribution, while subdominant features arise at the inflation-radiation, radiation-matter, and matter-dark energy transitions, i.e., epochs naturally encoded inside our scalar field picture. The resulting energy density spectrum is thus compared with the sensitivity curves of the planned next-generation ground- and space-based gravitational-wave observatories. The comparison identifies frequency bands where the predicted signal could be probed, providing those windows associated with potentially detectable signals, bounded by our analyses. Consequences of our recipe are thus compared with numerical outcomes and the corresponding physical properties discussed in detail.",
Cross submissions,Probing Light Dark Matter with Cosmic Gravitational Focusing,"Shao-Feng Ge,Liang Tan",High Energy Physics - Phenomenology (hep-ph); Cosmology and Nongalactic Astrophysics (astro-ph.CO),"We investigate the possibility of using the cosmic gravitational focusing (CGF) to probe the minor light dark matter (DM) component whose mass is in the range of $(0.1 \sim 100)$\,eV. Being a purely gravitational effect, the CGF offers a mode-independent probe that is complementary to the existing ways such as Lyman-$\alpha$ and $\Delta N_{\rm eff}$. Such effect finally leads to a dipole density distribution that would affect the galaxy formation and hence can be reconstructed with galaxy surveys such as DESI. Both the free-streaming and clustering limits have been studied with analytical formulas while the region in between is bridged with interpolation. We show the projected sensitivity at DESI with the typical phase space distribution of a freeze-in DM scenario as illustration.",
Cross submissions,Primordial black holes formation in inflationary $F(R)$ models with scalar fields,"E.O. Pozdeeva,S.Yu. Vernov",General Relativity and Quantum Cosmology (gr-qc); Cosmology and Nongalactic Astrophysics (astro-ph.CO); High Energy Physics - Theory (hep-th),"We construct $F(R)$ gravity models with scalar fields to describe cosmological inflation and formation of primordial black holes (PBHs). By adding the induced gravity term and the fourth-order polynomial potential for the scalar field to the known $F(R)$ gravity model, and using a conformal transformation of the metric, we obtain a two-field chiral cosmological model. For some values of the model parameters, we get that the inflationary parameters of this model are in good agreement with the observations of the cosmic microwave background radiation obtained by the Atacama Cosmology Telescope. The estimation of PBH masses suggests that PBHs could be dark matter candidates.",
