Heading,Title,Authors,Subjects,Abstract,PDF
Cross submissions,Impact of Perfect Fluid Dark Matter on the Appearance of Rotating Black Hole,"Huang Yu-Xiang,Guo Sen,Liang En-Wei,Lin Kai",High Energy Astrophysical Phenomena (astro-ph.HE); General Relativity and Quantum Cosmology (gr-qc),"Understanding how dark matter affects the immediate environment of black holes (BHs) is crucial for interpreting horizon-scale observations. We study rotating BHs surrounded by perfect fluid dark matter (PFDM), exploring their observable features through both analytical and numerical approaches. Using the existence criterion of the innermost stable circular orbit (ISCO), we first derive joint constraints on the PFDM intensity parameter~k and the spin parameter~a. Within the resulting physically allowed parameter regime, we perform high-resolution, general-relativistic ray-tracing simulations of thin accretion disks at 87~GHz and 230~GHz, capturing the detailed brightness morphology and photon ring structure shaped by PFDM. By incorporating angular diameter measurements of M87^{*} and Sgr~A^{*} from the Event Horizon Telescope (EHT), we further narrow down the viable parameter space and directly compare synthetic images with EHT observations of M87^{*}. We find that the inclusion of PFDM improves the agreement with the observed compact shadow and asymmetric brightness distribution, suggesting that dark matter may leave observable imprints on horizon-scale images. Our results position PFDM as a physically motivated extension to the Kerr geometry and highlight a promising astrophysical pathway for probing dark matter near BHs with current and future VLBI campaigns.",
Cross submissions,Model-Agnostic Population Inference for Gravitational-Wave Astronomy: From LIGO to LISA,"Yi-kun Li,Cheng Cheng,Lang Cui,Yun Fang",Instrumentation and Methods for Astrophysics (astro-ph.IM); High Energy Astrophysical Phenomena (astro-ph.HE); General Relativity and Quantum Cosmology (gr-qc),"Inferring the intrinsic population of compact binary mergers is complicated by detector selection biases and measurement uncertainties. Traditional parametric methods are limited by the need to presuppose functional forms, introducing model-dependent biases. To overcome these limitations, we introduce an inference framework powered by deep generative modeling. We develop a flexible, data-driven population model using a Correlated Compound-Mixture Density Network. This architecture integrates mixture models to handle multimodality, Gaussian copulas for parameter dependencies, and a library of flexible marginal distributions. The network is trained to approximate the posterior distribution of the population's hyperparameters using amortized variational inference with Normalizing Flows on catalogs of gravitational-wave events. We demonstrate the framework's capabilities in two distinct regimes. First, using simulated catalogs of supermassive black hole binary mergers for the Laser Interferometer Space Antenna (LISA), we show that the method accurately recovers complex three-dimensional distributions and absolute merger rates from sparse datasets, effectively correcting for selection effects and measurement uncertainties. Second, we validate the framework on real observational data from the LIGO-Virgo-KAGRA GWTC-3 catalog, successfully inferring the population of stellar-mass binary black holes using an injection-based selection effect correction. Our results confirm that the method is robust, scalable, and applicable across different detector sensitivities and source populations.",
Cross submissions,An autoencoder-based surrogate waveform model for quasi-circular binary-black-hole mergers,"Anastasios Theodoropoulos,Nino Villanueva,Osvaldo Gramaxo Freitas,Tiago Fernandes,Solange Nunes,Alejandro Torres-Forne,Jose A. Font,Antonio Onofre,Jose D. Martin-Guerrero",Instrumentation and Methods for Astrophysics (astro-ph.IM); High Energy Astrophysical Phenomena (astro-ph.HE); General Relativity and Quantum Cosmology (gr-qc),"The generation of accurate waveforms from binary black hole (BBH) mergers is a major effort in Gravitational-Wave Astronomy. In recent years, machine-learning-based surrogate models for BBH waveforms have been proposed. Those offer the potential to dramatically accelerate waveform generation while maintaining accuracy competitive with that of traditional waveform approximants. In this work, we investigate the viability of autoencoders as generative models for gravitational-wave signals from quasi-circular BBH mergers. We introduce AESur3dq8, a novel surrogate waveform model based on autoencoders that enables the rapid and accurate construction of large template banks, producing millions of waveforms in under a second using modest computational resources. The model is trained on the numerical-relativity-informed surrogate NRHybSur3dq8 and subsequently fine-tuned using the SXS catalog of BBH simulations. We demonstrate that waveforms generated by AESur3dq8 achieve mismatches of order $10^{-4}$ with respect to Numerical Relativity waveforms, and that parameter estimation performed with these templates yields results fully consistent with those reported by the LIGO-Virgo-KAGRA Collaboration for observed gravitational-wave events.",
Cross submissions,"Remarks on Dirac-Bergmann algorithm, Dirac's conjecture and the extended Hamiltonian",Kirill Russkov,High Energy Physics - Theory (hep-th); General Relativity and Quantum Cosmology (gr-qc); Mathematical Physics (math-ph); Quantum Physics (quant-ph),"The Dirac-Bergmann algorithm for the Hamiltonian analysis of constrained systems is a nice and powerful tool, widely used for quantization and non-perturbative counting of degrees of freedom. However, certain aspects of its application to systems with first-class constraints are often overlooked in the literature, which is unfortunate, as a naive treatment leads to incorrect results. In particular, when transitioning from the total to the extended Hamiltonian, the physical information encoded in the constrained modes is lost unless a suitable redefinition of gauge invariant quantities is made. An example of this is electrodynamics, in which the electric field gets an additional contribution to its longitudinal component in the form of the gradient of an arbitrary Lagrange multiplier. Moreover, Dirac's conjecture, the common claim that all first-class constraints are independent generators of gauge transformations, is somewhat misleading in the standard notion of gauge symmetry used in field theories. At the level of the total Hamiltonian, the true gauge generator is a specific combination of primary and secondary first-class constraints; in general, Dirac's conjecture holds only in the case of the extended Hamiltonian.The aim of the paper is primarily pedagogical. We review these issues, providing examples and general arguments. Also, we show that the aforementioned redefinition of gauge invariants within the extended Hamiltonian approach is equivalent to a form of the Stueckelberg trick applied to variables that are second-class with respect to the primary constraints.",
Cross submissions,Running Love Numbers of Charged Black Holes,"Sergio Barbosa,Sylvain Fichet,Lucas de Souza",High Energy Physics - Theory (hep-th); Cosmology and Nongalactic Astrophysics (astro-ph.CO); General Relativity and Quantum Cosmology (gr-qc),"Loops of virtual particles from the vacuum of quantum field theory (QFT) render black holes tidally deformable. We compute the static tidal response of unspinning charged black holes at arbitrary radius, using the perturbative formalism developed in2501.18684. Since the gravitational and electromagnetic tidal responses mix, we generalize the notion of Love numbers to Love matrices. We derive the coupled equations of motion for the metric and electromagnetic fluctuations around purely electric and magnetic backgrounds. For large charged black holes, which are described by the Effective Field Theory (EFT) of gravity, we compute the full set of Love matrices induced by an arbitrary tower of $F^{2n}$ operators. We find that, although quantum corrections break electromagnetic duality, the Love matrices in electric and magnetic backgrounds are related by a $Z_2$ symmetry under electric-magnetic exchange. Going beyond EFT, we compute the Love matrices of small magnetic black holes. We show that the running of the Love matrices is governed by the running of the $U(1)$ gauge coupling, and we derive the correspondence between Love and $U(1)$ beta functions for arbitrary harmonics. The overall picture that emerges is that the QFT-induced tidal response of magnetic black holes saturates in the strong-field regime. These results imply that nearly-extremal magnetic black holes charged under an Abelian dark sector could be probed by gravitational-wave observations.",
Cross submissions,Nonperfect Carrollian Fluids Through Holography,Felipe Diaz,High Energy Physics - Theory (hep-th); General Relativity and Quantum Cosmology (gr-qc),"We embed the covariant, gauge-invariant gravitational radiation criteria of Fernández-Álvarez and Senovilla, based in terms of conformal geometry and the Bel-Robinson tensor, into the hydrodynamic framework of gauge/gravity duality. This construction uncovers a direct correspondence between bulk gravitational waves and dissipative processes in the boundary theory, from which a natural notion of entropy production emerges. We further analyze a smooth flat limit in which the dual fluid becomes Carrollian, with dissipation governed by Carroll-covariant tensors. As an example, we apply our framework to the Robinson-Trautman family of solutions.",
Cross submissions,Has Kronos devoured Planet Nine and its epigones?,Lorenzo Iorio,Earth and Planetary Astrophysics (astro-ph.EP); General Relativity and Quantum Cosmology (gr-qc); Space Physics (physics.space-ph),"The Planet Nine hypothesis encompasses a body of about 5-8 Earth's masses whose orbital plane would be inclined to the ecliptic by one or two tens of degrees and whose perihelion distance would be as large as about 240-385 astronomical units. Recently, a couple of his epigones have appeared: Planet X and Planet Y. The former is a sort of minor version of Planet Nine in that all its physical and orbital parameters would be smaller. Instead, the latter would have a mass ranging from that of Mercury to the Earth's one and semimajor axis within 100-200 astronomical units. By using realistic upper bounds for the orbital precessions of Saturn, one can get insights on their position which, for Planet Nine, appears approximately confined around its aphelion. Planet Y can be just a Mercury-sized object at no less than about 125 astronomical units, while Planet X appears to be ruled out. Dedicated data reductions by modeling such perturber(s) are required to check the present conclusions, to be intended as hints of what might be detectable should planetary ephemerides include them. A probe on the same route of Voyager 1 would be perturbed by Planet Nine by about 20-40 km after some decades.",
Cross submissions,A structural criterion for asymptotic states in Supersymmetry,"Stefano Bellucci,Stefania De Matteo",High Energy Physics - Theory (hep-th); General Relativity and Quantum Cosmology (gr-qc),"In quantum field theory, the algebraic existence of a field does not guarantee the existence of a corresponding localized asymptotic particle state. This distinction is well established in the presence of infrared effects, long-range correlations, and environmental interactions, and becomes particularly relevant in supersymmetric theories, where fermionic and bosonic degrees of freedom are constrained at the algebraic level but need not share identical asymptotic behavior. In this work we introduce a minimal and predynamical localization criterion that distinguishes algebraically allowed degrees of freedom from those capable of forming stable, phasecoherent asymptotic states. The criterion is formulated in terms of long-time stability under slow structural fluctuations of an effective background, without modifying the underlying field equations or introducing new physical interactions. We show that fermionic and scalar fields respond qualitatively differently to such structural effects. While fermionic modes may retain asymptotic stability, scalar modes generically exhibit decoherence and damping, preventing their interpretation as localized one-particle states. This provides a conservative and model-independent perspective on how supersymmetric algebraic structures may coexist with an asymmetric observable particle spectrum. The analysis is intentionally non-constructive and does not rely on specific supersymmetrybreaking mechanisms, cosmological assumptions, or new dynamical ingredients. Rather, it clarifies localization as an independent structural requirement for particle existence within standard quantum field theory.",
Cross submissions,Replica Phase Transition with Quantum Gravity Corrections,"Jun Nian,Yuan Zhong",High Energy Physics - Theory (hep-th); Strongly Correlated Electrons (cond-mat.str-el); General Relativity and Quantum Cosmology (gr-qc),"Motivated by bulk replica wormholes, we study the boundary effective theory that describes the near-horizon fluctuations of a near-extremal Reissner-Nordström black hole. This theory consists of a Schwarzian mode and a $U(1)$ phase mode. We compute the partition function of this boundary theory on replica geometries, from which the entropy is derived. Our analysis reveals a rich phase structure, in which the dominance of connected or disconnected replica configurations leads to a phase transition controlled by the temperature and the coupling constants $C$, $K$, and $\mathcal{E}$ of the 1d effective theory.",
Cross submissions,Black Hole Interior and Quantum Error Correction with Dynamical Gravity,"Akihiro Miyata,Tomonori Ugajin",High Energy Physics - Theory (hep-th); General Relativity and Quantum Cosmology (gr-qc); Quantum Physics (quant-ph),"According to the island formula, information in the code subspace defined in the black hole interior is embedded in the Hawking radiation after the Page time. At first sight, this embedding suggests that operations acting on the Hawking radiation could modify the information in the code subspace, potentially leading to an apparent violation of causality. Indeed, in previous studies based on the PSSY model, which incorporates only the topological degrees of freedom of gravity, it was shown that when the error is sufficiently large, a violation of causality can arise, as indicated by a nonvanishing mutual information. In this paper, we investigate the situation in which dynamical gravity also acts on the Hawking radiation. In this case, operations on the Hawking radiation induce nontrivial backreaction on the bulk spacetime appearing in the gravitational path integral for the mutual information -- an effect that is absent when the Hawking radiation is non-gravitating. We find that this backreaction renders the relevant mutual information vanishing. This result implies that, in theories with dynamical gravity, the apparent violation of causality is resolved.",
Cross submissions,Detectability and Model Discriminability of the Dark Ages 21 cm Global Signal,"Shintaro Yoshiura,Fumiya Okamatsu,Tomo Takahashi",Cosmology and Nongalactic Astrophysics (astro-ph.CO); General Relativity and Quantum Cosmology (gr-qc); High Energy Physics - Phenomenology (hep-ph),"The 21 cm signal from neutral hydrogen atom is almost the only way to directly probe the Dark Ages. The Dark Ages 21 cm signal, observed at frequencies below 50 MHz, can serve as a powerful probe of cosmology, as the standard cosmological model predicts a well-defined 21 cm spectral shape. In this work, we assess the detectability and model-selection power of 21 cm observations assuming physically motivated foregrounds, optimistic error levels, and several observing strategies for the signals predicted in various cosmological models. Using a Bayesian evidence-based comparison, we find that wide-band observations covering 1-50 MHz can identify the evidence of non-zero 21 cm signals from models considered in this paper except the one with a smooth spectrum that peaks at lower frequencies. In particular, observations below 15 MHz are essential to avoid degeneracies with the foreground. Furthermore, even with observations measured at 5 MHz intervals over the frequency range 1-50 MHz, the 21 cm signal can be identified if the errors are sufficiently small. This indicates that the intrinsic 21 cm spectral shape can be captured without foreground degeneracy even with a limited number of frequency channels.",
Cross submissions,Factorized neural posterior estimation for rapid and reliable inference of parameterized post-Einsteinian deviation parameters in gravitational waves,"Yong-Xin Zhang,Tian-Yang Sun,Chun-Yu Xiong,Song-Tao Liu,Yu-Xin Wang,Shang-Jie Jin,Jing-Fei Zhang,Xin Zhang",Instrumentation and Methods for Astrophysics (astro-ph.IM); Cosmology and Nongalactic Astrophysics (astro-ph.CO); General Relativity and Quantum Cosmology (gr-qc); High Energy Physics - Phenomenology (hep-ph),"The direct detection of gravitational waves (GWs) by LIGO has strikingly confirmed general relativity (GR), but testing GR via GWs requires estimating parameterized post-Einsteinian (ppE) deviation parameters in waveform models. Traditional Bayesian inference methods like Markov chain Monte Carlo (MCMC) provide reliable estimates but suffer from prohibitive computational costs, failing to meet the real-time demands and surging data volume of future GW detectors. Here, we propose a factorized neural posterior estimation framework: we construct independent normalizing flow models for each of the nine ppE deviation parameters and effectively integrate prior information from other source parameters via a conditional embedding network. Leveraging a hybrid neural network with a convolutional neural network and a Residual Neural Network for feature extraction, our method performs rapid and statistically reliable posterior inference directly from binary black hole signals. Compared to conventional MCMC, our approach achieves millisecond-scale inference time with a speedup factor of $9 \times 10^4$. Comprehensive validations show that the posterior estimates pass the Kolmogorov-Smirnov test and achieve empirical coverage probabilities close to theoretical targets. This work demonstrates the great potential of deep learning for GW parameter estimation and provides a viable technical solution for real-time GR tests with next-generation detectors.",
Cross submissions,A single field inflationary potential consistent with recent observations,Md. Wali Hossain,Cosmology and Nongalactic Astrophysics (astro-ph.CO); General Relativity and Quantum Cosmology (gr-qc); High Energy Physics - Theory (hep-th),"Current observations indicate that an inverse exponential form of the inflaton potential provides an excellent description of single-field inflation. This potential fits the SPA$+$BK$+$DESI data sets well with in the $1\sigma$ bound in the $n_{\rm s}$-$r$ plane, thereby offering a simple and observationally viable single field inflationary scenario. To describe post-inflationary evolution and reheating, we extend the inverse exponential potential by adding a steep exponential term that remains negligible during inflation but becomes important afterwards. The resulting full potential develops a minimum after the end of inflation, leading to oscillations of the scalar field and consequently reheating of the Universe. We find that the maximum reheating temperature attainable in this scenario is of order $10^{13}\,\mathrm{GeV}$. The inverse exponential potential therefore emerges as a compelling candidate for early-Universe inflation, combining theoretical simplicity with robust observational viability.",
Cross submissions,Vacuum initial data with minimal decay and borderline decay,"Dawei Shen,Jingbo Wan",Analysis of PDEs (math.AP); General Relativity and Quantum Cosmology (gr-qc); Differential Geometry (math.DG),"In this note, we show that the conical solution-operator method of Mao-Tao in [Localized initial data for Einstein equations] applies to a simple construction of vacuum asymptotically flat initial data at minimal and borderline decay thresholds, corresponding to the global and exterior stability of Minkowski spacetime proved by the first named author in [Global stability of Minkowski spacetime with minimal decay] and [Exterior stability of Minkowski spacetime with borderline decay].",
Cross submissions,Shear subdiffusion in non-relativistic holography,"Yan Liu,Zhi-Ling Wang,Xin-Meng Wu",High Energy Physics - Theory (hep-th); Strongly Correlated Electrons (cond-mat.str-el); General Relativity and Quantum Cosmology (gr-qc),"We study shear fluctuations in non-relativistic holographic systems coupled to torsional Newton-Cartan geometry, using asymptotically Lifshitz spacetimes in Einstein-Maxwell-dilaton gravity. We identify a universal subdiffusive shear mode characterized by the quartic dispersion relation $\omega=-iD_4 k^4$, in sharp contrast to the conventional hydrodynamic diffusion. We derive this result analytically through a systematic higher-order matched asymptotic expansion connecting near-horizon and far-region solutions, and we verify it with direct numerical quasinormal mode calculations. Our numerics demonstrate that the first non-hydrodynamic mode is purely imaginary and gapped, following the dispersion relation $\omega=-i\omega_0-i D k^2$, and that both the hydrodynamic and the first non-hydrodynamic modes pass through pole-skipping points. These results highlight Lifshitz holography as an efficient framework for anomalous transport in strongly coupled non-relativistic quantum matter.",
Cross submissions,Universal Relations and Correlation Analysis of Proto-Neutron Star Properties in Energy-Momentum Squared Gravity,Sayantan Ghosh,Nuclear Theory (nucl-th); General Relativity and Quantum Cosmology (gr-qc); High Energy Physics - Phenomenology (hep-ph),"Proto-neutron stars (PNSs) are the hot, lepton-rich remnants of the core collapse supernovae, which go through a cooling phase and become cold, stable Neutron stars (NSs). Since PNSs are also superdense objects with strong gravitational fields, we can use them to probe general relativity (GR) in the high-curvature regime, similar to NSs. In this study, we analyze the macroscopic properties like mass, radius, compactness, tidal deformability, $f$-mode oscillations and gravitational binding energy of PNSs using four different relativistic mean-field (RMF) equations of state (EOSs) with fixed entropy per baryon ($S$ =1, 2) and varying the lepton fractions ($Y_l$). The variation of $S$ and $Y_l$ has a noticeable effect on these properties. Extending our study beyond GR, we explore these effects within the framework of Energy-Momentum Squared Gravity (EMSG). This modified gravity theory adds the squared energy-momentum terms to the field equations with a free parameter $\alpha$. In the weak-field regimes, EMSG remains indistinguishable from GR, but in the strong-field regimes, such as PNSs or NSs, it shows measurable deviations. Varying the free parameter $\alpha$, we observe significant changes in the macroscopic properties of the PNSs. After that, we focus on the universal relations of the macroscopic properties and the correlations of the universal relations. We find that, despite significant changes in the macroscopic properties induced by the variations of $S$, $Y_l$ and $\alpha$, the correlations remain strong and nearly unaffected.",
Cross submissions,Quantum clock and Newtonian time,"Dorje C. Brody,Lane P. Hughston",Quantum Physics (quant-ph); General Relativity and Quantum Cosmology (gr-qc); Mathematical Physics (math-ph),"An extension of standard quantum mechanics is proposed in which the Newtonian time parameter appearing in the unitary evolution operator is replaced with the time shown by a `quantum clock'. A quantum clock is defined by the following properties: (a) the time that the clock shows is non-decreasing, (b) the clock ticks at random with random tick sizes, and (c) on average the clock shows the Newtonian time. We show that the leading term in the evolution equation for the density matrix associated with any quantum clock model gives the von Neumann equation. Modifications to the von Neumann equation are worked out in detail in a parametric family of examples for which the tick sizes have a gamma distribution. The leading correction to the von Neumann equation is given by the Lindblad equation generated by the Hamiltonian, but there are higher-order terms that generalize the von Neumann equation and the Lindblad equation. Lower bounds on the parameters of these quantum clock models are derived by use of the precision limit of an atomic clock.",
