Heading,Title,Authors,Subjects,Abstract,PDF
New submissions,"Lyapunov Exponents, Phase Transitions, and Chaos Bound of ModMax AdS Black Holes","Gorima Bezboruah,Mozib Bin Awal,Prabwal Phukon",General Relativity and Quantum Cosmology (gr-qc),"We study the thermodynamic phase transition of ModMax anti-de Sitter (AdS) black holes using Lyapunov exponents of massless and massive particles in unstable circular orbits. Our results demonstrate that the thermal profile of the Lyapunov exponent serves as an efficient probe of the black hole's phase structure. We calculate the discontinuity in the Lyapunov exponent across the transition and show that it acts as an order parameter, exhibiting a critical exponent $\delta=1/2$ in the vicinity of the critical point. Furthermore, we explore the violation of the chaos bound, finding that the bound is violated when the horizon radius falls below a threshold value. We also examine how the ModMax parameter and the particle's angular momentum modify this threshold, revealing their role in controlling the onset of chaos bound violation.",
New submissions,Inflation and Dark Energy from Loop Quantum Kaluza-Klein Cosmology,"Shengzhi Li,Yongge Ma,Faqiang Yuan,Xiangdong Zhang",General Relativity and Quantum Cosmology (gr-qc),"The five-dimensional loop quantum Kaluza-Klein cosmology is constructed based on the symmetric reduction of the connection formulation of the full theory. Through semiclassical analysis, the effective scalar constraint for the cosmological model coupled with a dust field is derived, incorporating the quantum fluctuations of geometry as a subleading order correction. It demonstrates that the quantum model has the correct classical limit. The explicit solutions to the equations of motion show that the classical big bang and past big rip singularities in the classical model are avoided by a quantum bounce and a quantum collapse respectively in the effective model. In a particular scenario, the dynamical compactification of the extra dimension is realized, while the observable four-dimensional universe transitions through three distinct epochs: (i) a super-inflationary phase generating 55 e-folds with particular choices of the initial value, (ii) a decelerated expansion era, and (iii) a late-time accelerated expansion phase driven by quantum fluctuations. These results suggest that both cosmic inflation and dark energy may originate from the interplay between the compactified extra dimension and quantum geometric effects.",
New submissions,Thermodynamic and quantum fluctuations of horizon area,G.E. Volovik,General Relativity and Quantum Cosmology (gr-qc); High Energy Physics - Phenomenology (hep-ph),"The event horizon is a source of irreversibility, analogous to statistical irreversibility. This is why for systems with an event horizon there is no difference between quantum and thermal fluctuations. Quantum processes of quantum tunneling determine the thermodynamics of these systems, their temperatures, entropies and fluctuations. We considered three examples of entropy variance that support this point of view: (i) the variance of the area of the black hole horizon, obtained by consideration of quantum fluctuations; (ii) the variance of the entropy of the Hubble volume in the de Sitter state, obtained by consideration of thermal fluctuations; and (iii) the variance of entropy in integers in the Planckon model, determined by the Poisson distribution.",
Cross submissions,Black Hole Critical Collapse in Infinite Dimensions: Continuous Self-Similar Solutions,"Craig R. Clark,Guilherme L. Pimentel",High Energy Physics - Theory (hep-th); General Relativity and Quantum Cosmology (gr-qc),"We investigate the dynamics of black hole critical collapse in the limit of a large number of spacetime dimensions, $D$. In particular, we study the spherical gravitational collapse of a massless, scale-invariant scalar field with continuous self-similarity (CSS). The large number of dimensions provides a natural separation of scales, simplifying the equations of motion at each scale where different effects dominate. With this approximation scheme, we construct matched asymptotic solutions for this family, including the critical solution. We then compute the mass critical exponent of the black hole for linear perturbations that break CSS, finding that it asymptotes to a constant value in infinite dimensions. Additionally, we present a link between these solutions and closed Friedmann--Lemaître--Robertson--Walker (FLRW) cosmologies with a dimension-dependent equation of state and cosmological constant. The critical solution corresponds to an unstable Einstein-like universe, while subcritical and supercritical solutions correspond to bouncing and crunching cosmologies respectively. Our results provide a proof of concept for the large-$D$ expansion as a powerful analytic tool in gravitational collapse and suggest potential extensions to other self-similar systems.",
Cross submissions,On Carrollian and Celestial Correlators in General Dimensions,"Harshal Kulkarni,Romain Ruzziconi,Akshay Yelleshpur Srikant",High Energy Physics - Theory (hep-th); General Relativity and Quantum Cosmology (gr-qc),"Carrollian holography is a framework for flat space holography, suggesting that gravity in asymptotically flat spacetime in $D$ dimensions is dual to a conformal Carrollian field theory in $D - 1$ dimensions living at null infinity. In this work, we elaborate on the definition of Carrollian amplitudes for massless scalar fields in general dimensions and provide explicit expressions for the two-, three-, and four-point functions. We show that these amplitudes naturally arise from Lorentzian holographic correlators in AdS/CFT through a correspondence between the flat space limit in the bulk and the Carrollian limit at the boundary. Finally, we use the relation between Carrollian and celestial holography to derive explicit expressions for celestial amplitudes in $D$ dimensions, which are reinterpreted as correlators of the celestial CFT in $D - 2$ dimensions.",
Cross submissions,Einstein Telescope: Ferromagnetic Shielding for Magnetic Noise Mitigation,"Federico Armato,Barbara Garaventa,Andrea Chincarini",Instrumentation and Detectors (physics.ins-det); General Relativity and Quantum Cosmology (gr-qc),"The Einstein Telescope is the next-generation gravitational wave interferometer which, compared to current detectors, will enable the observation of gravitational signals at lower frequencies with a sensitivity improved by approximately two orders of magnitude. Achieving such exceptional sensitivity requires minimizing all sources of noise. In the low-frequency regime, magnetic noise is one of the dominant. This article examines the effectiveness and limitations of a passive mitigation technique: ferromagnetic shielding.",
Cross submissions,Primordial Gravitational Waves in Parity-violating Symmetric Teleparallel Gravity,"Rongrong Zhai,Chengjie Fu,Xiangyun Fu,Puxun Wu,Hongwei Yu",Cosmology and Nongalactic Astrophysics (astro-ph.CO); General Relativity and Quantum Cosmology (gr-qc); High Energy Physics - Phenomenology (hep-ph),"In this paper, we investigate the inflationary phenomenology of parity-violating (PV) extensions of symmetric teleparallel gravity by applying this PV gravity theory to axion inflation. The presence of PV terms induces velocity birefringence in the tensor perturbations. During inflation, when the inflaton rapidly traverses the cliff-like region in its potential, the tensor modes at specific scales for one of the two circular polarization states undergo significant amplification due to tachyonic instability. Consequently, the resulting primordial gravitational waves (GWs), characterized by a one-handed polarization and a multi-peak structure in their energy spectrum, exhibit a significant amplitude potentially detectable by LISA and Taiji, and their chirality could be determined by the LISA-Taiji network. The detection of such a chiral GW signal provides an opportunity to probe inflation and PV gravity theory.",
Cross submissions,The 300 TeV photon from GRB 221009A: a Hint at Non-linear Lorentz Invariance Violation?,"Dmitry D. Ofengeim,Tsvi Piran",High Energy Astrophysical Phenomena (astro-ph.HE); General Relativity and Quantum Cosmology (gr-qc); High Energy Physics - Phenomenology (hep-ph),"The air shower array Carpet-3 detected a 300 TeV photon from the direction of GRB 221009A at 4536 s after the Fermi-GBM trigger for this event. If the association with this gamma-ray burst is real, it poses two puzzles. First, why was this photon not absorbed by the extragalactic background light? ``New physics'' beyond the Standard Model is required to explain how it managed to reach Earth from a cosmological distance. Second, why was this photon detected when the VHE afterglow observed by LHAASO already faded? A novel astrophysical mechanism is required to explain this delay. In this work we show that Lorentz invariance violation (LIV), which arises as a low-energy limit of certain quantum gravity theories, can solve both puzzles. It shifts thresholds of particle interaction and changes the opacity of the extragalactic background, and cause energy-dependent variations of the photon velocity, which changes the photon time of flight. We investigate the LIV parameter space assuming that the 300 TeV photon is a part of the VHE afterglow detected by LHAASO in the TeV range. We identify viable solutions and place stringent two-sided constraints on the LIV energy scale required to resolve the observational puzzles. First-order LIV appears to be incompatible with the constraints set by analyzing the TeV afterglow of this GRB. Viable solutions emerge for higher orders. In particular, the commonly studied second-order subluminal LIV with $E_{\rm LIV2} = 1.30_{-0.35}^{+0.56} \times 10^{-7} E_{\rm Pl}$ (95.4% credibility level; $E_{\rm Pl}$ is the Planck energy) is consistent with all the observed data.",
Cross submissions,Information in quantum field theory simulators: Thin-film superfluid helium,"Maciej T. Jarema,Cameron R. D. Bunney,Vitor S. Barroso,Mohammadamin Tajik,Chris Goodwin,Silke Weinfurtner",Quantum Physics (quant-ph); General Relativity and Quantum Cosmology (gr-qc),"Understanding quantum correlations through information-theoretic measures is fundamental to developments in quantum field theory, quantum information, and quantum many-body physics. A central feature in a plethora of systems is the area law, under which information scales with the size of the boundary of the system, rather than volume. Whilst many systems and regimes exhibiting an area law have been identified theoretically, experimental verification remains limited, particularly in continuous systems. We present a methodology for measuring mutual information in an experimental simulator of non-interacting quantum fields, and propose using the analogue $(2 + 1)$-dimensional spacetime offered by thin films of superfluid helium. We provide numerical predictions incorporating the natural thermal state of the helium sample that exemplify an area-law scaling of mutual information, and characterise deviations attributable to the inherent finite system size.",
Cross submissions,Signature of polarized ultralight vector dark matter in pulsar timing arrays,"Kimihiro Nomura,Hidetoshi Omiya,Takahiro Tanaka",Cosmology and Nongalactic Astrophysics (astro-ph.CO); General Relativity and Quantum Cosmology (gr-qc); High Energy Physics - Phenomenology (hep-ph),"We investigate observational signatures of ultralight vector dark matter with masses $m \sim 10^{-24}$-$10^{-22}$ eV in pulsar timing arrays, taking into account general polarization states of the vector field. We find that vector dark matter induces pulsar timing residuals with nontrivial directional dependence, reflecting the anisotropic property and polarization structure specific to vector dark matter, unlike scalar dark matter. We also derive angular correlation curves of the timing residuals. Intriguingly, circular polarization of the vector dark matter enhances the quadrupole nature of the correlation curve, resulting in a more notable bending of the Hellings-Downs curve. The derived correlation curves offer a useful means to distinguish gravitational wave and dark matter contributions and to probe the nature of dark matter.",
Cross submissions,Preheating and gravitational waves in large-field hilltop inflation,"Diganta Das,Shreyas Revankar",Cosmology and Nongalactic Astrophysics (astro-ph.CO); General Relativity and Quantum Cosmology (gr-qc); High Energy Physics - Phenomenology (hep-ph),"The combined Planck, BICEP/Keck Array and BAO measurements of the scalar spectral index and the tensor-to-scalar ratio from the cosmic microwave background observations severely constrain or completely rule out several models of inflationary potentials. On the other hand, the data seems to favor concave potentials over convex ones. In this paper, we study preheating and gravitational waves after inflation in a large-field, regularized hilltop potential where inflation takes place in the concave plateau. The inflaton, $\phi$, is coupled to a subdominant scalar field, $\chi$, through a quartic coupling. After inflation ends, $\phi$ oscillates about the potential minimum and becomes inhomogeneous. The growth of the fluctuation modes, $\delta\phi_k$ and $\delta\chi_k$, in a homogeneous, oscillating background is analyzed in linear perturbation theory, revealing that small modes likely experience broad self-resonance or external parametric resonance. To determine if the resonances are sufficiently strong to cause unstable growth of the modes we perform a lattice simulation. The lattice simulations demonstrate that, although the initial inhomogeneities generate a stochastic gravitational wave background that remains below the present observational limit, the fluctuations do not grow exponentially, and the occupation numbers of $\delta\phi_k$ and $\delta\chi_k$ remain close to zero.",
Cross submissions,Holographic AME states in black hole interiors,"Takanori Anegawa,Kotaro Tamaoka",High Energy Physics - Theory (hep-th); General Relativity and Quantum Cosmology (gr-qc),"We argue that the special extremal slice inside an AdS black hole is dual to an absolutely maximally entangled (AME) state. We demonstrate this by confirming the $n$-independence of holographic $n$-th Renyi entropies for any bi-partite subsystems. Our result gives an AME state in an infinite-volume system, where the local bond dimension is set by the black hole entropy. In particular, our construction provides concrete support from the gravity side for the emergence of random structures and an infinite-dimensional Hilbert space in recent non-isometric holographic codes.",
Cross submissions,Sagnac and Mashhoon effects in graphene,"Yu.V. Shtanov,T.-H.O. Pokalchuk,S.G. Sharapov",Mesoscale and Nanoscale Physics (cond-mat.mes-hall); General Relativity and Quantum Cosmology (gr-qc); Quantum Physics (quant-ph),"We investigate the Sagnac and Mashhoon effects in graphene, taking into account both the pseudospin and intrinsic spin of electrons, within a simplified model of a rotating nanotube or infinitesimally narrow ring. Based on considerations of the relativistic phase of the wave function and employing the effective Larmor theorem, we demonstrate that the Sagnac fringe shift retains a form analogous to that for free electrons, governed by the electron's vacuum mass. In the case of a narrow ring, an additional $\pi$-phase shift arises due to the Berry phase associated with the honeycomb graphene lattice. The Mashhoon fringe shift, which characterizes the dynamics of intrinsic spin, retains its conventional form in graphene, with its dependence on the Fermi velocity. Our analysis highlights both the similarities and differences between spin and pseudospin degrees of freedom in graphene.",
Cross submissions,Information Transport in Classic-Quantum Hybrid System,"Julian Rapp,Radhika H. Joshi,Alwin van Steensel,Yuli V. Nazarov,Mohammad H. Ansari",Quantum Physics (quant-ph); Mesoscale and Nanoscale Physics (cond-mat.mes-hall); General Relativity and Quantum Cosmology (gr-qc); High Energy Physics - Theory (hep-th); Mathematical Physics (math-ph),"Many important quantities in quantum information science, such as entropy and entanglement, are non-linear functions of the density matrix and cannot be expressed as operator observables. Standard open-system approaches evolve only a single copy of the density matrix, making it impossible to track the dynamics of such quantities. A formalism proposed by some of the present authors addressed this challenge by evolving multiple virtual replicas, but was limited to the weak-coupling regime. Here, we extend this approach to strong coupling between a quantum system and classical environments. The resulting multi-replica master equation enables direct evaluation of entropy flow and related metrics in strongly hybridized quantum-classical systems. Our results show that quantum coherence and hybridization jointly suppress net entropy transfer, creating a thermodynamic bottleneck. This framework provides a general tool for studying entropy dynamics and guiding the design of more robust, resource-efficient quantum hardware.",
Cross submissions,Gravitational Wave Signatures of Quasi-Periodic Eruptions: LISA Detection Prospects for RX J1301.9+2747,"Leif Lui,Alejandro Torres-Orjuela,Rudrani Kar Chowdhury,Lixin Dai",High Energy Astrophysical Phenomena (astro-ph.HE); General Relativity and Quantum Cosmology (gr-qc),"One prominent model for quasi-periodic eruptions (QPEs) is that they originate from extreme mass-ratio inspirals (EMRIs) involving stellar-mass objects orbiting around massive black holes and colliding with their accretion disks. We compute the gravitational wave signals from such a model, demonstrating that orbiter-disk interactions result in small frequency shifts and high-frequency tails due to the excitation of non-discrete modes. Interestingly, we show that QPE RX J1301.9+2747 could be detectable by future space-based gravitational wave detectors, provided a moderate eccentricity around $0.25$ and a mass exceeding $35\,M_\odot$ for the orbiter. Moreover, based on this QPE model, we show that the signal-to-noise ratio of the gravitational wave signals from QPEs, if detectable, will be sufficiently high to distinguish such systems from vacuum EMRIs and shed light on the origin of QPEs and environments around massive black holes.",
Cross submissions,Probing gravity beyond general relativity with bispectrum multipoles of cosmological tracers: I. Theoretical Foundations,Sukhdeep Singh Gill,Cosmology and Nongalactic Astrophysics (astro-ph.CO); Astrophysics of Galaxies (astro-ph.GA); General Relativity and Quantum Cosmology (gr-qc),"The bispectrum, being sensitive to non-Gaussianity and mode coupling of cosmological fields induced by non-linear gravitational evolution, serves as a powerful probe for detecting deviations from General Relativity (GR). The signatures of modified gravity in the bispectrum are even more pronounced in redshift space, where anisotropies from peculiar velocities provide unbiased information on higher-order properties of gravity. We investigate the potential of all non-zero angular multipoles $B_l^m$ of redshift space bispectrum across all possible triangle configurations to probe degenerate higher-order scalar tensor (DHOST) theory. We show that the higher-order multipoles of the bispectrum with $l=2,4,6$ are more sensitive to the modifications in gravity than the spherically averaged monopole moment $l=0$. These multipoles demonstrate remarkable sensitivity to the higher-order growth history, which varies across triangle configurations, with acute triangles generally being the most sensitive to modification in GR. The values of various multipoles exhibit opposite signs in modified gravity compared to those predicted in GR, which serves as a robust indicator of the deviation from GR. We demonstrate that, unlike $l=2$ and $4$ multipoles, the $l=6$ multipoles with $m\leq 4$ are not affected by the quadratic bias and second-order tidal bias parameters, emphasising the need to leverage their capabilities in analyses. The $(l=6, m > 4)$ multipoles fail to capture the second-order growth, while all $l=8$ multipoles lack any independent information regarding modified gravity in both linear and nonlinear regimes.",
Cross submissions,Parametrizing the Hubble function instead of dark energy: Many possibilities,"Sivasish Paul,Raj Kumar Das,Supriya Pan",Cosmology and Nongalactic Astrophysics (astro-ph.CO); General Relativity and Quantum Cosmology (gr-qc),"In the present article, we propose a very simple parametrization of the Hubble function without parametrizing the dark components of the Universe. One of the novelties of the parametrization is that it may include a wide variety of the cosmological models, such as dark energy (both noninteracting and interacting fluids), modified gravity, cosmological matter creation and other known scenarios. The model is constrained with the latest astronomical probes from Hubble parameter measurements, three distinct versions of Type Ia Supernovae (Pantheon+, DESY5, Union3) and baryon acoustic oscillations from Sloan Digital Sky Survey and Dark Energy Spectroscopic Instrument data releases 1 and 2. Our results suggest a mild deviation from the standard $\Lambda$CDM cosmological model for most of the combined datasets. We also find that our model is thermodynamically consistent and performs well in the model comparison tests.",
Cross submissions,Gravitational Waves from Strongly Magnetized Eccentric Neutron Star Binaries,"R. Prasad,Anushka Doke,Prayush Kumar",High Energy Astrophysical Phenomena (astro-ph.HE); General Relativity and Quantum Cosmology (gr-qc),"We study the imprint of magnetic fields on gravitational waves emitted during the inspiral phase of eccentric binary neutron star systems. While observations indicate that neutron stars typically exhibit strong magnetic fields in the range of $10^{14}$-$10^{15}\,\mathrm{G}$, theoretical models allow for fields as high as $ \sim 10^{17-18}\,\mathrm{G}$. In binaries, the fate of these fields depends on the formation pathway: in systems formed through isolated evolution, magnetic fields may decay over long inspiral timescales. In contrast, binaries formed via dynamical capture can retain substantial eccentricity and strong fields until merger, potentially altering the gravitational waveform. We consider two magnetic effects: magnetic interaction between the neutron stars and electromagnetic radiation from the system's effective dipole, and identify regimes where each dominates. Using a perturbative framework, we compute the associated energy loss and gravitational wave phase evolution. We find that for binaries with strong and comparable magnetic fields, $10^{14}\,\mathrm{G}$ fields may be detectable up to $\sim 10 \, \mathrm{Mpc}$ with DECIGO and the Einstein Telescope, while $10^{15}\,\mathrm{G}$ fields extend the reach to several hundred Mpc. For extreme fields of $10^{16}\,\mathrm{G}$, third-generation detectors could be sensitive out to Gpc scales. In contrast, LIGO is limited to galactic distances: $10^{15}\,\mathrm{G}$ fields are detectable only within $\sim 100\,\mathrm{kpc}$, and only ultrastrong fields ($\sim 10^{16}$-$10^{17}\,\mathrm{G}$) are potentially observable at Gpc distances. In highly asymmetric systems, where dipole radiation dominates, the gravitational wave dephasing is significantly suppressed, reducing the detection horizon. These findings suggest that current and future gravitational wave observatories may be capable of identifying magnetized binary systems.",
Cross submissions,Closing the Mass Window for Stupendously Large Black Holes,"Christopher Gerlach,Yann Gouttenoire,Antonio J. Iovino,Nicholas Leister",Cosmology and Nongalactic Astrophysics (astro-ph.CO); General Relativity and Quantum Cosmology (gr-qc); High Energy Physics - Phenomenology (hep-ph),"We show that primordial black holes (PBHs) in the $\textit{Stupendously Large Black Hole}$ mass range ($M \gtrsim 10^{11}\,M_\odot$) produce isocurvature perturbations exceeding current $\textit{Planck}$ Cosmic Microwave Background limits, thereby excluding them as a significant dark matter component.",
