Heading,Title,Authors,Subjects,Abstract,PDF
New submissions,GW231123: Binary Black Hole Merger or Cosmic String?,"Iuliu Cuceu,Marie Anne Bizouard,Nelson Christensen,Mairi Sakellariadou",General Relativity and Quantum Cosmology (gr-qc); Cosmology and Nongalactic Astrophysics (astro-ph.CO),"The LIGO-Virgo-KAGRA Collaboration recently reported an exceptional gravitational-wave event, GW231123. This gravitational-wave signal was assumed to be generated from the merger of a binary black hole system, with source frame masses of $137^{+22}_{-17}~\textup{M}_\odot$ and $103^{+20}_{-52}~ \textup{M}_\odot$ (90\% credible intervals). As seen by the two LIGO detectors, the signal has only $\sim 5$ cycles, between 30 and 80 Hz, over $\sim 10$ ms. It is of critical importance to confirm the origin of this signal. Here we present the results of a Bayesian model comparison to test whether the gravitational-wave signal was actually generated by a binary black hole merger, or emitted from cusps or kinks on a cosmic string. We find significant evidence for a binary black hole merger origin of the signal.",
New submissions,Ultralight boson constraints from gravitational wave observations of spinning binary black holes,"P.S. Aswathi,William E. East,Nils Siemonsen,Ling Sun,Dana Jones",General Relativity and Quantum Cosmology (gr-qc); High Energy Astrophysical Phenomena (astro-ph.HE); High Energy Physics - Phenomenology (hep-ph),"In the presence of an ultralight scalar or vector boson, a spinning black hole will be spun down through the superradiant instability. We use spin measurements from gravitational wave observations of binary black holes, in particular the heavy binary black hole merger event GW231123, along with the lower-mass GW190517 event, to constrain the existence of ultralight bosons. We disfavor scalars with masses in the range of $[0.55, 11]\times 10^{-13}$ eV and vectors in the range of $[0.11, 18]\times 10^{-13}$ eV, making only a conservative assumption that the black hole lifetimes are greater than $10^5$ years. The lower ends of these ranges, where the exclusion confidence is the highest, were not previously excluded by spin measurements from electromagnetic or gravitational wave observations. We map these constraints to axion and dark photon models with interactions.",
New submissions,Heat Capacity and the Violation of Scaling Laws in Gravitational System,Shi-Bei Kong,General Relativity and Quantum Cosmology (gr-qc); High Energy Physics - Theory (hep-th),"In this paper, we examine the scaling laws in gravitational system from the perspective of free energy landscape. It has been found that for some special black holes, their critical exponents are beyond mean field theory, and more surprisingly violate the scaling laws. We find that the main reason for the violation of the scaling laws is that the heat capacity at constant volume for these black holes is 0, so the critical exponent $\alpha$ is often treated as 0 and can not be derived from the scaling hypothesis while another three critical exponents can. We also find that the strange critical exponents means there is a symmetry violation in the order parameter.",
Cross submissions,Dark energy constraints in light of theoretical priors,"Neel Shah,Kazuya Koyama,Johannes Noller",Cosmology and Nongalactic Astrophysics (astro-ph.CO); General Relativity and Quantum Cosmology (gr-qc); High Energy Physics - Theory (hep-th),"In order to derive model-independent observational bounds on dark energy/modified gravity theories, a typical approach is to constrain parametrised models intended to capture the space of dark energy theories. Here we investigate in detail the effect that the nature of these parametrisations can have, finding significant effects on the resulting cosmological dark energy constraints. In order to observationally distinguish well-motivated and physical parametrisations from unphysical ones, it is crucial to understand the theoretical priors that physical parametrisations place on the phenomenology of dark energy. To this end we discuss a range of theoretical priors that can be imposed on general dark energy parametrisations, and their effect on the constraints on the phenomenology of dynamical dark energy. More specifically, we investigate both the phenomenological $\{\mu,\Sigma\}$ parametrisation as well as effective field theory (EFT) inspired approaches to model dark energy interactions. We compare the constraints obtained in both approaches for different phenomenological and theory-informed time-dependences for the underlying functional degrees of freedom, discuss the effects of priors derived from gravitational wave physics, and investigate the interplay between constraints on parameters constraining only the background evolution vs. parameters controlling linear perturbations.",
Cross submissions,Timelike entanglement and central charge for quantum BTZ black holes,Dibakar Roychowdhury,High Energy Physics - Theory (hep-th); General Relativity and Quantum Cosmology (gr-qc),"We compute holographic timelike entanglement entropy for quantum BTZ black holes in a Karch-Randall braneworld scenario. These black holes are exact solutions of massive 3d gravity on the brane and are conjectured to be dual to thermal states in 2d defect CFTs, living at the interface of the brane and the boundary of the bulk $AdS_4$. Our analysis reveals an interesting relation between the tEE and the central charge pertaining to the dual CFT, which receives nontrivial corrections due to quantum backreaction effects on the Karch-Randall brane, which is explored non-perturbatively.",
Cross submissions,Constraints on extra charges in dyonic Kerr-Newman-Kasuya-Taub-NUT black hole from the observations of quasi-periodic oscillations,"Hamza Rehman,Saddam Hussain,Ghulam Abbas,Tao Zhu",High Energy Astrophysical Phenomena (astro-ph.HE); General Relativity and Quantum Cosmology (gr-qc),"This paper investigates the influence of the dimensionless electric charge ($Q/M$), magnetic charge ($P/M$), and Taub-NUT parameter ($n/M$) of a dyonic Kerr-Newman-Kasuya-Taub-NUT black hole on quasi-periodic oscillations (QPOs) observed in X-ray binaries. Using the relativistic precession model, we calculate the three fundamental frequencies arising from particle motion in the accretion disk around the black hole. These theoretical predictions are then confronted with observational QPO data from five X-ray binaries (GRO J1655-40, XTE J1859$+$226, XTE J1550-564, GRS 1915$+$105, and H1743-322), and the Markov Chain Monte Carlo technique is used to constrain the black hole parameters. Our analysis reveals no significant evidence for nonzero values of $Q/M$ and $P/M$ across all sources, thereby allowing us to place several stringent upper limits on electric charge ($Q/M$) and magnetic charge ($P/M$) of the black hole in these systems. Similarly, no compelling indication of a nonzero Taub-NUT parameter is found in QPOs from GRO J1655-40, XTE J1859$+$226, XTE J1550-564, and H1743-322. In contrast, the posterior distribution derived from GRS 1915$+$105 data suggests a nonzero Taub-NUT parameter, i.e., gravitomagnetic monopole moment. This result indicates a potential deviation from the Kerr metric in this astrophysical black hole.",
Cross submissions,Binary Neutron Star Mergers: Multi-Messenger Systematics and Prospects with Next-Generation Facilities,"Nathan Steinle,Samar Safi-Harb,Matt Nicholl,Isabelle Worssam,Benjamin P. Gompertz",High Energy Astrophysical Phenomena (astro-ph.HE); Cosmology and Nongalactic Astrophysics (astro-ph.CO); General Relativity and Quantum Cosmology (gr-qc),"Multi-messenger astronomy was galvanized by the detection of gravitational waves (GWs) from the binary neutron star (BNS) merger GW170817 and electromagnetic (EM) emission from the subsequent kilonova and short gamma ray burst. Maximizing multi-messenger constraints on these systems requires combining models of the progenitors and products of BNS mergers within a single framework in anticipation of future GW and EM detectors. We demonstrate how combining models of different aspects of the BNS progenitor-merger-remnant system into a full multi-messenger modeling pipeline reveals insight into modeling challenges that will need to be addressed in the coming decade of multi-messenger astronomy. Motivated by GW170817, this combined model relates the progenitor astrophysics of a BNS population with their GW observability and localizability, kilonova light curves, gamma-ray burst afterglow flux, and kilonova remnant evolution. We find joint correlations between the GW and EM observables that depend on a complicated interplay between modeling assumptions and theoretical uncertainties. Next generation detectors will generically provide multi-messenger constraints on BNSs with median GW network signal-to-noise ratio $\approx 10$, median of the 90$^{\rm th}$ percentile sky area $\approx 10$ sq. deg., and kilonova $i$-band apparent magnitudes ranging from $\approx 33$ to $23$. We find no more than 4\% of the BNSs are simultaneously detectable by a network of two Cosmic Explorers and one Einstein Telescope and by the Roman and Rubin telescopes for 55 and 180 sec. exposures in a $K$-like band and $i$ and $g$ bands, respectively. We discuss key modeling assumptions that will be transmitted as multi-messenger systematics in the analysis of future datasets, such as uncertain astrophysical processes of binary populations and the nuclear equation of state for tests of nuclear physics and dark matter.",
Cross submissions,Quasi-topological mass generation for 3D linearized gravity,"Erica Bertolini,Edoardo Lui,Nicola Maggiore",High Energy Physics - Theory (hep-th); General Relativity and Quantum Cosmology (gr-qc),"We present a new mass generation mechanism for linearized gravity in three spacetime dimensions, which consists of a lower-dimensional Chern-Simons-like term added to the invariant action. The propagators of the gauge fixed massive action show a massive pole and a good massless limit. Moreover, we show that, as the Topological Massive Gravity model of Deser, Jackiw and Templeton, this theory displays one propagating massive DoF, which can be traced back to the transverse part of the spatial Ricci tensor. Finally, the action of this linearized massive gravity is characterized by an algebraic structure formed by a set of Ward operators, which uniquely determine the theory.",
Cross submissions,Fiducial observers and the thermal atmosphere in the black hole quantum throat,"Thomas G. Mertens,Thomas Tappeiner,Bruno de S. L. Torres",High Energy Physics - Theory (hep-th); General Relativity and Quantum Cosmology (gr-qc),"We propose a construction of fiducial observers in the throat region of near-extremal black holes within the framework of JT quantum gravity, leading to a notion of local observers in a highly quantum regime of the gravitational field. The construction is based on an earlier proposal for light-ray anchoring to the asymptotic boundary and is uniquely fixed at the semiclassical level by demanding that the notion of time translations for an observer at the asymptotic boundary of JT gravity should be extended into the bulk as the flow of a conformal isometry. Since conformal isometries are a necessary condition for geometric modular flow, our construction is amenable as a candidate geometric gravitational dressing that may be interpreted via the modular crossed product, potentially connecting our choice of dressing with recent developments on the literature on local observables in quantum gravity. Taking this definition beyond the semiclassical regime, we compute quantum gravitational wormhole contributions to the black hole thermal atmosphere, directly producing a finite thermal entropy and leading to a quantum description of the stretched horizon in this model.",
