Heading,Title,Authors,Subjects,Abstract,PDF
New submissions,Probing Ultralight Axion-like Dark Matter $-$ A PTA-PPA Synergy,"Ximeng Li,Yonghao Liu,Zu-Cheng Chen,Shi Dai,Boris Goncharov,Xiao-Song Hu,Qing-Guo Huang,Tao Liu,Jing Ren,Yu-Mei Wu,Xiao Xue,Xingjiang Zhu",Cosmology and Nongalactic Astrophysics (astro-ph.CO); High Energy Astrophysical Phenomena (astro-ph.HE); High Energy Physics - Phenomenology (hep-ph),"Ultralight axion-like dark matter (ALDM) is a leading candidate in the dark matter realm, characterized by its prominent wave properties on astronomical scales. Pulsar Timing Arrays (PTAs) and Pulsar Polarization Arrays (PPAs) aim to detect this dark matter through timing and polarization measurements, respectively, of pulsars. The PTA relies on gravitational effects, as the ALDM halo perturbs the spacetime metric within the Milky Way, while the PPA detects non-gravitational effects, namely cosmological birefringence induced by the ALDM Chern-Simons coupling with photons. These two methods complement each other, synergistically enhancing the pulsar array's capability to identify the ALDM signals in the data. In this article, we provide a foundational development of this synergy. We begin by revisiting previously derived two-point correlation functions for both PTA and PPA, and expand our analysis to include correlations between timing and polarization signals. We then construct likelihood functions for PTA and combined PTA-PPA analyses within a Bayesian framework, aimed at detecting the characteristic correlations of ALDM signals. We emphasize the non-Gaussianity of the ALDM timing signals, which arises from their non-linear dependence on the field, in contrast to the Gaussian nature of its polarization signals. To address the complexities introduced, we approach this investigation in two ways: one involves a Gaussian approximation with proper justifications, while the other derives the formalism from the generic Gaussian characteristics of the ALDM field. We anticipate that these efforts will lead to further developments in PTA and PTA-PPA analysis methods.",
New submissions,Learning Balanced Field Summaries of the Large-Scale Structure with the Neural Field Scattering Transform,"Matthew Craigie,Yuan-Sen Ting,Rossana Ruggeri,Tamara M. Davis",Cosmology and Nongalactic Astrophysics (astro-ph.CO),"We present a cosmology analysis of weak lensing convergence maps using the Neural Field Scattering Transform (NFST) to constrain cosmological parameters. The NFST extends the Wavelet Scattering Transform (WST) by incorporating trainable neural field filters while preserving rotational and translational symmetries. This setup balances flexibility with robustness, ideal for learning in limited training data regimes. We apply the NFST to 500 simulations from the CosmoGrid suite, each providing a total of 1000 square degrees of noiseless weak lensing convergence maps. We use the resulting learned field compression to model the posterior over $\Omega_m$, $\sigma_8$, and $w$ in a $w$CDM cosmology. The NFST consistently outperforms the WST benchmark, achieving a 16% increase in the average posterior probability density assigned to test data. Further, the NFST improves direct parameter prediction precision on $\sigma_8$ by 6% and w by 11%. We also introduce a new visualization technique to interpret the learned filters in physical space and show that the NFST adapts its feature extraction to capture task-specific information. These results establish the NFST as a promising tool for extracting maximal cosmological information from the non-Gaussian information in upcoming large-scale structure surveys, without requiring large simulated training datasets.",
New submissions,Learning Intrinsic Alignments from Local Galaxy Environments,"Matthew Craigie,Eric Huff,Yuan-Sen Ting,Rossana Ruggeri,Tamara M. Davis",Cosmology and Nongalactic Astrophysics (astro-ph.CO),"We present DELTA (Data-Empiric Learned Tidal Alignments), a deep learning model that isolates galaxy intrinsic alignments (IAs) from weak lensing distortions using only observational data. The model uses an Equivariant Graph Neural Network backbone suitable for capturing information from the local galaxy environment, in conjunction with a probabilistic orientation output. Unlike parametric models, DELTA flexibly learns the relationship between galaxy shapes and their local environments, without assuming an explicit IA form or relying on simulations. When applied to mock catalogs with realistic noisy IAs injected, it accurately reconstructs the noise-free, pure IA signal. Mapping these alignments provides a direct visualization of IA patterns in the mock catalogs. Combining DELTA with deep learning interpretation techniques provides further insights into the physics driving tidal relationships between galaxies. This new approach to understanding and controlling IAs is suitable for application to joint photometric and spectroscopic surveys such as the combination of upcoming Euclid, Rubin, and DESI datasets.",
New submissions,The Hourglass Simulation: A Catalog for the Roman High-Latitude Time-Domain Core Community Survey,"B. M. Rose,M. Vincenzi,R. Hounsell,H. Qu,L. Aldoroty,D. Scolnic,R. Kessler,P. Macias,D. Brout,M. Acevedo,R. C. Chen,S. Gomez,E. Peterson,D. Rubin,M. Sako",Instrumentation and Methods for Astrophysics (astro-ph.IM); Cosmology and Nongalactic Astrophysics (astro-ph.CO); High Energy Astrophysical Phenomena (astro-ph.HE),"We present a simulation of the time-domain catalog for the Nancy Grace Roman Space Telescope's High-Latitude Time-Domain Core Community Survey. This simulation, called the Hourglass simulation, uses the most up-to-date spectral energy distribution models and rate measurements for ten extra-galactic time-domain sources. We simulate these models through the design reference Roman Space Telescope survey: four filters per tier, a five day cadence, over two years, a wide tier of 19 deg$^2$ and a deep tier of 4.2 deg$^2$, with $\sim$20% of those areas also covered with prism observations. We find that a science-independent Roman time-domain catalog, assuming a S/N at max of >5, would have approximately 21,000 Type Ia supernovae, 40,000 core-collapse supernovae, around 70 superluminous supernovae, $\sim$35 tidal disruption events, 3 kilonovae, and possibly pair-instability supernovae. In total, Hourglass has over 64,000 transient objects, 11 million photometric observations, and 500,000 spectra. Additionally, Hourglass is a useful data set to train machine learning classification algorithms. We show that SCONE is able to photometrically classify Type Ia supernovae with high precision ($\sim$95%) to a z > 2. Finally, we present the first realistic simulations of non-Type Ia supernovae spectral-time series data from Roman's prism.",
Cross submissions,Can the universe experience an AdS landscape since matter-radiation equality?,"Hao Wang,Yun-Song Piao",General Relativity and Quantum Cosmology (gr-qc); Cosmology and Nongalactic Astrophysics (astro-ph.CO); High Energy Physics - Theory (hep-th),"Though an anti-de Sitter (AdS) vacuum, corresponding to a negative cosmological constant (NCC), can be not responsible for the acceleration of current universe, it might coexist with one evolving positive dark energy component at low redshift, as well as with early dark energy around the recombination to solve the Hubble tension. In this paper, we investigate the scenario with one AdS vacuum around the recombination and one at low redshift, and from both current observational and theoretical perspectives preliminarily explore the possibility that the universe experienced a landscape with multiple AdS vacua since matter-radiation equality.",
Cross submissions,Discretely Evanescent Dark Energy,Nemanja Kaloper,High Energy Physics - Theory (hep-th); Cosmology and Nongalactic Astrophysics (astro-ph.CO); General Relativity and Quantum Cosmology (gr-qc); High Energy Physics - Phenomenology (hep-ph),"We propose a new UV-complete dark energy model which is \underbar{\it neither} a cosmological constant nor a slowly rolling scalar field. Our dark energy is the flux of a top form in a hidden sector gauge theory similar to QCD. The top form controls the vacuum energy generated by dark sector CP violation. Its flux discharges by the nucleation of membranes that source it. The tension and charge of the membranes are set by the chiral symmetry breaking scale $\sim 10^{-3} eV$, and the dark energy is a transient. It decays on the order of the current age of the universe. The decays decrease dark energy discretely and randomly, instead of gradually like rolling scalars. Since the decay rate is close to the present Hubble scale, $\Gamma \ga H_0^4$, in a time $\sim {\cal O}(1/H_0)$ the cosmic acceleration may even cease altogether.",
Cross submissions,Secluded Dark Composites and Remnant Binding Fields,"Katarina Bleau,Yilda Boukhtouchen,Joseph Bramante,Rohan Kulkarni",High Energy Physics - Phenomenology (hep-ph); Cosmology and Nongalactic Astrophysics (astro-ph.CO); High Energy Physics - Theory (hep-th),"Dark matter may freeze-out and undergo composite assembly while decoupled from the Standard Model. In this secluded composite scenario, while individual dark matter particles may be too weakly-coupled to detect, the assembled composite can potentially be detected since its effective coupling scales with number of constituents. We examine models and observables for secluded composites, and in particular we investigate the cosmological abundance of the composite binding field, which is generated during freeze-out annihilation and secluded composite assembly. This binding field could be discovered as a new relativistic species in the early universe or through later interactions as a subdominant dark component.",
Cross submissions,Non-perturbative determination of the sphaleron rate for first-order phase transitions,"Jaakko Annala,Kari Rummukainen,Tuomas V.I. Tenkanen",High Energy Physics - Phenomenology (hep-ph); Cosmology and Nongalactic Astrophysics (astro-ph.CO); High Energy Physics - Lattice (hep-lat),"In many extensions of the Standard Model electroweak phase transitions at high temperatures can be described in a minimal dimensionally reduced effective theory with SU(2) gauge field and fundamental Higgs scalar. In this effective theory, all thermodynamic information is governed by two dimensionless ratios $x \equiv \lambda_3/g^2_3$ and $y\equiv m^2_3/g^4_3$, where $\lambda_3$, $m^2_3$ and $g_3$ are the effective thermal scalar self-interaction coupling, the thermal mass and the effective gauge-coupling, respectively. By using non-perturbative lattice simulations to determine the rate of sphaleron transitions in the entire $(x,y)$-plane corresponding to the Higgs phase, and by applying previous lattice results for the bubble nucleation, we find a condition $x(T_c) \lesssim 0.025$ to guarantee preservation of the baryon asymmetry, which translates to $v/T_c \equiv \sqrt{2 \langle \phi^\dagger \phi \rangle}/T_c \gtrsim 1.33$ for the (gauge-invariant) Higgs condensate. This indicates that viability of the electroweak baryogenesis requires the phase transition to be slightly stronger than previously anticipated. Finally, we present a general template for analysing such viability in a wide class of beyond the Standard Model theories, in which new fields are heavy enough to be integrated out at high temperature.",
Cross submissions,2024 TASI Lectures: A Dark Matter Primer,Tien-Tien Yu,High Energy Physics - Phenomenology (hep-ph); Cosmology and Nongalactic Astrophysics (astro-ph.CO),"These notes are based on a sequence of 4 lectures delivered at the 2024 Theoretical Advanced Study Institute (TASI) and at the Università degli Studi di Padova. They are intended for graduate students at the early stages of their study of dark matter with some prior exposure to cosmology and quantum field theory. The primary aim is to offer an accessible introduction to dark matter and to lay the groundwork for exploring its phenomenology. These lectures are not intended to serve as a comprehensive review. We begin by motivating the study of dark matter through a discussion of the empirical evidence and the constraints it places on dark matter properties. This is followed by an overview of several canonical mechanisms for the production of cosmological dark matter, and a concluding section that surveys current experimental and observational efforts to detect it with a focus on direct detection.",
