Heading,Title,Authors,Subjects,Abstract,PDF
New submissions,Reheating in geometric Weyl-invariant Einstein-Cartan gravity,Ioannis D. Gialamas,General Relativity and Quantum Cosmology (gr-qc); Cosmology and Nongalactic Astrophysics (astro-ph.CO); High Energy Physics - Theory (hep-th),"We study Weyl-invariant purely gravitational theories formulated within the Einstein-Cartan framework. In the Einstein-frame description, these models are dynamically equivalent to standard general relativity coupled to an axion-like pseudoscalar degree of freedom, which naturally drives a period of cosmic inflation. Without committing to a specific microscopic mechanism for reheating, we demonstrate that the post-inflationary reheating dynamics play a crucial role in shaping the inflationary predictions. In particular, we show that assumptions about the reheating temperature and the equation-of-state parameter can significantly affect the predicted values of inflationary observables, highlighting the necessity of consistently incorporating reheating effects in the phenomenological analysis of inflationary models.",
New submissions,Jacobson's thermodynamic approach to classical gravity applied to non-Riemmanian geometries: remarks on the simplicity of Nature,"Jhan N. Martinez(1),Jose F. Rodriguez-Ruiz(2),Yeinzon Rodriguez(1,2) ((1) Universidad Industrial de Santander, (2) Universidad Antonio Narino)",General Relativity and Quantum Cosmology (gr-qc),"Three decades ago, Ted Jacobson surprised us with a very appealing approach to classical gravity. According to his proposal, the gravitational field equations are the consequence of the first law of thermodynamics applied, locally, to a Rindler observer. Together with the dynamical laws of black holes, Jacobson's approach has become a very strong piece of evidence supporting the intimate connection between gravity, thermodynamics, and quantum theory. Jacobson's approach being formulated for Riemannian geometries, we have wondered what its consequences would be for non-Riemannian geometries, i.e., those that involve torsion, non metricity, or both. The results of our quest have been particularly appealing: we have found that the gravitational theory that derives from the Einstein-Hilbert action, arguably ``the simplest one'', does not belong to the pool of gravitational theories available for Nature's selection (except in the Riemannian case). In the search of a unique alternative, we have also considered the hypotheses employed in the formulation of the Lanczos-Lovelock theories of gravity. Together, the two approaches point towards the gravitational theory that derives from the Einstein-Hilbert action plus a term quadratic in the torsion vector as the one that would be selected by Nature in the non-Riemannian case without non metricity. The same strategy cannot be followed in the full non-Riemannian case as the two approaches are mutually inconsistent.",
New submissions,Realization of quintom dark energy after DESI DR2 in Nieh-Yan modified teleparallel gravity,"Yuxuan Kang,Mingzhe Li,Changzhi Yi",General Relativity and Quantum Cosmology (gr-qc); Cosmology and Nongalactic Astrophysics (astro-ph.CO); High Energy Physics - Phenomenology (hep-ph); High Energy Physics - Theory (hep-th),"Recent observations from the DESI Collaboration indicate a preference for quintom dark energy, i.e., its equation of state evolves across the cosmological constant boundary $w=-1$. It is well known that models with single perfect fluid or single scalar field minimally coupled to Einstein gravity develop perturbative instabilities around the crossing, thereby cannot realize the quintom scenario. In this paper, we provide a method to circumvent the instability problem of these models by introducing the coupling of dark energy to the Nieh-Yan density in teleparallel gravity. We show that with this coupling the background evolution is not affected, but the dark energy perturbation is removed from the menu of dynamical degrees of freedom, thus avoiding the intrinsic difficulties in the old models.",
New submissions,Charged Superradiant Instability of Spherically Symmetric Regular Black Holes in de Sitter Spacetime: Time- and Frequency-Domain Analysis,"Yizhi Zhan,Hengyu Xu,Haowei Chen,Shao-Jun Zhang",General Relativity and Quantum Cosmology (gr-qc),"We investigate the superradiant instability of Ayón-Beato-García-de Sitter (ABG-dS) black holes under massless charged scalar perturbations using both time-domain evolutions and frequency-domain computations. We show that the instability occurs only for the spherically symmetric mode with $\ell=0$, whereas asymptotically flat ABG black holes remain stable in the massless limit, which underscores the essential role of the cosmological horizon in providing a confining boundary. We further study the dependence of the growth rate on the cosmological constant $\Lambda$, the scalar charge $q$, and the black hole charge $Q$, finding that it reaches a maximum at intermediate values of $\Lambda$ and $q$ and increases monotonically with $Q$. Compared with Reissner-Nordström-de Sitter black holes, ABG-dS black holes exhibit distinct instability characteristics due to the modified electrostatic potential induced by nonlinear electrodynamics.",
New submissions,Null Raychaudhuri Equation and the Impossibility of Traversable Wormholes in Unimodular Gravity,"Erick Pastén,Marco Bosquez,Norman Cruz",General Relativity and Quantum Cosmology (gr-qc),"We formulate the traversability of wormhole throats as a local and covariant null defocusing condition derived from the Raychaudhuri equation. Since unimodular gravity preserves the local geometric structure of spacetime, the null focusing properties of geodesic congruences are unchanged with respect to general relativity. We show that any genuinely traversable wormhole in unimodular gravity necessarily violates the null energy condition, establishing a local no--go theorem for wormholes supported by ordinary matter in this framework.",
New submissions,"Non-exotic asymptotically flat wormholes in $f(Q,T)$ gravity","Sara Rastgoo,Foad Parsaei,Soudabe Nasirimoghadam",General Relativity and Quantum Cosmology (gr-qc),"In this study, we investigate the possible existence of static and spherically symmetric wormhole solutions within the context of the newly formulated extended $f(Q,T)$ gravity. We analyze a linear model, $f(Q,T)=\alpha Q+ \beta T$, and focus on traversable wormholes. By applying the variational method, we derive modified versions of the field equations that are influenced by an anisotropic matter source for a zero redshift function. It has been observed that the violation of energy conditions is influenced by the parameters $\alpha$ and $\beta$. We reach the conclusion that solutions which violate the radial and lateral null energy condition in the context of general relativity may still adhere to the energy conditions within the realm of $f(Q,T)$ gravity. To begin with, by utilizing a linear equation of state for radial pressure, we obtain a power-law shape function. Additionally, we investigate solutions defined by a variable equation of state parameter. A broad spectrum of non-exotic wormhole solutions has been identified, contingent upon the particular parameters of the model.",
New submissions,Chaotic Dynamics due Prolate and Oblate Sources in Kerr-like and Hartle-Thorne Spacetimes with and without Magnetic Field,"Adrián Eduarte-Rojas,Francisco Frutos-Alfaro,Rodrigo Carboni",General Relativity and Quantum Cosmology (gr-qc),"As demonstrated by observations, every stellar-mass object rotates around some axis; some objects spin faster than others due to different mechanisms. Furthermore, these spinning objects are slightly deformed and are no longer perfect spheres because of hydrostatic equilibrium. The well-known Kerr solution of the Einstein Field Equations (EFE) represents the spacetime surrounding a rotating spherical gravitational source. However, real objects deviate from a perfect sphere and may be prolate or oblate. There are several solutions of the EFE that represent the spacetime of deformed objects. The Kerr--like (KL) metric represents the spacetime surrounding this kind of object, where the deformation is characterized by the mass quadrupole moment parameter $q_{\mathrm{KL}}$. When $q_{\mathrm{KL}} \neq 0$, the Carter constant no longer exists and the equations of motion (EOM) are no longer integrable; therefore, the system exhibits chaotic orbits. Another widely used solution is the Hartle--Thorne (HT) metric, which has similar characteristics and represents a slightly deformed, slowly rotating star. The HT metric has several versions, and two of them were selected to test their validity. The traditional HT version, which contains logarithmic terms, is less accurate than the version with exponential terms. Moreover, both the KL and HT metrics may be extended to include contributions due to the magnetic dipole moment of the source. The equations of motion (EOM) were computed, and these new dynamical systems display several interesting features, which are shown in their Poincar'e sections.",
New submissions,Path Integrated Geodesics and Distances,Nima Khosravi,General Relativity and Quantum Cosmology (gr-qc); High Energy Physics - Theory (hep-th),"In this paper, the quantum corrections to the kinematics of geometry, specifically geodesics, are presented. This is done by employing the path integral over the geodesics. Interestingly, the geodesics do not see any modifications in this framework. However for the distances, it is demonstrated that these quantum corrections exhibit distinct behaviors for time-like, light-like, and space-like geodesics. For time-like geodesics, the maximum correction is the Planck length, which disappears when the classical separation vanishes. The light-like geodesics do not exhibit quantum corrections, meaning that the causal light cone remains the same in both classical and quantum frameworks under certain conditions. The quantum corrections for space-like geodesics impose a minimum on space-like separation, potentially playing a role in removing singularities by preventing null congruences from being closer than the Planck length. This framework also explores the correspondence between space-like/time-like geodesics and quantum/statistical physics.",
New submissions,A Local Lorentz Invariance test with LAGEOS satellites,"David Lucchesi,Massimo Visco,Roberto Peron,José C. Rodriguez,Giuseppe Pucacco,Luciano Anselmo,Massimo Bassan,Graham Appleby,Marco Cinelli,Alessandro Di Marco,Marco Lucente,Carmelo Magnafico,Carmen Pardini,Feliciana Sapio",General Relativity and Quantum Cosmology (gr-qc),"Strong theoretical arguments suggest that a breakdown of Lorentz Invariance could arise under some very particular conditions. From an experimental point of view, it is important to test the Local Lorentz Invariance with ever greater precision and in all contexts, regardless of the theoretical motivation for the possible violation. In this paper we discuss some aspects of the gravitational sector. Tests of Lorentz Invariance in the context of gravity are difficult and rare in the literature. Possible violations could arise from quantum physics applied to gravity or the presence of vector and tensor fields mediating the gravitational interaction together with the metric tensor of General Relativity. We present our results in the latter case. We analyzed the orbit of the LAGEOS and LAGEOS II satellites over a period of almost three decades. The effects of the possible preferred frame represented by the cosmic microwave background radiation on the mean argument of latitude of the satellites orbit were considered. These effects would manifest themselves mainly through the post-Newtonian parameter $\alpha_1$, a parameter that has a null value in General Relativity. We constrain this parameterized post-Newtonian parameter down to the level of $\alpha_1 \le 2\times10^{-5}$, improving a previous limit obtained through the Lunar Laser Ranging technique.",
New submissions,$δN$ formalism with gradient interactions,"S. Mohammad Ahmadi,Nahid Ahmadi",General Relativity and Quantum Cosmology (gr-qc); High Energy Physics - Theory (hep-th),"The standard $\delta N$ formalism, a cornerstone for calculating nonlinear curvature perturbations on super-Hubble scales, relies on the separate universe assumption, in which spatial gradients are neglected. However, this approximation breaks down in scenarios critical for primordial black hole formation, such as transitions to an ultra-slow-roll phase, where gradient interactions induce significant non-conservation of the comoving curvature perturbation. In this Letter, we introduce a framework that incorporates gradient corrections into the $\delta N$ formalism at a desired order by adding an effective source term to the background Klein--Gordon equation. This approach allows for a nonlinear treatment of curvature perturbations at the end of inflation considering initial conditions at the time of horizon exit. By computing the equilateral non-Gaussianity parameter $f_{\mathrm{NL}}^{\mathrm{eq}}$, we demonstrate that our method captures essential features missed by the standard $\delta N$, offering a simple yet rigorous pathway to determine nonlinear evolution expected from cosmological perturbation theory.",
New submissions,Tripartite quantum steering in Schwarzschild spacetime,"Guang-Wei Mi,Xiaofen Huang,Tinggui Zhang",General Relativity and Quantum Cosmology (gr-qc); Quantum Physics (quant-ph),"We investigate the effects of Hawking radiation on quantum steering and steering asymmetry in a tripartite system embedded in Schwarzschild spacetime. All tripartite steering types were classified,comprising three ""1 to 2"" and three ""2 to 1"" steering cases. Through a systematic analysis of all physically relevant scenarios (including accessible and inaccessible modes), we classify three canonical scenarios with one, two and three physically accessible modes. In the scenario of three physically accessible modes, Hawking radiation disrupts quantum steering, with the maximum steering asymmetry during the two-way steering to one-way steering transition precisely demarcating the phase boundary between these regimes. For two physically accessible modes, Hawking radiation exhibits dual behavior: enhancing the steering from Alice and Bob to anti-Charlie under certain parameters while suppressing it under others, while net strengthening other steering types. When considering one physically accessible mode, the Hawking effect of the black hole significantly enhances quantum steering. These findings provide new insights into quantum correlations in curved spacetime and establish observable signatures of Hawking effects in quantum steering phenomena.",
New submissions,Ellis--Bronnikov wormhole in Quasi-topological Gravity,"Gen Li,Yong-Qiang Wang",General Relativity and Quantum Cosmology (gr-qc); High Energy Physics - Theory (hep-th),"We construct higher-dimensional traversable wormholes in quasi-topological gravity (QTG) supported by a phantom scalar field. Using a static, spherically symmetric ansatz, we numerically analyze how quasi-topological gravity corrections affect the geometry and physical properties of the wormhole solutions. The resulting wormhole solutions are symmetric about the throat. Negative mass can arise for certain choices of parameters. For certain parameter ranges, the scalar charge $\mathcal{D}$ of the phantom field rapidly decreases with increasing the higher-curvature coupling parameter $\alpha$ and approaches zero. Moreover, by changing $\alpha$, the overall level of the Kretschmann scalar is also lowered. Finally, for sufficiently large $\alpha$, $-g_{tt}$ becomes close to zero near the throat, exhibiting a ``horizon''-like structure.",
New submissions,Charged nutty black holes are hairy,"Dmitri Gal'tsov,Rostom Karsanov",General Relativity and Quantum Cosmology (gr-qc); High Energy Physics - Theory (hep-th),"We uncover the physical nature of the electric and magnetic monopoles discovered by McGuire and Ruffini on Misner strings accompanying charged nutty black holes, showing that these strings carry singular, nonuniform flows of electric and magnetic fields. These fields inevitably have nonzero divergence, thereby simulating the effective electric and magnetic charge densities along the strings. The latter create a complex short-range electromagnetic hair zone around the horizon, making the combined Misner-Dirac strings classically observable. Typical features of this new type of hair are presented. We also note that rotation can act as a hair generator even in the absence of NUT.",
New submissions,Testing the wormhole echo hypothesis for GW231123,"Qi Lai,Qing-Yu Lan,Zhan-He Wang,Yun-Song Piao",General Relativity and Quantum Cosmology (gr-qc); High Energy Astrophysical Phenomena (astro-ph.HE); High Energy Physics - Theory (hep-th),"The short-duration gravitational-wave (GW) event GW231123 has inferred component masses in the pair-instability mass gap and exhibits a burst-like morphology with no clearly inspiral, making it an interesting target for tests beyond the standard binary black hole (BBH) interpretation. In this work, motivated by its phenomenological similarity to GW190521, we test whether GW231123 is compatible with a wormhole-echo scenario by modeling a leading echo pulse with a well-motivated phenomenological sine-Gaussian wavepacket. We perform Bayesian model comparison against a BBH baseline described by the IMRPhenomXPHM-SpinTaylor waveform, and obtain the Bayes factor ratio $\ln B^{\rm Echo}_{\rm BBH} = 1.87$, corresponding to weak-to-moderate support for the echo hypothesis. In our previous analysis for GW190521 within the same overall framework, we found $\ln B^{\rm Echo}_{\rm BBH} \approx -2.9$, implying a shift of $\Delta \ln B \approx 4.8$ between the two events. This sign change indicates that GW231123 is more compatible with a single-pulse echo description than GW190521.",
New submissions,Reduced Phase Space Quantization and Quantum Corrected Entropy of Schwarzschild-de Sitter Horizons,"S. Jalalzadeh,H. Moradpour",General Relativity and Quantum Cosmology (gr-qc),"This paper investigates the quantization of the Schwarzschild--de Sitter (SdS) black hole (BH) using the Misner--Sharp--Hernandez (MSH) mass as the internal energy in a reduced phase space framework. After introducing the canonical variables of the reduced phase space, we derive a discrete spectrum for the surface areas of the BH event horizon (EH) as well as MSH masses. We utilized the MSH mass spectrum to obtain the entropy of the BH. The entropy of the BH and cosmic EHs reveals a logarithmic correction to the Bekenstein--Hawking term. Our results support the robustness of the logarithmic form of quantum corrections in SdS thermodynamics.",
New submissions,Hyperbolicity analysis of the linearised 3+1 formulation in the Teleparallel Equivalent of General Relativity,"Cheng Cheng,Maria Jose Guzman",General Relativity and Quantum Cosmology (gr-qc),"We study the properties of the principal symbol of the 3+1 equations of motion in Teleparallel Equivalent of General Relativity (TEGR) and assess the conditions for hyperbolicity. We use the Hamiltonian formulation based on the vectorial, antisymmetric, symmetric trace-free, and trace (VAST) decomposition of the canonical variables in the Hamiltonian formalism, and the Hamilton's equations previously presented in the literature. We study the system of differential equations at the linear level, and show that the principal symbol has a sector with imaginary eigenvalues, which renders the system not hyperbolic. This situation persists by taking spatial derivatives in either one or three coordinate directions, and it should be interpreted as a problem of the specific gauge choice instead of a general problem with TEGR. The first practical use of Hamilton's equations in this work can be extended for proving well-posedness in spherical symmetry, and establish numerical relativity setups in TEGR.",
New submissions,Cosmic evolution from Lorentz-violating bumblebee dynamics and Tsallis holographic dark energy,"E. M. Siquieri,D. S. Cabral,A. F. Santos",General Relativity and Quantum Cosmology (gr-qc),"In this work, the behavior, evolution, and expansion of the universe are investigated within a Lorentz-violating framework driven by Tsallis holographic dark energy. The cosmological extension is implemented through a spontaneously symmetry-breaking Bumblebee field, which is assumed to play a fundamental role in the dynamics of the universe. Estimates for key Lorentz-violating quantities are obtained, and the evolution of the Hubble parameter is analyzed from the early universe era to the present epoch. This formulation provides an alternative perspective on the Hubble tension.",
New submissions,"Observable Optical Signatures, Particle Dynamics and Epicyclic Frequencies of Mod(A)Max Black Holes","Faizuddin Ahmed,Ahmad Al-Badawi,Edilberto O. Silva",General Relativity and Quantum Cosmology (gr-qc); High Energy Physics - Theory (hep-th),"In this work, we investigate the observable optical signatures of the Mod(A)Max black hole spacetime. We analyze key optical features, including the photon sphere, black hole shadow, and photon trajectories, and examine how these observables depend on the underlying geometric parameters, such as the electric charge and the Mod(A)Max coupling parameter. We further study the dynamics of neutral test particles in the vicinity of the black hole by deriving the effective potential within the Hamiltonian formalism. Using this potential, we obtain the specific energy and specific angular momentum for test particles on circular orbits of fixed radius, as well as the innermost stable circular orbit (ISCO), and explore how the geometric parameters influence these quantities and the ISCO radius. Finally, we derive the epicyclic (azimuthal, radial, and vertical) frequencies to analyze quasi-periodic oscillations (QPOs) exploring how the geometric parameters influences these and discuss their physical implications.",
New submissions,Radial perturbations of neutron stars in Scalar-Vector-Tensor (SVT),Hamza Boumaza,General Relativity and Quantum Cosmology (gr-qc),"In this paper, we investigate the equilibrium configurations and the radial perturbations of neutron stars in a subclass of Scalar-Vector-Tensor (SVT) theories. By solving the generalised Tolman-Oppenheimer-Volkoff equations in SVT theories for several values of the modified gravity parameter, we examine the impact of the spontaneous scalarization of charged neutron star (NSs), which arises from the coupling of the scalar field to the electromagnetic tensor and double-dual Reimann tensor, $L^{\mu\nu\alpha\beta}F_{\mu\nu}F_{\alpha\beta}$. Then we extend our study by deriving the action at quadratic order in linear perturbations of radial type and computing scalar quasinormal modes (QNMs)as well as the normal modes (NMs) showing the coincidence of stability and maximum mass points in generlar relativity (GR) is still present in this modified theory.",
New submissions,Complete asymptotics in the formation of quiescent big bang singularities,"Andrés Franco-Grisales,Hans Ringström",General Relativity and Quantum Cosmology (gr-qc); Mathematical Physics (math-ph); Differential Geometry (math.DG),"There are three categories of mathematical results concerning quiescent big bang singularities: the derivation of asymptotics in a symmetry class; the construction of spacetimes given initial data on the singularity; and the proof of big bang formation in the absence of symmetries, including the proof of stable big bang formation. In a recent article, the first author demonstrated the existence of developments corresponding to a geometric notion of initial data on a big bang singularity. Moreover, this article, combined with previous articles by the second author, gives a unified and geometric perspective on large classes of seemingly disparate results in the first two categories. Concerning the third category, Oude Groeniger et al recently formulated a general condition on initial data ensuring big bang formation, including curvature blow up. This result, among other things, generalises previous results on stable big bang formation. However, it does not include a statement saying that the solutions induce initial data on the singularity. Here we tie all three categories of results together by demonstrating that the solutions of Oude Groeniger et al induce data on the singularity. However, the results are more general and can potentially be used to derive similar conclusions in other gauges.",
