Heading,Title,Authors,Subjects,Abstract,PDF
Cross submissions,Spin-orbit misalignment and residual eccentricity are evidence that neutron star-black hole mergers form through triple star evolution,"Jakob Stegmann,Jakub Klencki",High Energy Astrophysical Phenomena (astro-ph.HE); Solar and Stellar Astrophysics (astro-ph.SR); General Relativity and Quantum Cosmology (gr-qc),"There is growing evidence that a substantial fraction of the neutron star-black holes (NSBHs) detected through gravitational waves merge with non-zero eccentricity or large BH spin-orbit misalignment. This is in tension with the leading formation scenarios to date. Residual eccentricity rules out formation through isolated binary star evolution, while NS natal kicks and the unequal masses of NSBHs inhibit efficient pairing in dense stellar environments. Here, we report that all observed properties-NSBH merger rate, eccentricity, and spin-orbit misalignment-are explained by the high prevalence of massive stellar triples in the field. Modelling their evolution from the ZAMS, we investigate NSBH mergers caused by gravitational perturbations from a tertiary companion. We show that the formation of the NS decisively impacts the triple stability, preferentially leaving behind surviving NSBHs in compact triple architectures. The rich three-body dynamics of compact, unequal-mass triples enables mergers across a wide range of orbital parameters without requiring fine-tuned highly inclined tertiary orbits and provides a natural explanation for an abundance of residual eccentricity and spin-orbit misalignment. We infer a total NSBH merger rate of $R\sim1-23\,\rm Gpc^{-3}\,yr^{-1}$, with more than a few 10% exhibiting eccentricity $e_{20}>0.1$ or large spin-orbit misalignment $\cos\theta_{\rm BH}<0$, consistent with current observations. Tertiary-driven NSBH mergers closely track the cosmic star formation rate due to their short delay times, include a substantial fraction of burst-like highly eccentric systems ($e_{20} > 0.9$), and almost universally retain eccentricities $e_{20}>10^{-3}$, potentially detectable by next-generation detectors. If evidence for eccentric and misaligned events solidifies, our results suggest that triple dynamics is the dominant formation channel of NSBH mergers.",
Cross submissions,Hollow-grams: Generalized Entanglement Wedges from the Gravitational Path Integral,"Sami Kaya,Pratik Rath,Kyle Ritchie",High Energy Physics - Theory (hep-th); General Relativity and Quantum Cosmology (gr-qc); Quantum Physics (quant-ph),"Recently, Bousso and Penington (BP) made a proposal for the entanglement wedge associated to a gravitating bulk region. In this paper, we derive this proposal in time-reflection symmetric settings using the gravitational path integral. To do this, we exploit the connection between random tensor networks (RTNs) and fixed-geometry states in gravity. We define the entropy of a bulk region in an RTN by removing tensors in that region and computing the entropy of the open legs thus generated in the ""hollowed"" RTN. We thus derive the BP proposal for RTNs and hence, also for fixed-geometry states in gravity. By then expressing a general holographic state as a superposition over fixed-geometry states and using a diagonal approximation, we provide a general gravitational path integral derivation of the BP proposal. We demonstrate that the saddles computing the Rényi entropy $S_n$ depend on how the bulk region is gauge-invariantly specified. Nevertheless, we show that the BP proposal is universally reproduced in the $n\to1$ limit.",
Cross submissions,Locating the QCD critical point with neutron-star observations,"Christian Ecker,Niko Jokela,Matti Järvinen",High Energy Astrophysical Phenomena (astro-ph.HE); General Relativity and Quantum Cosmology (gr-qc); High Energy Physics - Phenomenology (hep-ph); High Energy Physics - Theory (hep-th); Nuclear Theory (nucl-th),"We present a probabilistic model for the QCD critical endpoint (CEP) and the equation of state (EOS) at $\beta$-equilibrium, constrained by neutron-star observations. Using a hybrid framework that combines the holographic V-QCD model with an effective van der Waals description of nuclear matter, we generate a large ensemble of EOSs incorporating nuclear theory uncertainties. Constraining this ensemble with neutron-star mass-radius data and tidal deformability measurements from gravitational waves, we identify a strong first-order deconfinement transition at zero temperature, with a transition strength of $\Delta n_{\rm{PT}}/n_0 = 3.75^{+0.70}_{-0.53}$ and onset density $n_{\rm{PT}}/n_0 = 4.9^{+1.33}_{-1.17}$. The resulting posterior yields $95\%$ credible intervals for the CEP location: $\mu_{\rm{crit}} = 626^{+90}_{-179}\,\rm{MeV}$, $T_{\rm{crit}} = 119^{+14}_{-6}\,\rm{MeV}$.",
Cross submissions,EFT Corrections to Charged Black Hole Quasinormal Modes,"William L. Boyce,Jorge E. Santos",High Energy Physics - Theory (hep-th); General Relativity and Quantum Cosmology (gr-qc),"We study the impact of higher-derivative corrections from Effective Field Theory on the quasinormal mode spectrum of Reissner-Nordström black holes. While previous work has explored corrections to Schwarzschild and Kerr black holes - typically using small-rotation approximations - a comprehensive analysis near extremality remains lacking. We focus on Reissner-Nordström black holes as a tractable model admitting an extremal limit, enabling investigation of the effect of these corrections on the so-called zero damped modes, which dominate in this regime. Specifically, we derive a corrected Moncrief equation governing quasinormal modes and present both analytic and numerical results for the corrected frequencies. This work also offers the first explicit test of the recently proposed ""Quasinormal Mode Causality"" boundarXiv:2401.05524, which constrains Effective Field Theory coefficients by requiring that quasinormal mode lifetimes do not increase measurably under ultraviolet-complete Effective Field Theory corrections. Using Standard Model contributions - particularly those arising from integrating out the electron - we verify that this bound holds. Our results provide new insights into the interplay between Effective Field Theory, extremal black hole dynamics, and causality in gravitational theories.",
Cross submissions,Positron Signal from the Early Universe,"L. Stodolsky,J. Silk",Cosmology and Nongalactic Astrophysics (astro-ph.CO); General Relativity and Quantum Cosmology (gr-qc),"Bursts from the very early universe may lead to a detectable signal via the production of positrons, whose annihilation gives an observable X-ray signal. Using the absorption parameters for the annihilation photons of 511 keV, it is found that observable photons would originate at a red-shift around $z\approx$ 200-300, resulting in soft X-rays of energy $\sim$ 2-3 keV at present. Positrons are expected to be absent at these times or red-shifts in the standard picture of the early universe. Detection of the X-rays would thus provide dramatic support for the hypothesis of the bursts, explosive events at very early times. We urge the search for such a signal.",
Cross submissions,Spacetime quantum mechanics for bosonic and fermionic systems,"N. L. Diaz,R. Rossignoli",Quantum Physics (quant-ph); General Relativity and Quantum Cosmology (gr-qc); High Energy Physics - Theory (hep-th),"We provide a Hilbert space approach to quantum mechanics (QM) where space and time are treated on an equal footing. Our approach replaces the standard dependence on an external classical time parameter with a spacetime-symmetric algebraic structure, thereby unifying the axioms that traditionally distinguish the treatment of spacelike and timelike separations. Standard quantum evolution can be recovered from timelike correlators, defined by means of a quantum action operator, a quantum version of the action of classical mechanics. The corresponding map also provides a novel perspective on the path integral (PI) formulation, which, in the case of fermions, yields an alternative to the use of Grassmann variables. In addition, the formalism can be interpreted in terms of generalized quantum states, codifying both the conventional information of a quantum system at a given time and its evolution. We show that these states are solutions to a quantum principle of stationary action enabled by the novel notion of timelike correlations.",
Cross submissions,Complexity equals anything for multi-horizon black holes,"Hong-Yue Jiang,Yu-Xiao Liu",High Energy Physics - Theory (hep-th); General Relativity and Quantum Cosmology (gr-qc),"We investigate the ``complexity equals anything"" proposal with codimension-one and codimension-zero gravitational observables for multi-horizon black holes, using the Bardeen-AdS class black hole as an example. In particular, we compare the results with the ``complexity equals volume"" (CV) proposal and find that the ``complexity equals anything"" ($\mathcal{C}_{\text{gen}}$) enables the probing of a more complete black hole interior, that is, all spacetime regions where the blackening factor $f(r)<0$. This is the advantage brought by the flexibility of this holographic complexity conjecture. In addition, we compute the complexity derived from various geometric quantities and show that these constructions can effectively differentiate the distinct interior regions of the black hole.",
Cross submissions,Rotating Carroll Black Holes: A No Go Theorem,"Ivan Kolář,David Kubiznak,Poula Tadros",High Energy Physics - Theory (hep-th); General Relativity and Quantum Cosmology (gr-qc),"Recently, there has been a lot of interest in Carroll black holes and in particular whether or not one could find a Carrollian analogue of a rotating black hole spacetime. Here we show that every stationary and axisymmetric solution (and thence also a black hole) of Carrollian general relativity in any number of $d\geq 3$ dimensions is necessarily also static. Using this result, we construct a unique stationary and axisymmetric black hole in three dimensions - a static Carroll BTZ black hole. At the same time, we find a Carrollian analogue of an accelerating black hole, showing that Schwarzschild is not the only possible stationary and axisymmetric Carroll black hole in four dimensions. A generalization of the no go theorem to include Maxwell, dilatonic, and axionic matter fields is also discussed.",
Cross submissions,Constraining the lensing dispersion from the angular clustering of binary black hole mergers,"Fumihiro Chuman,Masamune Oguri",Cosmology and Nongalactic Astrophysics (astro-ph.CO); General Relativity and Quantum Cosmology (gr-qc),"Gravitational waves from inspiraling compact binaries provide direct measurements of luminosity distances and serve as a powerful probe of the high-redshift Universe. In addition to their role as standard sirens, they offer an opportunity to constrain small-scale density fluctuations through the dispersion in the distance-redshift relation induced by gravitational lensing. We propose a method to constrain this lensing dispersion without requiring the redshift information by analyzing the angular clustering of gravitational wave sources. Our formalism incorporating second-order lensing effects in the luminosity distance shows that the amplitude of the auto-correlation angular clustering decreases with increasing lensing dispersion. While we show that the auto-correlation signal is detected with sufficient signal-to-noise ratios in future gravitational wave experiments, there exists a strong degeneracy between the lensing dispersion and the linear bias of gravitational wave sources. We demonstrate that this degeneracy is partially broken by a joint analysis of the auto-correlation of gravitational wave sources and the cross-correlation with galaxies whose redshifts are known. This approach enhances the use of gravitational waves as a cosmological probe at high redshifts.",
Cross submissions,$α$-attractor inflation modified by GUP in light of ACT observations,"Hana Heidarian,Milad Solbi,Soma Heydari,Kayoomars Karami",Cosmology and Nongalactic Astrophysics (astro-ph.CO); General Relativity and Quantum Cosmology (gr-qc); High Energy Physics - Theory (hep-th),"Here, the $\alpha$-attractor inflation is investigated within a framework incorporating a minimal measurable length, as implemented by the Generalized Uncertainty Principle (GUP). The GUP modifications to the Friedmann equations and cosmological perturbation parameters are employed to assess the model observational viability against recent high-precision data, primarily from the Atacama Cosmology Telescope Data Release 6 (ACT DR6) combined with Planck, DESI BAO, and BICEP/Keck 2018 observations (P-ACT-LB-BK18). Our results indicate that while the standard $\alpha$-attractor model ($\beta=0$) for $N_*=60$ lies near the $2\sigma$ boundary of the P-ACT-LB-BK18 dataset, the inclusion of GUP effects significantly shifts the predictions for the scalar spectral index $n_s$ and the tensor-to-scalar ratio $r$. Notably, for the GUP parameter $\beta$ values surpassing approximately $10^{13}$, the model predictions are shown to fall well within the 68\% CL region of this combined observational data, enhancing its consistency. The viable parameter space in the $\alpha-\beta$ plane is explored, revealing that a maximum $\alpha \simeq 0.74$ is consistent with the 68\% CL for $\beta \simeq 1.4\times 10^{13}$. In addition, for smaller values of $\alpha$, the predictions of the model remain inside the 68\% CL region for larger values of $\beta$.",
Cross submissions,On the calculation of p-values for quadratic statistics in Pulsar Timing Arrays,Rutger van Haasteren,Instrumentation and Methods for Astrophysics (astro-ph.IM); General Relativity and Quantum Cosmology (gr-qc),"Pulsar Timing Array (PTA) projects have reported various lines of evidence suggesting the presence of a stochastic gravitational wave (GW) background in their data. One key line of evidence involves a detection statistic sensitive to inter-pulsar correlations, such as those induced by GWs. A $p$-value is then calculated to assess how unlikely it is for the observed signal to arise under the null hypothesis $H_0$, purely by chance. However, PTAs cannot empirically draw samples from $H_0$. As a workaround, various techniques are used in the literature to approximate $p$-values under $H_0$. One such technique, which has been heralded as a model-independent method, is the use of ``scrambling'' transformations that modify the data to cancel out pulsar correlations, thereby simulating realizations from $H_0$. In this work, scrambling methods and the detection statistic are investigated from first principles. The $p$-value methodology that is discussed is general, but the discussions regarding a specific detection statistic apply to the detection of a stochastic background of gravitational waves with PTAs. All methods in the literature to calculate $p$-values for such a detection statistic are rigorously analyzed, and many analytical expressions are derived. All this leads to the conclusion that scrambling methods are \emph{not} model-independent and thus not completely empirical. Rigorous Bayesian and Frequentist $p$-value calculation methods are advocated, the evaluation of which depend on the generalized $\chi^2$ distribution. This view is consistent with the posterior predictive $p$-value approach that is already in the literature. Efficient expressions are derived to evaluate the generalized $\chi^2$ distribution of the detection statistic on real data. It is highlighted that no Frequentist $p$-values have been calculated correctly in the PTA literature to date.",
Cross submissions,Gromov's reconstruction theorem and measured Gromov-Hausdorff convergence in Lorentzian geometry,"Mathias Braun,Clemens Sämann",Differential Geometry (math.DG); General Relativity and Quantum Cosmology (gr-qc); Mathematical Physics (math-ph); Metric Geometry (math.MG),"We establish Gromov's celebrated reconstruction theorem in Lorentzian geometry. Alongside this result, we introduce and study a natural concept of isomorphy of normalized bounded Lorentzian metric measure spaces. We outline applications to the spacetime reconstruction problem from causal set theory. Lastly, we propose three notions of convergence of (isomorphism classes of) normalized bounded Lorentzian metric measure spaces, for which we prove several fundamental properties.",
