Heading,Title,Authors,Subjects,Abstract,PDF
New submissions,A Correlation Between FRB Dispersion Measure and Foreground Large-Scale Structure,"Maryam Hussaini,Liam Connor,Ralf M. Konietzka,Vikram Ravi,Jakob Faber,Kritti Sharma,Myles Sherman",Cosmology and Nongalactic Astrophysics (astro-ph.CO); Astrophysics of Galaxies (astro-ph.GA); High Energy Astrophysical Phenomena (astro-ph.HE),"The distribution of baryons in the Universe remains a fundamental open question in astronomy, and the dispersion measure (DM) of Fast Radio Bursts (FRBs) serves as a valuable tool for probing this cosmic gas. We investigate the impact of the foreground cosmic web on FRB DMs using 61 localized FRBs and public galaxy catalogs. We test for the large-scale structure's impact on cosmological DM using two methods. First, we searched for a correlation between galaxy number density along the line of sight and extragalactic DM, and found a statistically significant positive correlation ($p$ = $1.76 \times 10^{-5}$). The shape of this correlation contains information about the cosmic baryon distribution, and can also be used to better constrain host galaxy DM by providing an estimate of the cosmic contribution on a per-source basis. We observe similar correlations in a mock FRB survey based on the IllustrisTNG cosmological simulation, where the DM is dominated by filaments in the IGM and not by halos. Next, we performed a stacking analysis that measures the average excess DM as a function of impact parameter of foreground galaxies to obtain spatial information about how ionized gas is distributed around galaxy halos. We report excess DM in the stacked signal for impact parameters up to Mpc scales ($\sim$3$\sigma$). Finally, we identified FRBs that do not appear to intersect intervening halos within $r_{vir}$, allowing us to estimate the fraction of baryons that reside in the IGM. We find $f_{\mathrm{IGM}} \geq 0.69$ at 95$\%$ confidence, indicating significant astrophysical feedback.",
New submissions,Analyzing Line-of-sight selection biases in galaxy-scale strong lensing with external convergence and shear,"Xianzhe TZ Tang,Simon Birrer,Anowar J. Shajib,Narayan Khadka, theLSST Strong Gravitational Lensing Science Collaboration, theLSST Dark Energy Science Collaboration",Cosmology and Nongalactic Astrophysics (astro-ph.CO); Astrophysics of Galaxies (astro-ph.GA),"The upcoming Vera Rubin Observatory Legacy Survey of Space and Time (LSST) will dramatically increase the number of strong gravitational lensing systems, requiring precise modeling of line-of-sight (LOS) effects to mitigate biases in lensing observations and cosmological inferences. We develop a method to construct joint distributions of external convergence ($\kappa_{\mathrm{ext}}$) and shear ($\gamma_{\mathrm{ext}}$) for strong lensing LOS by aggregating large-scale structure simulations with high-resolution halo renderings and non-linear correction. Our approach captures both smooth background matter and perturbations from halos, enabling accurate modeling of LOS effects. We apply non-linear LOS corrections to $\kappa_{\mathrm{ext}}$ and $\gamma_{\mathrm{ext}}$ that address the non-additive lensing effects caused by objects along the LOS in strong lensing. We find that, with a minimum image separation of $1.0^{\prime\prime}$, non-linear LOS correction due to the presence of a dominant deflector slightly increases the ratio of quadruple to double lenses; this non-linear LOS correction also introduces systematic biases of $\sim 0.1\%$ for galaxy-AGN lenses in the inferred Hubble constant ($H_0$) if not accounted for. We also observe a $0.66\%$ bias for galaxy-galaxy lenses on $H_0$, and even larger biases up to $1.02\%$ for galaxy-AGN systems if LOS effects are not accounted for. These results highlight the importance of LOS for precision cosmology. The publicly available code and datasets provide tools for incorporating LOS effects in future analyses.",
Cross submissions,Bulk/boundary Modular Quintessence and DESI,"Luis A. Anchordoqui,Ignatios Antoniadis,Niccolò Cribiori,Arda Hasar,Dieter Lust,Joaquin Masias,Marco Scalisi",High Energy Physics - Theory (hep-th); Cosmology and Nongalactic Astrophysics (astro-ph.CO); General Relativity and Quantum Cosmology (gr-qc),"The latest DESI DR2 results, when combined with other independent cosmological data on the Cosmic Microwave Background and supernovas, suggest a preference for dynamical dark energy.We propose a novel cosmological scenario, which features two distinct scalar fields. One governs the magnitude of the present-day dark energy density and is related to the size of extra-dimensions. Accounting for the observed smallness of this energy density requires the scalar to reside near the boundary of field space.The second field, responsible for the time evolution of dark energy and associated with the string coupling, must instead lie in the bulk to remain consistent with the non-observation of light string states. We show that a natural candidate for such dark energy dynamics is a quintessence modular-invariant potential, in which the second scalar field rolls down a negatively curved slope, starting from a self-dual critical point. We find that this scenario is in good agreement with the latest findings by DESI.",
Cross submissions,Could Planck Star Remnants be Dark Matter?,"Oem Trivedi,Abraham Loeb",General Relativity and Quantum Cosmology (gr-qc); Cosmology and Nongalactic Astrophysics (astro-ph.CO); High Energy Physics - Theory (hep-th),"We explore the end state of gravitational collapse under quantum gravity effects and propose that Planck Star Remnants (PSR), formed via nonsingular bounces, could serve as viable dark matter candidates. Within the framework of Loop Quantum Cosmology, we model the collapse of a homogeneous matter distribution and show that the classical singularity is replaced by a quantum bounce at the Planck density. By analytically matching the Friedmann Lemaitre Robertson Walker (FLRW) interior to an exterior Schwarzschild spacetime using the Israel junction conditions, we demonstrate that the bounce remains causally hidden from external observers, avoiding any observable re-expansion. This naturally leads to the formation of stable, non-radiating PSR, whose radius coincides with the Schwarzschild radius when the black hole mass approaches the Planck mass as a result of Hawking evaporation. We suggest that such remnants may originate from evaporating primordial black holes in the early universe, and estimate the relic abundance needed for PSR to account for the observed dark matter density. We also discuss some crucial differences between PSR and previous proposals of Planck mass relics. The scenario is shown to be consistent with existing astrophysical and cosmological constraints, offering a unified framework connecting quantum gravitational collapse, and the nature of dark matter.",
Cross submissions,Revisiting Isocurvature Bounds on the Minimal QCD Axion,"Peter W. Graham,Davide Racco",High Energy Physics - Phenomenology (hep-ph); Cosmology and Nongalactic Astrophysics (astro-ph.CO),"The QCD axion has important connections to early universe cosmology. For example, it is often said that isocurvature limits rule out a combination of high axion decay constant, $f_a$, and high inflationary Hubble scale, $H_I$. High scales are theoretically motivated, so it is important to ask how robust this constraint is. We demonstrate that this constraint is naturally evaded when the quartic coupling of the complex $U(1)_\mathrm{PQ}$-breaking field is small. In this case, $f_a$ changes from a larger value during inflation to a smaller value in the later universe, suppressing isocurvature perturbations. Importantly, we show that in large parts of parameter space this solution is not jeopardised by overproduction of the axion through parametric resonance. The isocurvature bounds are thus dependent on UV physics. We have found that, even for the minimal QCD axion, large parts of UV parameter space at both high $f_a$ and high $H_I$ are in fact allowed, not ruled out by isocurvature constraints.",
Cross submissions,Quantum entanglement in cosmology,"Alessio Belfiglio,Orlando Luongo,Stefano Mancini",General Relativity and Quantum Cosmology (gr-qc); Cosmology and Nongalactic Astrophysics (astro-ph.CO); High Energy Physics - Phenomenology (hep-ph); High Energy Physics - Theory (hep-th); Quantum Physics (quant-ph),"We discuss recent progress in the study of entanglement within cosmological frameworks, focusing on both momentum and position-space approaches and also reviewing the possibility to directly extract entanglement from quantum fields. Entanglement generation in expanding spacetimes can be traced back to the phenomenon of gravitational particle production, according to which the background gravitational field may transfer energy and momentum to quantum fields. The corresponding entanglement amount and its mode dependence are both sensitive to the field statistics and to the details of spacetime expansion, thus encoding information about the background. Gravitational production processes also play a key role in addressing the quantum-to-classical transition of cosmological perturbations. In order to directly extract entanglement from quantum fields, local interactions with additional quantum systems, working as detectors, have been suggested, leading to the formulation of the entanglement harvesting protocol. Despite harvesting procedures are currently unfeasible from an experimental point of view, various proposals for implementation exist and a proper modeling of detectors and local interactions is crucial to address entanglement extraction via realistic setups. In the final part of the work, we address entanglement characterization in position space, primarily focusing on black hole spacetimes. We first investigate a possible interpretation of Bekenstein-Hawking black hole entropy in terms of the entanglement entropy arising in discrete quantum field theories, on account of the area law. Then, we discuss the resolution of the black hole information paradox via the gravitational fine-grained entropy formula, which provides a new way to compute the entropy of Hawking radiation and allows to preserve unitarity in black hole evaporation processes.",
Cross submissions,Stochastic inflation as a superfluid,Gianmassimo Tasinato,General Relativity and Quantum Cosmology (gr-qc); Cosmology and Nongalactic Astrophysics (astro-ph.CO); High Energy Physics - Theory (hep-th),"We point out that inflationary superhorizon fluctuations can be effectively described by a set of equations analogous to those governing a superfluid. This is achieved through a functional Schrödinger approach to the evolution of the inflationary wavefunction, combined with a suitable coarse-graining procedure to capture large-scale dynamics. The irrotational fluid velocity is proportional to the gradient of the wavefunction phase. Marginalizing over short superhorizon modes introduces an external force acting on the fluid velocity. The quantum pressure characteristic of the superfluid plays a role in scenarios involving an ultra-slow-roll phase of inflation. Our superfluid framework is consistent with the standard Starobinsky approach to stochastic inflation while offering complementary insights, particularly by providing more precise information on the phase of the inflationary wavefunction. We also discuss a heuristic approach to include dissipative effects in this description.",
