Heading,Title,Authors,Subjects,Abstract,PDF
New submissions,A new exact rotating spacetime in vacuum: The Kerr--Levi-Civita Spacetime,"José Barrientos,Adolfo Cisterna,Mokhtar Hassaine,Keanu Müller,Konstantinos Pallikaris",General Relativity and Quantum Cosmology (gr-qc); High Energy Physics - Theory (hep-th),"We construct a new rotating solution of Einstein's theory in vacuum by exploiting the Lie point symmetries of the field equations in the complex potential formalism of Ernst. In particular, we perform a discrete symmetry transformation, known as inversion, of the gravitational potential associated with the Kerr metric. The resulting metric describes a rotating generalization of the Schwarzschild--Levi-Civita spacetime, and we refer to it as the Kerr--Levi-Civita metric. We study the key geometric features of this novel spacetime, which turns out to be free of curvature singularities, topological defects, and closed timelike curves. These attractive properties are also common to the extremal black hole and the super-spinning case. The solution is algebraically general (Petrov-type I), and its horizon structure is exactly that of the Kerr spacetime. The ergoregions, however, are strongly influenced by the Levi-Civita-like asymptotic structure, producing an effect akin to the magnetized Kerr--Newman and swirling solutions. Interestingly, while its static counterpart permits a Kerr--Schild representation, the Kerr--Levi-Civita metric does not admit such a formulation.",
New submissions,Quenched entanglement harvesting,"Adrian Lopez-Raven,Robert B. Mann,Jorma Louko",General Relativity and Quantum Cosmology (gr-qc); Quantum Physics (quant-ph),"Ultracold fermionic atoms in an optical lattice, with a sudden position-dependent change (a quench) in the effective dispersion relation, have been proposed by Rodríguez-Laguna et al as an analogue spacetime test of the Unruh effect. We provide new support for this analogue by analysing the entanglement of a scalar field in a (1 + 1)-dimensional continuum spacetime with a similar quench, and the harvesting of this entanglement by a pair of Unruh-DeWitt detectors. We present numerical evidence that the concurrence and mutual information harvested by the detectors are qualitatively similar to those in Rindler spacetime, but they exhibit a small yet noticeable variation when the energy pulse created by the quench crosses the detectors. These findings provide further motivation to implement the experimental proposal of Rodríguez-Laguna et al.",
New submissions,Hamiltonian equations of motion of quadratic gravity,Jorge Bellorin,General Relativity and Quantum Cosmology (gr-qc); High Energy Physics - Theory (hep-th),"We compute explicitly the equations of motion of the Hamiltonian formulation of quadratic gravity. This is the theory with the most general Lagrangian with terms of quadratic order in the curvature tensor. We employ the symbolic computational tool Cadabra. We present the linearized version of the equations of motion, performing the longitudinal-transverse decomposition. We compare the linear equations with the covariant field equations, finding that, if general-relativity terms are active, the linear Hamiltonian formulation is valid only if the perturbative spatial metric is traceless, a condition that can be freely imposed by recurring to an arbitrary function. We apply the equations of motion on homogeneous and isotropic configurations, finding explicit solutions.",
New submissions,Charged scalar boson in Melvin universe,"L. G. Barbosa,L. C. N. Santos,J. V. Zamperlini,F. M da Silva,C. C. Barros Jr",General Relativity and Quantum Cosmology (gr-qc),"This work investigates the dynamics of a charged scalar boson in the Melvin universe by solving the Klein-Gordon equation with minimal coupling in both inertial and non-inertial frames. Non-inertial effects are introduced through a rotating reference frame, resulting in a modified spacetime geometry and the appearance of a critical radius that limits the radial domain of the field. Analytical solutions are obtained under appropriate approximations, and the corresponding energy spectra are derived. The results indicate that both the magnetic field and non-inertial effects modify the energy levels, with additional contributions depending on the coupling between the rotation parameter and the quantum numbers. A numerical analysis is also presented, illustrating the behavior of the solutions for two characteristic magnetic field scales: one that may be considered extreme, of the order of the ones proposed to be produced in heavy-ion collisions and another near the Planck scale.",
New submissions,Scalar Particles on embedded submanifolds,"Li Wang,Jun Wang",General Relativity and Quantum Cosmology (gr-qc); Mathematical Physics (math-ph); Quantum Physics (quant-ph),"We derive Klein-Gordon equation and Schrödinger equation on curved manifolds embedded in high-dimensional manifolds to describe the motion of constrained spineless particles. We start from the equations on the main manifold and obtain the effective equations on the submanifold by degenerate additional dimensions. A geometric induced potential appears in ourthis http URLreviewed the previous works of others and our results are consistent in the special case they calculated,We focused on discussing our results under general conditions and obtained a connection between differential geometry andthis http URLthe influence of peripheral manifolds on submanifold physics is somewhatthis http URLhave analyzed several explicit examples, presenting an elucidation of the interactions between the submanifold and matter fields. In one specific case, our approach derived the mass term of scalar fields on a lower-dimensional manifold through purely geometric induction. This mass term coincides with that in Kaluza-Klein theory, yet was achieved without invoking any periodic compactification constraints.",
New submissions,Butterfly in Spacetime: Inherent Instabilities in Stable Black Holes,"Zhan-Feng Mai,Run-Qiu Yang",General Relativity and Quantum Cosmology (gr-qc); High Energy Physics - Theory (hep-th),"This paper numerically studies the time evolution of s-wave scalar probe field in a black hole of which the event horizon is surrounded by matter. As a toy model, it encodes the effects of matter into deformations of Regge-Wheeler potential. It considers three different types of local deformations in the vicinity of the event horizon, the negative static bump potential, the stochastic potential and bump potential modulated by time function in low frequency limit. Our numerical results show that infinitesimal local deformations on Regge-Wheeler potential near the horizon can overturn stability of an arbitrarily strongly stable black hole, implying that late-time behavior of a stable black hole is extremely sensitive to geometry near horizon. Specially, certain deformations that stabilize systems in flat backgrounds can destabilize otherwise stable black holes. It also shows that horizon-induced redshift transforms near-horizon quantum fluctuations into classical-scale stochastic deformations capable of triggering instability, implying that even an isolated black hole cannot keep stable in extended timescales.",
New submissions,Open quantum battery in the background of a three-dimensional rotating black hole,"Xiaofang Liu,Zehua Tian,Jieci Wang",General Relativity and Quantum Cosmology (gr-qc); Quantum Physics (quant-ph),"We investigate the charging performance of a quantum battery (QB) coupled to a scalar field under the background of a three-dimensional rotating black hole. It is shown that under Dirichlet boundary conditions, when the QB's energy level spacing is smaller than the charging amplitude, the black hole rotation enhances the charging performance at finite times, whereas in other parameter regimes, it degrades the charging performance. Notably, as the black hole approaches extremal rotation, charging performance undergoes significant amplification or suppression, depending on the parameter regime. This indicates that the performance of QBs can probe critical properties of black holes. Additionally, regarding the energy flow in QB, it is further demonstrated that the energy extraction from vacuum fluctuations via dissipation, and rotation suppresses the QB's capacity to extract this energy. Our findings not only advance the relativistic dissipation dynamics of QBs but also propose a novel method to detect black hole rotation and extremal-state transitions.",
New submissions,Absence of curvature singularities in symmetric perfect fluid spacetimes in Einstein-Gauss-Bonnet Gravity,"Aavishkar Madhunlall,Chevarra Hansraj,Rituparno Goswami,Sunil D. Maharaj",General Relativity and Quantum Cosmology (gr-qc),"In this paper we study the higher dimensional homogeneous and isotropic perfect fluid spacetimes in Einstein-Gauss-Bonnet (EGB) gravity. We solve the modified field equations with higher order curvature terms to determine the evolution of the scale factor. We transparently show that this scale factor cannot become smaller than a finite minimum positive value which depends on the dimension and equation of state. This bound completely eliminates any curvature singularities in the spacetimes, where the scale factor must tend to zero. This is a unique property of EGB gravity which, despite being ghost-free and having quasi-linear field equations like general relativity, allows for the violation of singularity theorems. This phenomenon, thus, gives a natural way to dynamically construct regular black holes via higher dimensional continual gravitational collapse.",
New submissions,"$f(R, G, T)$ Gravity: Cosmological Implications and Dynamical System Analysis","Ratul Mandal,Himanshu Chaudhary,Tiberiu Harko,Ujjal Debnath,G. Mustafa",General Relativity and Quantum Cosmology (gr-qc),"We consider the cosmological implications of a four-dimensional extension of the Gauss-Bonnet f(G) gravity, where $G$ is the Gauss-Bonnet topological invariant, in which the Einstein-Hilbert action is replaced by an arbitrary function $f(R,G,T)$ of G, of the Ricci scalar $R$, and of the trace $T$ of the matter energy-momentum tensor. By construction, the extended Gauss-Bonnet type action involves a non-minimal coupling between matter and geometry. The field equations of the model are obtained by varying the action with respect to the metric. The generalized Friedmann equations, describing the cosmological evolution in the flat Friedmann-Lemaitre-Robertson-Walker geometry, are also presented in their general form. We investigate the cosmological evolution of the Universe in the generalized Einstein-Gauss-Bonnet theiry for a specific choice of the Lagrangian density, as given by $f(R, G, T) = \alpha_1 G + \alpha_2 R^{\beta} - 2\alpha_3 \sqrt{-T}$, where $\alpha_i$ (for $i = 1, 2, 3$) are model parameters. First, the theoretical predictions of the model are compared with a set of observational data (Cosmic Chronometers, Type IA Supernovae, Baryon Acoustic Oscillations) via an MCMC analysis, which allows us to obtain constraints on the model parameters. A comparison with the predictions of the $\Lambda$CDM system is also performed. Next, the generalized Friedmann equations are reformulated as a dynamical system, and the properties of its critical points are studied by using the Lyapunov linear stability analysis. This investigation allows for the reconstruction of the Universe's history in this model, from the early inflationary era to the late accelerating phase. The statefinder diagnostic parameters for the model are also considered from the dynamical system perspective.",
New submissions,Gravitational collapse of Matter in the presence of Scalar field Dark energy,"Priyanka Saha(1),Dipanjan Dey(2),Kaushik Bhattacharya(1) ((1) Department of Physics, Indian Institute of Technology, Kanpur India, (2) Department of Mathematics and Statistics, Dalhousie University, Halifax, Nova Scotia, Canada)",General Relativity and Quantum Cosmology (gr-qc),"This study examines the gravitational collapse of an overdense dark matter region in a coupled scalar field dark energy scenario within a flat FLRW background. It finds that, depending on the initial conditions, some overdense regions avoid collapse and expand eternally with the background. The interior overdense region follows a closed FLRW metric, while its boundary is described by generalized Vaidya spacetime, which allows flux across the boundary while preserving the homogeneity of dark energy inside. Dark matter evolves as cold dark matter, but in non-minimal coupling, the modified Klein-Gordon equation alters dark energy evolution. The results highlight the impact of coupled dark energy on dark matter virialization and cosmic structure formation.",
New submissions,Cosmic Jets in General Relativity,Bahram Mashhoon,General Relativity and Quantum Cosmology (gr-qc),"In certain general relativistic time-dependent gravitational fields, free test particles can asymptotically line up relative to fiducial static observers and produce a cosmic jet whose speed approaches the speed of light. Two scenarios for the formation of these purely gravitational jets have thus far been theoretically demonstrated: the double-jet collapse scenario and the wave scenario that involves both a cosmic jet in the general direction of wave propagation as well as a counterjet in the opposite direction. These scenarios are briefly reviewed in this paper. Moreover, to elucidate the process of jet formation in these scenarios, we study the propagation of scalar fields in related gravitational fields in connection with the correspondence between the scalar wave perturbations and the motion of free test particles and null rays.",
New submissions,Spatial Correlation between Pulsars from Interfering Gravitational-Wave Sources in Massive Gravity,"Yu-Mei Wu,Yan-Chen Bi,Qing-Guo Huang",General Relativity and Quantum Cosmology (gr-qc); Cosmology and Nongalactic Astrophysics (astro-ph.CO),"In the nanohertz band, the spatial correlations in pulsar timing arrays (PTAs) produced by interfering gravitational waves (GWs) from multiple sources likely deviate from the traditional ones without interference under the assumption of an isotropic Gaussian ensemble. This work investigates the impact of such interference within the framework of massive gravity. Through simulations, we show that while the resulting correlation patterns can be described by Legendre expansions with coefficients that depend on the interference configuration, they remain predominantly quadrupolar (l = 2), with this feature becoming more pronounced as the graviton mass increases--reflecting both the tensorial polarizations and the modified GW dispersion. However, the interference introduces significant variability in the angular correlation, making it difficult to distinguish massive gravity from general relativity based on a single realization of the Universe. We conclude that beyond a fundamental constraint set by the PTA observation time, achieving a substantially tighter bound on the graviton mass is statistically challenging and observationally limited under realistic conditions.",
New submissions,Polymer Geodesic Motion in Schwarzschild Spacetime,"Lorenzo Boldorini,Corrado Marzano,Giovanni Montani",General Relativity and Quantum Cosmology (gr-qc); High Energy Physics - Phenomenology (hep-ph),"In this paper we will study the geodesic motion of massive particles, in a Schwarzschild background, with a semi-classical quantum framework called ""Polymer Quantum Mechanics"" (PQM) in order to investigate the black hole phenomenology resulting from this formulation, which accounts for Planckian scale physics. In particular we studied two main scenarios, being the radial in-fall and circular orbits and their stability. In this framework, we built an effective Hamiltonian taking into account the polymer quantum effects, altering the classical equations of motion with Planckian scale corrections. As a main result, we obtained the existence of a classically forbidden region surrounding the event horizon, preventing particles from crossing it. Additionally, we discovered the presence of stable circular orbits below both the classical Innermost Stable Circular Orbit (ISCO) and the horizon (corresponding to closed time-like geodesics).",
New submissions,The stochastic gravitational wave background from QCD phase transition in the framework of higher-order GUP,"Zhong-Wen Feng,Long-Xiang Li,Shi-Yu Li",General Relativity and Quantum Cosmology (gr-qc),"We investigate the stochastic gravitational wave background generated by a first-order cosmological QCD phase transition in the early universe, within the framework of a new higher-order generalized uncertainty principle. This model predicts a minimal length scale for both positive and negative values of the deformation parameter $\beta$. However, our analysis shows that only positive $\beta$ leads to physically viable stochastic gravitational wave background spectra. We derive generalized uncertainty principle induced corrections to the radiation energy density and the Hubble expansion rate and analyze their impact on the resulting stochastic gravitational wave background signal. The results indicate that an increase in $\beta$ leads to a redshift in the peak frequency and a modest enhancement in the energy density. Finally, we examine the detectability of these modified signals by comparing them with the sensitivity curves of current and upcoming pulsar timing arrays. Our findings suggest that the stochastic gravitational wave background signal for positive $\beta$ values can be probed by observatories such as SKA, IPTA, and NANOGrav, offering a potential avenue for testing the effects of quantum gravity effects.",
Cross submissions,Thermodynamics of dyonic black holes in non-linear electrodynamics,"Lewis Croney,Ruth Gregory,Carlos J. Ramírez-Valdez",High Energy Physics - Theory (hep-th); General Relativity and Quantum Cosmology (gr-qc),"We investigate dyonic black holes in a weak field expansion of non-linear electrodynamics. The breadth of parameter space permits a rich thermodynamic structure, additional turning points and intricate phase phenomena. Energy conditions are employed to ensure the physical viability of solutions. Analytic special cases illustrate novel properties of black holes in non-linear electrodynamics, including modified extremal limit behaviour. Numerical solutions offer the most elaborate thermodynamic landscape, culminating in up to five turning points, and multiple reentrant phase transitions.",
Cross submissions,Momentum-space Metric Tensor from Nonadiabatic Evolution of Bloch Electrons,Yafei Ren,Materials Science (cond-mat.mtrl-sci); Mesoscale and Nanoscale Physics (cond-mat.mes-hall); General Relativity and Quantum Cosmology (gr-qc),"We reveal a fundamental geometric structure of momentum space arising from the nonadiabatic evolution of Bloch electrons. By extending semiclassical wave packet theory to incorporate nonadiabatic effects, we introduce a momentum-space metric tensor -- the nonadiabatic metric. This metric gives rise to two velocity corrections, dubbed geometric and geodesic velocities, providing a unified and intuitive framework for understanding nonlinear and nonadiabatic transport phenomena beyond Berry phase effects. Furthermore, we show that the nonadiabatic metric endows momentum space with a curved geometry, recasting wave packet dynamics as forced geodesic motion. In this picture, the metric defines distances, the Berry connection acts as a gauge potential, band dispersion serves as a scalar potential, and the toroidal topology of the Brillouin zone imposes periodic boundary conditions. When the nonadiabatic metric is constant, it reduces to an effective mass, allowing electrons to behave as massive particles in flat bands. In a flat Chern band with harmonic attractive interactions, the two-body wave functions mirror the Landau-level wave functions on a torus.",
Cross submissions,Emergent Holographic Spacetime from Quantum Information,Tadashi Takayanagi,High Energy Physics - Theory (hep-th); Strongly Correlated Electrons (cond-mat.str-el); General Relativity and Quantum Cosmology (gr-qc); Quantum Physics (quant-ph),"Holographic duality describes gravitational theories in terms of quantum many-body systems. In holography, quantum information theory provides a crucial tool that directly connects microscopic structures of these systems to the geometries of gravitational spacetimes. One manifestation is that the entanglement entropy in quantum many-body systems can be calculated from the area of an extremal surface in the corresponding gravitational spacetime. This implies that a gravitational spacetime can emerge from an enormous number of entangled qubits. In this Essay, I will discuss open problems in this area of research, considering recent developments and outlining future prospects towards a complete understanding of quantum gravity. The first step in this direction is to understand what kind of quantum circuits each holographic spacetime corresponds to, drawing on recent developments in quantum complexity theories and studying concrete examples of holography in string theory. Next, we should extend the concept of holography to general spacetimes, e.g., those spacetimes which appear in realistic cosmologies, by utilizing the connections between quantum information and holography. To address the fundamental question of how time emerges, I will propose the concepts of pseudo-entropy and time-like entanglement as a useful tool in our exploration.",
Cross submissions,The $α$-Attractor E-Model in Warm Inflation: Observational Viability from Planck 2018,"Bhargabi Saha,Malay K. Nandy",Cosmology and Nongalactic Astrophysics (astro-ph.CO); General Relativity and Quantum Cosmology (gr-qc); High Energy Physics - Phenomenology (hep-ph),"We explore the inflationary evolution and observational viability of the $\alpha$-attractor E-model in the framework of warm inflation, focusing on both weak and strong dissipative regimes, with a dissipation coefficient linear in temperature. In the strong regime, we account for the growth of inflaton fluctuations due to coupling with the radiation bath via two different forms for the dissipation enhancement function: one associated with plateau-like potentials, and another motivated by the warm little inflation scenario. Employing slow roll conditions, we analytically derive the expressions for the key inflationary observables, the spectral index $n_s$ and the tensor-to-scalar ratio $r$, in both dissipative regimes. The resulting theoretical trajectories on the $n_s$--$r$ plane are then juxtaposed with the contour plots obtained from Planck 2018 data in order to constrain the model parameter. Our analysis shows that the warm $\alpha$-attractor E-model remains compatible with observations in both dissipative regimes, with dissipation playing a crucial role in shifting the predictions and enlarging the viable parameter space, highlighting observational robustness of the model when extended to warm inflation.",
Cross submissions,Primordial Black Holes Save $R^2$ Inflation,"Kazunori Kohri,Xinpeng Wang",Cosmology and Nongalactic Astrophysics (astro-ph.CO); General Relativity and Quantum Cosmology (gr-qc); High Energy Physics - Phenomenology (hep-ph),"In light of the latest Planck-Atacama Cosmology Telescope (P-ACT) joint results on the primordial scalar power spectrum, we show that the $R^2$ inflation model extended with a non-minimally coupled scalar field $\chi$--namely the $R^2$-Higgs model--can yield a larger spectral index $n_s$ and a small positive running $\alpha_s$ at cosmic microwave background (CMB) scales, which are consistent with the data. This is because the $\chi$ field contributes a blue-tilted component to the primordial power spectrum which both modifies the large-scale power and, as a result, significantly enhances power on small scales. The consequent enhancement be large enough to lead to the formation of primordial black holes (PBHs) of mass $\lesssim 10^{20}\mathrm{g}$, accounting for all of the dark matter. Furthermore, future observations of the small-scale power spectrum, CMB spectral distortions, and stochastic gravitational waves will provide decisive tests of this model and its predictions for PBHs.",
Cross submissions,Quantum cosmological perturbations in bouncing models with mimetic dark matter,"Idaiane L. Machado,Dêivid R. da Silva,Nelson Pinto-Neto",Cosmology and Nongalactic Astrophysics (astro-ph.CO); General Relativity and Quantum Cosmology (gr-qc); High Energy Physics - Theory (hep-th),"We calculate the power spectrum of cosmological perturbations originated from quantum vacuum fluctuations in bouncing scenarios proposed in Ref.~\cite{chamseddine2014cosmology} in the framework of mimetic cosmology. We show that all physically relevant models produce scale invariant spectral indices, and amplitudes compatible with observations provided that the bounce occurs at length scales $t_0$ inside the physically reasonable interval $10^5 l_p < t_0 < 10^9 l_p$. We also show that by slightly modifying the scalar field potential proposed in Ref.~\cite{chamseddine2014cosmology}, we can also obtain the observed red-tilted spectral index, with the same amplitude constraints. Hence, mimetic cosmology provides reasonable bouncing cosmological models without the need of any background quantum effect.",
