Heading,Title,Authors,Subjects,Abstract,PDF
New submissions,Quantum Particle Creation by Cosmic Strings in de Sitter Spacetime,"Bilgehan Baris Oner,Ozlem Yesiltas",General Relativity and Quantum Cosmology (gr-qc); High Energy Astrophysical Phenomena (astro-ph.HE),"This paper explores the phenomenon of particle creation associated with cosmic strings in de Sitter spacetime, a model that represents the universe exponential expansion. We examine how the presence of cosmic strings in a de Sitter background affects particle production, focusing on the roles of string tension and angular deficits. Utilizing the Klein Gordon equation adapted to curved spacetime with cosmic string defects, we derive solutions expressed through hypergeometric functions to describe particle states. Our findings highlight how string properties influence particle creation rates and energy distributions. By analyzing both point-like and linear potentials near the string, we determine exact solutions, investigate asymptotic behaviors, and calculate particle creation probabilities using Bogoliubov transformations.",
New submissions,Observer in quantum cosmology,"Natalia Gorobey,Alexander Lukyanenko,Alexander V. Goltsev",General Relativity and Quantum Cosmology (gr-qc); High Energy Physics - Experiment (hep-ex),"Within the framework of the new formalism of quantum theory - the quantum principle of least action - the initial state of the universe is determined, which is an analogue of the Hartle-Hawking no-boundary wave function. The quantum evolution of the universe is modified by an additional condition in a certain compact region of space-time, which is called the observation region. The additional condition is the covariant conservation law of the energy-momentum tensor of matter. The consequence of this is the deterministic nature of the motion of the energy and momentum densities of matter in the observation region. The geometric parameters of the region boundary are also determined by the deterministic motion of the matter fields inside. The choice of boundary conditions for the energy-momentum flow at the boundary serves as a mechanism for decoherence of the quantum evolution of the universe. The result of decoherence is a certain correspondence of the final state of the universe, including its norm, to the state of the observer in the specified region. It is proposed to use the norm of the final state as an action functional in quantum cosmology, which determines the world history of the universe as it is seen by the observer.",
New submissions,"Reconstructing cosmic expansion in $f(R, G)$ gravity using a log-periodic deceleration model","Amit Samaddar,S. Surendra Singh",General Relativity and Quantum Cosmology (gr-qc),"We study the late-time cosmology in $f(R, G)=R+\alpha R^{2}+\beta e^{\gamma G}$, using a logarithmic parametrization of the deceleration parameter $q(z)=q_{0}+q_{1}sin[log(1+z)]$. The Hubble parameter $H(z)$ is reconstructed and model parameters are constrained via MCMC analysis using CC ($31$), BAO ($26$) and Pantheon+SHOES ($1701$) datasets. Our results yield a Hubble constant in the range $H_0 = 71.7$--$72.8$ km/s/Mpc, consistent with late-time observations. The present deceleration parameter is found to be $q_{0}=-0.484$ to $-0.517$, while the evolution parameter $q_{1}\approx 1$, indicating increasing acceleration. The transition redshift shifts from $z_{tr}=0.879$ (CC) to $0.744$ (CC+BAO+Pantheon+SHOES), supporting a dynamic acceleration phase. The model reproduces early radiation behavior with $\omega (z>>1) \approx 0.33$ and predicts present-day values $\omega_{0} \approx -0.49$. Energy conditions NEC and DEC are satisfied, while SEC is violated at late times. The statefinder parameters $\{r_0, s_0\} = (0.866, 0.046)$ lie near the $\Lambda$CDM point. Estimated age of the Universe ranges from $13.01$ to $13.59$ Gyr. Thermodynamic analysis confirms consistency with the generalized second law. Overall, the model offers a viable and observationally consistent description of cosmic acceleration.",
New submissions,"Cosmological insights from an exponential $Om(z)$ function in $f(T,T_{G})$ gravity framework","Amit Samaddar,S. Surendra Singh",General Relativity and Quantum Cosmology (gr-qc),"We examine a modified teleparallel gravity model defined by $f(T,T_{G})=T+\gamma\sqrt{T_{G}}+\delta\sqrt{T}$ by introducing an exponential $Om(z)$ diagnostic of the form $Om(z)=\alpha e^{\frac{z}{1+z}}+\beta$. This novel form captures smooth redshift evolution and allows for a flexible, model-independent probe of dark energy dynamics. We derive a Hubble function from this expression and use MCMC analysis with $31$ CC, $26$ BAO and $1701$ Pantheon+ data points to constrain the model parameters. The best-fit results yield $H_{0} \in [68.46, 77.38]$km/s/Mpc for $\alpha \in [-0.232, -0.068]$ and $\beta \in [0.218, 0.560]$ which is consistent with local $H_{0}$ values. Our model predicts a transition redshift $z_{tr} \approx (0.48-0.54)$, present $q_{0}\approx -0.34$, and $\omega_{0}\approx-0.33$. It satisfies NEC and DEC, closely tracks $\Lambda$CDM in the statefinder plane and estimates a cosmic age of $(13.28-13.87)$ Gyr which confirms its strength in explaining late-time acceleration. Our findings demonstrate that the exponential $Om(z)$ parameterization provides a robust and insightful approach to trace dark energy evolution within modified gravity frameworks.",
New submissions,Constraint instabilities in first-order viscous relativistic fluids,"Delfina Fantini,Marcelo E. Rubio",General Relativity and Quantum Cosmology (gr-qc),"Relativistic hydrodynamics provides a solid framework for evolving matter and energy in a wide variety of phenomena. Nevertheless, the inclusion of dissipative effects in realistic scenarios through causal, stable, and well-posed theories still constitutes an open problem. In this paper, we point out that the first-order reduction originally proposed by Bemfica, Disconzi, Noronha and Kovtun (BDNK) for proving the local well-posedness of conformally-invariant viscous fluids in Sobolev spaces, admits a set of differential constraints which do not propagate along evolution. To see so, we first show analytically that this is the case for uniform-velocity configurations. Motivated by this result, we perform numerical simulations of the BDNK first-order reduction restricted to plane-symmetric configurations in Minkowski spacetime. We report on initial data sets which satisfy the constraints, but display exponential grow at early times. Thus, although the principal part of the reduction is diagonalizable with real eigenvalues --as proved by BDNK--, the corresponding differential constraints appearing from it are not conserved along evolution. This result suggests that an alternative path is needed to prove the strong-hyperbolicity for the conformal version of the theory.",
New submissions,Stability and collisions of excited spherical boson stars: glimpses of chains and rings,"Marco Brito,Carlos Herdeiro,Eugen Radu,Nicolas Sanchis-Gual,Miguel Zilhão",General Relativity and Quantum Cosmology (gr-qc),"Scalar, spherically symmetric, radially excited boson stars were previously shown to be stabilized, against spherical dynamics, by sufficiently strong self-interactions. Here, we further test their stability now in a full 3+1D evolution. We show that the stable stars in the former case become afflicted by a non-spherical instability. Then, we perform head-on collisions of both (stable) fundamental and (sufficiently long-lived) excited boson stars. Depending on the stars chosen, either a black hole or a bosonic remnant are possible. In particular, collisions of excited stars result in a bosonic bound state which resembles a dynamical superposition of chains and rings, akin to the ones found as equilibrium solutions in Liang:2025myf. These evolutions emphasize a key difference concerning the dynamical robustness of fundamental vs. excited spherical boson stars, when generic (beyond spherical) dynamics is considered.",
New submissions,New Methods for Offline GstLAL Analyses,"Prathamesh Joshi,Leo Tsukada,Chad Hanna,Shomik Adhicary,Debnandini Mukherjee,Wanting Niu,Shio Sakon,Divya Singh,Pratyusava Baral,Amanda Baylor,Kipp Cannon,Sarah Caudill,Bryce Cousins,Jolien D. E. Creighton,Becca Ewing,Heather Fong,Richard N. George,Patrick Godwin,Reiko Harada,Yun-Jing Huang,Rachael Huxford,James Kennington,Soichiro Kuwahara,Alvin K. Y. Li,Ryan Magee,Duncan Meacher,Cody Messick,Soichiro Morisaki,Alexander Pace,Cort Posnansky,Anarya Ray,Surabhi Sachdev,Stefano Schmidt,Urja Shah,Ron Tapia,Koh Ueno,Aaron Viets,Leslie Wade,Madeline Wade,Zach Yarbrough,Noah Zhang",General Relativity and Quantum Cosmology (gr-qc); Instrumentation and Methods for Astrophysics (astro-ph.IM),"In this work, we present new methods implemented in the GstLAL offline gravitational wave search. These include a technique to reuse the matched filtering data products from a GstLAL online analysis, which hugely reduces the time and computational resources required to obtain offline results; a technique to combine these results with a separate search for heavier black hole mergers, enabling detections from a larger set of gravitational wave sources; changes to the likelihood ratio which increases the sensitivity of the analysis; and two separate changes to the background estimation, allowing more precise significance estimation of gravitational wave candidates. Some of these methods increase the sensitivity of the analysis, whereas others correct previous mis-estimations of sensitivity by eliminating false positives. These methods have been adopted for GstLAL's offline results during the fourth observing run of LIGO, Virgo, and KAGRA (O4). To test these new methods, we perform an offline analysis over one chunk of O3 data, lasting from May 12 19:36:42 UTC 2019 to May 21 14:45:08 UTC 2019, and compare it with previous GstLAL results over the same period of time. We show that cumulatively these methods afford around a 50% - 100% increase in sensitivity in the highest mass space, while simultaneously increasing the reliability of results, and making them more reusable and computationally cheaper.",
New submissions,Lecture Notes in Loop Quantum Gravity. LN3: Boundary equations for Ashtekar-Barbero-Immirzi model,"L.Fatibene,A.Orizzonte",General Relativity and Quantum Cosmology (gr-qc),"We shall here perform the canonical analysis of field equations of ABI model in order to determine constraint equations. We shall show that one can use algebraic constraints in the covariant framework to fix $k^i$ as a function of the frame and obtain a model where $(A^i_a, E_i^a)$ is a pair of independent fields which are also a pair of conjugated fields.We shall not impose any relation on Immirzi parameter $\beta$ and Holst parameter $\gamma$, still constraint equations will depend on $\beta$ only and they agree with standard result of LQG which are obtained by a suitable canonical transformation on a leaf of the ADM foliation used to define a Hamiltonian framework. We eventually state the scheme for quantization that will be discussed in the following lecture notes.",
New submissions,Reducing the irreducible: the charged black hole bomb in a moving cavity,"Nicolas Sanchis-Gual,Alejandro Belchí,Carlos Herdeiro,José A. Font",General Relativity and Quantum Cosmology (gr-qc),"We revisit the charged black hole bomb by numerically solving the fully non-linear Einstein-Maxwell-(charged, complex) Klein-Gordon system with a moving mirror. By dynamically varying the cavity size, we find that the system evolves toward new hairy black hole equilibria. Expanding the mirror radius enhances superradiant extraction, increasing both the scalar field charge and the black hole's irreducible mass. Remarkably, on the other hand, shrinking the cavity size has the opposite effect: the black hole is able to reduce its irreducible mass as more charge than energy flows back from the field, without violating charge conservation or energy conditions. As a consistency check, in the limit of a vanishing cavity, we find that the system returns to the original Reissner-Nordström configuration. We discuss the implications of these findings for black hole thermodynamics in confined configurations where superradiant modes exist and the limitations of this setup, particularly in relation to Hawking's black hole area theorem.",
New submissions,Black-hole hair from vector dark matter accretion,"Fredric Hancock,Helvi Witek",General Relativity and Quantum Cosmology (gr-qc); High Energy Astrophysical Phenomena (astro-ph.HE); High Energy Physics - Theory (hep-th),"We model a single black hole in equilibrium with a dark photon-cold dark matter environment. Representing the dark photon as a Proca field, we show that a Schwarzschild black hole grows vector-field ""hair"" when allowed to accrete from an infinite homogeneous bath of particles far from the horizon. We solve the Proca equation in linear perturbation theory, separating it using the vector spherical harmonics and Frolov-Krtouš-Kubizňák-Santos approaches for the odd-parity and even-parity sectors, respectively. In the ""particle"" dark matter regime, the field is purely infalling and exhibits a sharply peaked density profile, in concordance with the particle dark matter ""spikes"" studied in the literature. In the ""wave"" regime, the field exhibits standing waves, and the profile is smeared. We find a dark-matter density amplification upward of $10^7$ near the horizon. Though small for most black holes, we find the mass enclosed in the cloud can reach $\sim 1 \%$ of the black hole mass for large supermassive black holes. These black holes are also most susceptible to vector dark matter accretion, with mass accretion rates as large as $10 M_\odot/$yr.",
New submissions,Time Delay of Pulsar Signals in Astrophysical Black Hole Spacetimes,"Parth Bambhaniya,Viraj Kalsariya,Saurabh,Elisabete M. de Gouveia Dal Pino,Ivan De Martino,Riccardo Della Monica,Mariafelicia De Laurentis",General Relativity and Quantum Cosmology (gr-qc),"In this paper, we investigate the fully relativistic time delay of pulsar signals propagating in the vicinity of a rotating black hole and its potential mimickers, including a deformed Kerr black hole and the Janis-Newman-Winicour naked singularity. We aim to compute and compare the pulsar time delays caused by different spacetime geometries to explore possible observational signatures that distinguish between black holes and their alternatives. We begin by solving the equations of motion for null geodesics in these background geometries. Subsequently, we address the emitter-observer problem to compute the time delay of pulsar signals in Kerr, deformed Kerr, and JNW spacetimes. A comparative analysis between Schwarzschild and Kerr black holes allows us to observe the effect of spin on propagation delay in pulsar timing. Further, we examine the impact of the deformation parameter in the deformed Kerr black hole and the influence of the scalar field on the rotating JNW spacetime. Our study considers both direct and indirect photons emitted by a source in the equatorial circular orbit. We find that the variations in the spin parameter show very small but detectable changes when we compare the time delay cases of a Kerr black hole with deformed Kerr and rotating JNW spacetimes. Our pulsar time delay results suggest a potential observable distinguishing feature of these astrophysical black hole geometries which could be useful for the forthcoming observational facilities such as Square Kilometer Array Observatory, Five-hundred-meter Aperture Spherical Telescope and Event Horizon Telescope.",
New submissions,The de Sitter Weak Gravity Conjecture from 3-Form Black Holes and Inflation with Higher-Derivative Corrections,"Nutthaphat Lunrasri,Chakrit Pongkitivanichkul",General Relativity and Quantum Cosmology (gr-qc); High Energy Physics - Theory (hep-th),"We investigate the interplay between the de Sitter (dS) Weak Gravity Conjecture (WGC) and slow-roll inflation within a framework governed by a 3-form gauge field. Starting from classical considerations, we derive an upper bound on the mass of extremal charged black holes in dS spacetime which constrains the admissible parameter space. To incorporate quantum gravity effects, we introduce higher-derivative corrections to the 3-form action and obtain additional bounds on these terms, ensuring consistency with swampland criteria. We further analyze these corrections from a thermodynamic perspective, confirming that the Wald entropy remains compatible with the classical extremality bound. Extending this setup to cosmological inflation, we examine the scalar dual of the 3-form in both large-field and small-field regimes. In the large-field limit, the potential acquires a Higgs-like structure that supports slow-roll inflation. In contrast, the small-field limit leads to an effective potential with an AdS minimum, rendering it inconsistent with the dS swampland constraints. Notably, we find that the dS WGC can impose constraints more stringent than those derived from inflationary dynamics alone. These results underscore the utility of swampland-inspired principles in shaping viable models of early universe cosmology.",
New submissions,Across the Horizon: On Gravitational Wave Flux Laws and Tests of Gravity,David Maibach,General Relativity and Quantum Cosmology (gr-qc),"Motivated by the first detection of gravitational waves, this dissertation develops analytical, numerical, and data analysis techniques to address persistent blind spots in our understanding of gravity. Beginning with asymptotically flat spacetimes and the geometry of null geodesic congruences, the derivation of the shear tensor--encoding gravitational radiation--is revisited. The covariant phase space formulation of General Relativity is then employed to derive a non-conservation law associated with the symmetry group at null infinity, generalizing prior constructions of radiative phase space and yielding consistent results. These flux laws are used to derive constraint equations that enable the evaluation and comparison of state-of-the-art numerical waveform models, leading to new insights and a robust algorithm for benchmarking future improvements. These flux laws are further applied to compute quantum corrections to gravitational waveforms arising from the gravitational wave echo effect. Two leading phenomenological scenarios involving echoes from binary black hole mergers are analyzed. The structure of both the primary echo signal and its induced corrections to nonlinear features of the waveform are studied for observability by the upcoming LISA mission. The results indicate that LISA could detect such signals, potentially probing black hole area quantization. Finally, motivated by recent hints of a stochastic gravitational wave background from Pulsar Timing Array data, this work reviews its theoretical basis and studies several astrophysical and cosmological source scenarios. A forecast for detection prospects with LISA is presented using a modern data analysis pipeline. The results suggest LISA will constrain the extra-galactic stochastic background to a spectral energy density below $ \Omega_\text{GW} \lesssim 10^{-8}$.",
New submissions,AthenaK simulations of the binary black hole merger GW150914,"David Radice,Rossella Gamba,Hengrui Zhu,Alireza Rashti",General Relativity and Quantum Cosmology (gr-qc),"We present new binary black hole simulations targeted to GW150914 using the GPU-accelerated code \texttt{AthenaK}. We compute the properties of the final remnant with the isolated horizon formalism and obtain gravitational-waveforms at future null infinity via Cauchy characteristic extraction. We compare our results with those obtained by the Simulating eXtreme Spacetimes (SXS) and Rochester Institute of Technology (RIT) groups, targeted to the same event. We find excellent agreement in the remnant mass, spin, and recoil velocity. For the dominant $(\ell,m)=(2,2)$ mode of the gravitational-wave signal we find maximum dephasing of $\Delta \phi \simeq 0.35$ and amplitude difference of $\Delta A/A \simeq 0.4\%$. We use our newly computed waveform to re-analyze the GW150914 data and find posteriors for chirp mass, luminosity distance, and inclination that are broadely consistent with those obtained using semi-analytic waveform models. This work demonstrates the viability of \texttt{AthenaK} for many-orbits binary black hole merger simulations. A step-by-step tutorial, including all necessary input files and analysis scripts to reproduce our results, is available on \texttt{GitHub}.",
New submissions,Correspondence between new agegraphic and Bose-Einstein condensate dark matter in the context of $f(T)$ gravity,Alireza Amani,General Relativity and Quantum Cosmology (gr-qc); High Energy Physics - Theory (hep-th); Mathematical Physics (math-ph),"In this paper, we study the universe in the context of $f(T)$ gravity with flat-FRW background and consider it to be a combination of three components: baryonic matter, dark matter, and dark energy. We consider the new agegraphic as an alternative for dark energy and the Bose-Einstein condensation (BEC) as an alternative for dark matter. After that, first we obtain the Friedman equations and then we obtain the continuity equations in the presence of the interaction term between the dark components of the universe, so that the interaction term is considered as the flow of energy from dark matter to dark energy. In what follows, we plot the variation of the cosmological parameters of dark energy in terms of the redshift parameter by using of the power-law cosmology. Finally, we investigate the evolution and stability of the universe and report the values of the density parameters of the universe components that confirm the present model with observational data.",
New submissions,Phase Diffusion of Light Immersed In Quantum Tides: Open Quantum System Approach,"Fateme Shojaei Arani,Brahim Lamine,Alain Blanchard,Malek Bagheri Harouni",General Relativity and Quantum Cosmology (gr-qc),"The interaction between quantum gravitational waves (GWs) and electromagnetic (EM) fields is investigated within the open quantum system formalism, where GWs are considered as a heat bath reservoir occupying a generic state $\hat{\rho}_{\text{gws}}$. Following the quantum Langevin equations, it turns out that the correlations of the Langevin noise operator associated with the GW background directly determine the statistical properties of the EM phasor $\phi(t)$. We apply this formalism to the background of inflationary-generated primordial gravitational waves (PGW). Since this background has an astronomically large correlation time, of the order of the Hubble time $H_0^{-1}$, we show that it leads to a non-Markovian dynamics of the EM field, which causes memory effects. As a result of the Gaussianity of PGW, it turns out that the EM phasor goes through a stochastic process, which is a manifestation of the fluctuation-dissipation in EM-GW system. The variance of the EM phase smears out as $\Delta^2\varphi(t)= \Delta^2\varphi_0+ 4(t/\tau_c)^4$, where the characteristic time scale $\tau_c$ is associated with the diffusion rate caused by PGWs. The specific quartic growth of the phase noise is thus attributed to the two-mode squeezed nature of PGWs, which is inherently different from the phase diffusion induced by vacuum fluctuations of spacetime or a thermal heat bath of gravitons.",
New submissions,Overcoming Barriers: Kramers' Escape Rate Analysis of Metastable Dynamics in First-Order Multi-Phase Transitions,"Mohammad Ali S. Afshar,Saeed Noori Gashti,Mohammad Reza Alipour,Jafar Sadeghi",General Relativity and Quantum Cosmology (gr-qc); High Energy Physics - Theory (hep-th),"The expanding application of classical thermodynamic methods to black hole physics has yielded significant advances in characterizing phase transition behavior. Among these approaches, thermodynamic analysis -- particularly kinetic formulations like the Kramers' escape rate -- provides a robust framework for probing black hole phase transitions with minimal relativistic constraints. This study investigates the kinetics and dynamic evolution of first-order phase transitions in black holes exhibiting multiple critical points, employing a particle-based escape rate model. The distinct free energy landscapes inherent to multi-critical systems, which can simultaneously support multiple local minima under specific thermodynamic conditions (temperature and pressure) within a given reference frame, raise fundamental questions regarding transition pathways. We rigorously assess whether the Kramers' escape rate retains its predictive validity in these complex multi-minima systems, as established for conventional single-minimum configurations. Furthermore, we examine whether transitions proceed via a sequential, stepwise mechanism between adjacent minima, or if pathways exist that bypass intermediate states through direct descent to the global minimum. Our analysis of black holes undergoing multiphase transitions reveals both parallels and significant deviations from single-transition models. Crucially, we demonstrate that the Kramers' escape rate remains a quantitatively reliable indicator of first-order phase transitions in black holes, even within multi-critical frameworks. This approach offers deeper insights into the governing energetic landscapes and kinetic processes underlying these phenomena.",
