Heading,Title,Authors,Subjects,Abstract,PDF
New submissions,The Nineteenth Data Release of the Sloan Digital Sky Survey,"SDSS Collaboration,Gautham Adamane Pallathadka,Mojgan Aghakhanloo,James Aird,Andrés Almeida,Singh Amrita,Friedrich Anders,Scott F. Anderson,Stefan Arseneau,Consuelo González Avila,Shir Aviram,Catarina Aydar,Carles Badenes,Jorge K. Barrera-Ballesteros,Franz E. Bauer,Aida Behmard,Michelle Berg,F. Besser,Christian Moni Bidin,Dmitry Bizyaev,Guillermo Blanc,Michael R. Blanton,Jo Bovy,William Nielsen Brandt,Joel R. Brownstein,Johannes Buchner,Esra Bulbul,Joseph N. Burchett,Leticia Carigi,Joleen K. Carlberg,Andrew R. Casey,Priyanka Chakraborty,Julio Chanamé,Vedant Chandra,Cristina Chiappini,Igor Chilingarian,Johan Comparat,Kevin Covey,Nicole Crumpler,Katia Cunha,Elena D'Onghia,Xinyu Dai,Jeremy Darling,Megan Davis,Nathan De Lee,Niall Deacon,José Eduardo Méndez Delgado,Sebastian Demasi,Mariia Demianenko,Delvin Demke,John Donor,Niv Drory,Monica Alejandra Villa Durango,Tom Dwelly,Oleg Egorov,Evgeniya Egorova,Kareem El-Badry,Mike Eracleous,Xiaohui Fan,Emily Farr,Douglas P. Finkbeiner,Logan Fries,Peter Frinchaboy,Nicola Pietro Gentile Fusillo,Luis Daniel Serrano Félix,Boris Gaensicke,Emma Galligan,Pablo García,Joseph Gelfand,Katie Grabowski,Eva Grebel,Paul J Green,Hannah Greve,Catherine Grier,Emily Griffith,Paloma Guetzoyan,Pramod Gupta,Zoe Hackshaw,Patrick B. Hall,Keith Hawkins,Viola Hegedűs,Saskia Hekker,T. M. Herbst,J. J. Hermes,Lorena Hernández-García,Pranavi Hiremath,David W Hogg,Jon Holtzman,Keith Horne,Danny Horta,Yang Huang,Brian Hutchinson,Maximilian Häberle,Hector Javier Ibarra-Medel,Alexander P. Ji,Paula Jofre,James W. Johnson,Jennifer Johnson,Evelyn J. Johnston,Mary Kaldor",Astrophysics of Galaxies (astro-ph.GA); Cosmology and Nongalactic Astrophysics (astro-ph.CO); Instrumentation and Methods for Astrophysics (astro-ph.IM); Solar and Stellar Astrophysics (astro-ph.SR),"Mapping the local and distant Universe is key to our understanding of it. For decades, the Sloan Digital Sky Survey (SDSS) has made a concerted effort to map millions of celestial objects to constrain the physical processes that govern our Universe. The most recent and fifth generation of SDSS (SDSS-V) is organized into three scientific ``mappers"". Milky Way Mapper (MWM) that aims to chart the various components of the Milky Way and constrain its formation and assembly, Black Hole Mapper (BHM), which focuses on understanding supermassive black holes in distant galaxies across the Universe, and Local Volume Mapper (LVM), which uses integral field spectroscopy to map the ionized interstellar medium in the local group. This paper describes and outlines the scope and content for the nineteenth data release (DR19) of SDSS and the most substantial to date in SDSS-V. DR19 is the first to contain data from all three mappers. Additionally, we also describe nine value added catalogs (VACs) that enhance the science that can be conducted with the SDSS-V data. Finally, we discuss how to access SDSS DR19 and provide illustrative examples and tutorials.",
Cross submissions,Road through Dark$ν$ess: Probing dark matter-neutrino interactions using KM3-230213A,"Ranjini Mondol,Subhadip Bouri,Akash Kumar Saha,Ranjan Laha",High Energy Physics - Phenomenology (hep-ph); Cosmology and Nongalactic Astrophysics (astro-ph.CO); High Energy Astrophysical Phenomena (astro-ph.HE); High Energy Physics - Experiment (hep-ex),"KM3NeT has recently reported an event where a muon of energy $120^{+110}_{-60}$ PeV was observed at its ARCA detector, which can stem from a very high-energy neutrino interaction in the vicinity of the detector. Besides revolutionizing our understanding of high-energy neutrino sources, this event can serve as a valuable probe for studying Beyond the Standard Model (BSM) interactions of neutrinos. In this work, we study the dark matter (DM)-neutrino interaction by assuming the neutrino for the event KM3-230213A is originated from a blazar. The flux of such neutrinos, traveling through DM distributed across astrophysical and cosmological scales, can get attenuated due to DM interactions. The detection of such event by KM3NeT allows us to place constraints on the interaction cross section at highest-ever neutrino energy. We derive both conservative constraints-neglecting flux attenuation from the host halo-and optimistic ones by including host halo contributions. Our results show that the energy-independent constraints are weaker than previous bounds. For energy-dependent case, the extreme energy of the event allows us to set some of the strongest limits on scattering cross sections. In future, more such neutrino events with well-understood origin will be essential in constraining or potentially discovering DM-neutrino interactions.",
Cross submissions,"Optimal Detection Bands for Intermediate-Mass Black Hole Binaries: Prospects for LISA and AMIGO in General Relativity and $f(R, T)$ Gravity","Marcelo M. Lapola,Oswaldo D. Miranda",General Relativity and Quantum Cosmology (gr-qc); Cosmology and Nongalactic Astrophysics (astro-ph.CO),"We present a semi analytic forecast for the detection of intermediate mass black hole (IMBH) binaries with the space based detectors LISA (millihertz band) and AMIGO (deci hertz band). A redshift dependent population model is built from extrapolated black hole mass functions and realistic pairing and merger time scales. Folding this population through the instrument sensitivities yields event rates of about 1e4 mergers for LISA in four observing years and between 1e2 and 1e3 mergers for AMIGO in three years, with complementary optimal detection bands in total mass and redshift.We then incorporate the minimal matter coupled modified gravity model f(R,T) = R + 2 lambda T. In this scenario the strain amplitude is rescaled by (1 - lambda / 8 pi)^(5/6) while the waveform phasing is unchanged at leading order. For Solar System compatible couplings abs(lambda) <= 2 x 10^-3, the peak detection redshift shifts by less than one percent and the total number of events changes by less than five percent. Combined statistics from LISA and AMIGO therefore provide a consistency check on f(R,T) gravity without spoiling standard IMBH forecasts.",
Cross submissions,On the stability of de Sitter inflationary solution in the Starobinsky-Bel-Robinson gravity,Tuan Q. Do,General Relativity and Quantum Cosmology (gr-qc); Cosmology and Nongalactic Astrophysics (astro-ph.CO),"We will present the way to derive a de Sitter inflationary solution within the so-called Starobinsky-Bel-Robinson gravity. Then, we will show by using the dynamical system method whether the obtained solution is stable or not. According to the stability of the de Sitter inflationary solution, we could judge which phase of our universe, among the two early and late-time phases, is more appropriate for this solution.",
Cross submissions,Resonant Landau-Zener Conversion In Multi-Axion Systems,"David I. Dunsky,Claudio Andrea Manzari,Pablo Quílez,Maria Ramos,Philip Sørensen",High Energy Physics - Phenomenology (hep-ph); Cosmology and Nongalactic Astrophysics (astro-ph.CO); High Energy Physics - Experiment (hep-ex),"Multiple axions may emerge in the low-energy effective theory of Nature. Generically, the potentials describing these axion fields are non-diagonal, leading to mass mixing between axion states which can be temperature-dependent due to QCD instanton effects. As the temperature of the Universe drops, level crossing can occur, causing resonant conversion between axion states. In this work, we present an analytic study of the cosmological evolution of multi-axion systems including adiabatic and non-adiabatic resonant conversion from one axion state into another during the misalignment process. We show how the Landau-Zener formalism accurately captures the non-adiabatic resonant conversion, permitting an analytic description of the relic abundances of each axion field for nearly any arbitrary two-state axion mass matrix. As an application, we study the mixing of a QCD axion with an axion-like-particle for specific potentials to identify the predictions for haloscope experiments. We conclude that the detection of an axion off the expected QCD mass-coupling line predicts other haloscope targets if it mixes with the QCD axion.",
Cross submissions,Dark Walker in the Early Universe: A Strongly Coupled Sector Model,Chen Yang,High Energy Physics - Phenomenology (hep-ph); Cosmology and Nongalactic Astrophysics (astro-ph.CO); High Energy Physics - Theory (hep-th),"We explore the phenomenology of the ``Dark Walker'' -- an $\text{SU}(3)$ theory with eight flavors of fundamental fermions in the dark sector. During inflation, its walking dynamics generate primordial non-Gaussianities through the exchange of unparticles, while accounting for the current dark matter relic abundance if the resulting massive pseudoscalars behave as strongly interacting massive particles (SIMPs). This provides a simple yet concrete example of a strongly coupled sector during inflation.",
Cross submissions,Resolving the QCD Axion Domain Wall Problem with a Light Axion,"Junseok Lee,Kai Murai,Fuminobu Takahashi,Wen Yin",High Energy Physics - Phenomenology (hep-ph); Cosmology and Nongalactic Astrophysics (astro-ph.CO),"We propose two novel solutions to the domain wall problem of the QCD axion by introducing a massless or light axion that also couples to gluons. The first solution applies when the new axion forms strings after inflation. Due to its mixing with the QCD axion, domain walls of the QCD axion are bounded by these strings and confined into cosmologically safe string bundles. This scenario predicts the existence of such string bundles, which may survive until today and leave observable signatures, such as gravitational waves, cosmic birefringence, and CMB anisotropies. The simultaneous detection of the QCD axion and any of these cosmological signatures would serve as a smoking-gun signal. The second solution assumes a homogeneous initial condition for the new axion. If it is sufficiently light, its potential temporarily induces a bias in the QCD axion potential before the onset of oscillations, rendering the domain walls unstable. In both scenarios, the Peccei-Quinn mechanism remains effective, and the strong CP problem is not reintroduced. We identify the viable parameter regions and discuss the resulting dark matter abundance.",
