Heading,Title,Authors,Subjects,Abstract,PDF
New submissions,Gravitational-Wave Background from Extragalactic Double White Dwarfs for LISA,"Guillaume Boileau,Tristan Bruel,Alexandre Toubiana,Astrid Lamberts,Nelson Christensen",General Relativity and Quantum Cosmology (gr-qc); Cosmology and Nongalactic Astrophysics (astro-ph.CO),"Recent studies have revealed the contribution of extragalactic DWD to the astrophysical SGWB could be detectable in the mHz regime by LISA. Conversely, the presence of this SGWB could hamper the detection of cosmological SGWB, which are one of the key targets of GW astronomy. We aim to confirm the spectrum of the extragalactic DWD SGWB and estimate its detectability with LISA under different assumptions. We also aim at understanding the main uncertainties in the spectrum and estimate if the signal could be anisotropic. We use population synthesis code COSMIC with several assumptions on binary evolution and initial conditions. We incorporate a specific treatment to account for the mass transfer and tidal torques after DWDs formation. Our study is in global agreement with previous studies, although we find a lower contribution at high frequencies, due to a different treatment of mass transfer in stellar binaries. We find that the uncertainties in the amplitude are dominated by the SFR model, and to a lesser degree by the binary evolution model. The inclusion of tidal effects and mass transfer episodes in DWDs can change the amplitude of the estimated SGWB up to a factor 3 at the highest frequencies. For all the models, we find that this SGWB could be potentially observable by LISA after 4 years. Under the hypothesis of an homogeneous Universe beyond 200Mpc, anisotropies associated to the astrophysical population of DWDs will likely not be detectable. We provide fits of this SGWB under different assumptions to be used by the community. We demonstrate variability in SGWB predictions, emphasizing uncertainties due to different astrophysical assumptions. We highlight the importance of determining the position of the knee in the SGWB spectrum, as it provides insights on mass transfer models. The prediction of this SGWB is of critical importance for LISA in the context of observing other SGWB.",
New submissions,From Barthel Randers Kropina Geometries to the Accelerating Universe: A Brief Review of Recent Advances in Finslerian Cosmology,"Amine Bouali,Himanshu Chaudhary,Lehel Csillag,Rattanasak Hama,Tiberiu Harko,Sorin V. Sabau,Shahab Shahidi",General Relativity and Quantum Cosmology (gr-qc); High Energy Physics - Theory (hep-th),"We review recent developments in cosmological models based on Finsler geometry and extensions of general relativity within this framework. Finsler geometry generalizes Riemannian geometry by allowing the metric tensor to depend on position and an additional internal degree of freedom, typically represented by a vector field at each point of the spacetime manifold. We explore whether Finsler-type geometries can describe gravitational interaction and cosmological dynamics. In particular, we examine the Barthel connection and $(\alpha, \beta)$ geometries, where $\alpha$ is a Riemannian metric and $\beta$ is a one-form. For a specific construction of $\beta$, the Barthel connection coincides with the Levi-Civita connection of the associated Riemann metric. We review gravitational field and cosmological evolution in three geometries: Barthel-Randers ($F = \alpha + \beta$), Barthel-Kropina ($F = \alpha^2 \beta$), and the conformally transformed Barthel-Kropina geometry. After presenting the mathematical foundations of Finslerian-type modified gravity theories, we derive generalized Friedmann equations in these geometries assuming a Friedmann-Lemaître-Robertson-Walker type metric. We also present the matter-energy balance equations, interpreting them from the perspective of thermodynamics with particle creation. The cosmological properties of Barthel-Randers and Barthel-Kropina models are explored in detail. The additional geometric terms in these models can be interpreted as an effective dark energy component, generating an effective cosmological constant. Several cosmological solutions are compared with observational data (Cosmic Chronometers, Type Ia Supernovae, Baryon Acoustic Oscillations) using MCMC analysis. A comparison with the $\Lambda$CDM model shows that Finslerian models fit observational data well, suggesting they offer a viable alternative to general relativity.",
New submissions,Observational constraints on inflationary models with non-minimally derivative coupling by ACT,"Qing Gao,Yanjiang Qian,Yungui Gong,Zhu Yi",General Relativity and Quantum Cosmology (gr-qc); Cosmology and Nongalactic Astrophysics (astro-ph.CO); High Energy Physics - Theory (hep-th),"The most recent data release from the Atacama Cosmology Telescope (ACT) reveals a larger value of the scalar spectral tilt $n_s$, ruling out a broad class of inflationary attractors. In this paper, we consider inflationary models including the power law potential, the hilltop model, the polynomial $\alpha$-attractor and exponential $\alpha-$attractor, with non-minimally derivative coupling in the high friction limit, and show how the models can fit ACT data. We also derive constraints on the model parameters using the latest ACT data.",
New submissions,Observable signatures of Black Holes with Hernquist Dark Matter Halo having a cloud of strings: From Geodesics to Shadow,"Faizuddin Ahmed,Ahmad Al-Badawi,İzzet Sakallı",General Relativity and Quantum Cosmology (gr-qc); High Energy Physics - Theory (hep-th),"We present a comprehensive theoretical investigation of a novel black hole (BH) spacetime: a Schwarzschild BH embedded in a Hernquist-type dark matter halo (HDMH) and surrounded by a cloud of cosmic strings (CSs) -- collectively termed the Schwarzschild-HDMH with CS (SHDMHCS) configuration. By analyzing the spacetime geometry, we explore how key parameters -- the core radius and halo density of the dark matter, along with the string tension -- affect the geodesic motion of both massless and massive particles. Our results reveal that the combined influence of HDMH and CSs modifies the effective potentials for null and timelike geodesics, leading to distinct dynamical behavior compared to standard Schwarzschild geometry. We perform a perturbative analysis for scalar (spin-0), electromagnetic (spin-1), and Dirac (spin-1/2) fields, deriving the associated effective potentials and showing how both the dark halo and CSs alter field propagation and potential barriers. The shadow of the BH is studied in detail: we derive analytical expressions for photon sphere and shadow radii, finding that CSs tend to enlarge the shadow, while HDMH properties tend to shrink it. The combined effects of these parameters significantly influence the shadow's shape and size, producing potentially observable signatures. Our results establish that the SHDMHCS configuration yields distinct observational imprints detectable by present and forthcoming astrophysical instruments. This framework provides new tools for probing exotic matter distributions via gravitational wave observations, orbital dynamics, and high-resolution black hole imaging, offering a pathway to distinguish such configurations from simpler BH models in realistic environments.",
New submissions,A numerical approach to particle creation in accelerating toy models,"Pedro Duarte Baptista,Alex Vañó-Viñuales,Adrían del Río Vega",General Relativity and Quantum Cosmology (gr-qc),"The formation of black holes by the gravitational collapse of stars is known to spontaneously excite particle pairs out of the quantum vacuum. For the canonical vacuum state at past null infinity, the expected number of particles received at future null infinity can be obtained in full closed form at sufficiently late times. However, for intermediate times, or for more complicated astrophysical processes (e.g. binary black hole mergers), the problem is technically challenging and has not yet been resolved. We develop here a numerical approach to study scattering problems of massless quantum fields in asymptotically flat spacetimes, based on the hyperboloidal slice method used in numerical relativity and perturbation theory. This promising approach can reach both past and future null infinities, and therefore it has the potential to address the Hawking scattering problem more rigorously than evolution on the usual Cauchy slices. We test this approach with some dynamical toy models in Minkowski using effective potentials that mimic the effects of gravity, and compute the spectrum of particles received at future null infinity. We finally discuss future prospects for applying this framework in more relevant gravitational scenarios.",
New submissions,Quasibound states of massive charged scalars around dilaton black holes in $2+1$ dimensions: Exact frequencies,H. S. Vieira,General Relativity and Quantum Cosmology (gr-qc); High Energy Physics - Theory (hep-th); Mathematical Physics (math-ph),"In this work, we investigate massive charged scalar perturbations in the background of three-dimensional dilaton black holes with a cosmological constant. We demonstrate that the wave equations governing the dynamics of these perturbations are exactly solvable, with the radial part expressible in terms of confluent Heun functions. The quasibound state frequencies are computed analytically, and we examine their dependence on the scalar field's mass and charge, as well as on the black hole's mass and electric charge. Our analysis also underscores the crucial role played by the cosmological constant in shaping the behavior of these perturbations. This specific black hole metric arises as a solution to the low-energy effective action of string theory in $2+1$ dimensions, and it holds potential for experimental realization in analog gravity systems due to the similarity between its surface gravity and that of acoustic analogs. Moreover, the analytic tractability of this system offers a valuable testing ground for exploring aspects of black hole spectroscopy, stability, and quantum field theory in curved spacetime. The exact solvability facilitates deeper insights into the interplay between geometry and matter fields in lower-dimensional gravity, where quantum gravitational effects can be more pronounced. Such studies not only enrich our understanding of dilaton gravity and its string-theoretic implications but also pave the way for potential applications in simulating black hole phenomena in laboratory settings using analog models.",
New submissions,Local d'Alembertian for causal sets,"Marián Boguñá,Dmitri Krioukov",General Relativity and Quantum Cosmology (gr-qc),"Causal set theory is an intrinsically nonlocal approach to quantum gravity, inheriting its nonlocality from Lorentzian nonlocality. This nonlocality causes problems in defining differential operators -- such as the d'Alembert operator, a cornerstone of any relativistic field theory -- within the causal set framework. It has been proposed that d'Alembertians in causal sets must themselves be nonlocal to respect causal set nonlocality. However, we show that such nonlocal d'Alembertians do not converge to the standard continuum d'Alembertian for some basic fields. To address this problem, we introduce a local d'Alembert operator for causal sets and demonstrate its convergence to its continuum counterpart for arbitrary fields in Minkowski spacetimes. Our construction leverages recent developments in measuring both timelike and spacelike distances in causal sets using only their intrinsic structure. This approach thus reconciles locality with Lorentz invariance, and paves a way toward defining converging discrete approximations to locality-based differential operators even in theories that are inherently nonlocal.",
New submissions,Identifying multiple images of gravitational-wave sources lensed by elliptical lensing potentials,"Saif Ali,Michael Kesden,Lindsay King",General Relativity and Quantum Cosmology (gr-qc); High Energy Astrophysical Phenomena (astro-ph.HE); High Energy Physics - Theory (hep-th),"Real astrophysical lenses typically lack axisymmetry, necessitating the study of gravitational-wave (GW) lensing by elliptical mass distributions to accurately assess detectability and waveform interpretation. We investigate strong lensing using the singular isothermal ellipsoid (SIE) model, which produces two or four images depending on the source's position relative to lens caustics. Employing a quasi-geometrical optics framework, we determine that the geometrical-optics approximation holds reliably for lens masses above approximately $10^5 \, M_\odot$ at GW frequencies relevant for ground-based detectors $(\sim 10^2 \,\text{Hz})$, though wave-optics effects become significant for lower masses or sources near caustics. Our waveform mismatch analysis demonstrates that the use of three-image templates significantly improves our ability to distinguish source signals, reducing mismatches from $O(10^{-1})$ to $O(10^{-2})$, typically by factors between 1.5 and 5 compared to the standard two-image template model. At lens masses above $10^7 \, M_\odot$, diffraction effects become negligible for ground-based detectors, resulting in an additional mismatch reduction by a factor of approximately three. These findings highlight the critical need for multi-image templates in GW searches to enhance detection efficiency and accuracy.",
New submissions,The gravitational wave echoes from the black hole with three-form fields,"Natthason Autthisin,Supakchai Ponglertsakul,Daris Samart",General Relativity and Quantum Cosmology (gr-qc); Cosmology and Nongalactic Astrophysics (astro-ph.CO); High Energy Physics - Theory (hep-th),"In this work, we study of massless three-form black hole, where the three-form fields are higher $p$-form gauge fields with $p=3$. These give rise to the Schwarzschild-de Sitter (Sch-dS)-like solution through an effective cosmological constant represented by $a_1$. We analyze this solution under gravitational perturbations and find that it exhibits a single-peak potential. For this case, no echoes are produced. Furthermore, we consider the massive case of the three-form fields by introducing a Stueckelberg field to restore gauge invariance and to investigate its effect on GWs at late times. In this case, the potential exhibits a double-peak structure, with the modified potential appearing beside the gravitational perturbation potential. We also examine the impact of the relevant parameters as well as the influence of the parameter $c_0$, which arises from the equation of motion of the Stueckelberg field. For a large value of $a_1$, the two peaks of the potentials are close together, while $c_0$ affects the amplitude and decay rate of the time-domain waveform, resulting in no echoes. For small values of $a_1$, the peaks of the potentials are widely separated and $c_0$ influences both the phase and the amplitude of the echoes. In addition, the quasinormal frequencies of the black hole are also calculated using both the WKB and Prony methods. As results, these provide a potential avenue for testing deviations from GR and probing possible signatures of quantum gravity through future GWs observations.",
New submissions,$g$-mode oscillations of dark matter admixed neutron stars,"Swarnim Shirke,Debarati Chatterjee,Prashanth Jaikumar",General Relativity and Quantum Cosmology (gr-qc); High Energy Astrophysical Phenomena (astro-ph.HE); Solar and Stellar Astrophysics (astro-ph.SR); Nuclear Theory (nucl-th),"We investigate $g$-mode oscillations in dark matter admixed neutron stars employing a relativistic mean field model to describe hadronic matter and a model for self-interacting fermionic dark matter motivated by the neutron decay anomaly. Following the construction of such admixed configurations, we derive the equilibrium and adiabatic speeds of sound therein, leading to a computation of the star's $g$-mode spectrum in the Cowling approximation. In particular, we explore the effect of dark matter self-interaction, the nucleon effective mass and dark matter fraction on the principal $g$-mode frequency, and its first overtone. We show that the effect on $g$-mode frequency depends predominantly on the dark matter fraction, and demonstrate an equation of state-independent constraint for the latter. Prospects of identifying the presence of dark matter in neutron stars using $g$-mode are discussed.",
Cross submissions,Phase transitions in a holographic superfluid model with non-linear terms beyond the probe limit,"Zi-Qiang Zhao,Zhang-Yu Nie,Jing-Fei Zhang,Xin Zhang",High Energy Physics - Phenomenology (hep-ph); Cosmology and Nongalactic Astrophysics (astro-ph.CO); General Relativity and Quantum Cosmology (gr-qc); High Energy Physics - Theory (hep-th),"We study the holographic s-wave superfluid model with 4th and 6th power self-interaction terms $\lambda |\psi|^4$ and $\tau |\psi|^6$ with considering the full back-reaction of the matter fields on the metric in the 3+1 dimensional bulk. The self-interaction terms are good at controlling the condensate to realize various phase transitions, such as the zeroth-order, first-order, and second-order phase transitions within the single condensate s-wave superfluid model. Therefore, in this work, we are able to investigate the influence of the back-reaction strength on the various phase transitions, including the zeroth and first order phase transitions. In addition, we confirm that the influence of the 4th and 6th power terms on the superfluid phase transition in the case of finite back-reaction are qualitative the same as in the probe limit, thus present universality. We also plot the special value $\lambda_s$ of the parameter $\lambda$ at different back-reaction strength, below which the condensate grows to an opposite direction and is important in controlling the order of the superfluid phase transitions. Comparing the influence of the back-reaction parameter and that of the higher-order nonlinear coefficients, we see that the back-reaction strength brings in both the effective couplings similar to the 4th power and 6th power terms.",
Cross submissions,Towards relational foundations for spacetime quantum physics,"Pietro Dall'Olio,José A. Zapata",Quantum Physics (quant-ph); General Relativity and Quantum Cosmology (gr-qc); High Energy Physics - Theory (hep-th),"Rovelli's relational interpretation of quantum mechanics tells us that the description of a system in the formalism of quantum mechanics is not an absolute, but it is relative to the observer itself. The interpretation goes further and proposes a set of axioms. In standard non relational language, one of them states that an observer can only retrieve finite amount information from a system by means of measurement. Our contribution starts with the observation that quantum mechanics, i.e. quantum field theory (QFT) in dimension 1, radically differs from QFT in higher dimensions. In higher dimensions boundary data (or initial data) cannot be specified by means of finitely many measurements. This calls for a notion of measuring scale, which we provide. At a given measuring scale the observer has partial information about the system. Our notion of measuring scale generalizes the one implicitly used in Wilsonian QFT, where at each measuring scale there are effective theories, which may be corrected, and if the theory turns out to be renormalizable the mentioned corrections converge to determine a completely corrected (or renormalized) theory at the given measuring scale. The notion of a measuring scale is the cornerstone of Wilsonian QFT. This notion tells us that we are not describing a system from an absolute perspective. An effective theory at that scale describes the system with respect to the observer, which may retrieve information from the system by means of measurement in a specific way determined by our notion of measuring scale. We claim that a relational interpretation of quantum physics for spacetimes of dimension greater than 1 is Wilsonian.",
Cross submissions,Time-frequency Imprints of Extreme Mass-Ratio Inspirals in Confusion Gravitational Wave Background,"Lingyuan Ji,Liang Dai",Cosmology and Nongalactic Astrophysics (astro-ph.CO); General Relativity and Quantum Cosmology (gr-qc),"Detecting individual extreme-mass-ratio inspirals (EMRIs) is a major science goal of future space-based gravitational wave observatories such as Laser Interferometer Space Antenna (LISA) and TianQin. However, matched-filtering can be challenging as waveform templates are required to be accurate over tens of thousands of orbits. We introduce the time-frequency spectrum as an alternative observable that can be exploited to reveal the chirping of EMRIs at the population level. We analytically calculate this spectrum and its correlators for parameterized populations of slowly chirping sources on quasi-circular orbits, assuming a simplified model of the antenna response for a proof of concept. We then exploit this observable to distinguish between Galactic white dwarf binaries and a possible EMRI population, and quantify the precision at which EMRI population parameters can be determined through a Fisher analysis. We explore several scenarios of EMRI populations and find that this new method may allow us to determine EMRI population parameters at an accuracy level of several percent. Since white dwarf binaries have much longer chirping timescales than the EMRIs do, EMRI population properties can still be determined even if their stochastic gravitational wave background has a power spectrum two orders of magnitude weaker than that of the Galactic white dwarf binaries.",
Cross submissions,The MORRIS Experiment: Magnetic Levitation as a New Probe of Non-Newtonian Gravity,"Dorian W. P. Amaral,Tim M. Fuchs,Hendrik Ulbricht,Christopher D. Tunnell",High Energy Physics - Phenomenology (hep-ph); General Relativity and Quantum Cosmology (gr-qc); High Energy Physics - Experiment (hep-ex),"We present MORRIS (Magnetic Oscillatory Resonator for Rare-Interaction Studies) and propose the first tabletop search for non-Newtonian gravity due to a Yukawa-like fifth force using a magnetically levitated particle. Our experiment comprises a levitated sub-millimeter magnet in a superconducting trap that is driven by a time-periodic source. Featuring short-, medium-, and long-term stages, MORRIS will admit increasing sensitivities to the force coupling strength $\alpha$, optimally probing screening lengths of $\lambda \sim 1\,\mathrm{mm}$. Our short-term setup provides a proof-of-principle study, with our medium- and long-term stages respectively constraining $\alpha \lesssim 10^{-4}$ and $\alpha \lesssim 10^{-5}$, leading over existing bounds. Our projections are readily recastable to concrete models predicting the existence of fifth forces, and our statistical analysis is generally applicable to well-characterized sinusoidal driving forces. By leveraging ultralow dissipation and heavy test masses, MORRIS opens a new window onto tests of small-scale gravity and searches for physics beyond the Standard Model.",
Cross submissions,Identifying Long Radio Transients with Accompanying X-Ray Emission as Disk-Jet Precessing Black Holes: The Case of ASKAP J1832-0911,Antonios Nathanail,High Energy Astrophysical Phenomena (astro-ph.HE); General Relativity and Quantum Cosmology (gr-qc),"Aims: In this work we investigate whether the 2 min bursts every 44 min from ASKAP J1832-0911 can be explained by Lense-Thirring precession of an intermediate-mass black hole (IMBH) accretion disk launching a Blandford-Znajek jet, as an alternative to magnetar or white-dwarf models. Methods: We derive the Lense-Thirring period $ P_{\rm LT}=\frac{\pi G M}{a c^3}r^3 $ and solve $P_{\rm LT}=44$ min for black-hole mass M and dimensionless radius $r=R/R_g$. We estimate the equipartition field B at r, compute the Blandford-Znajek power $P_{\rm BZ}$, and the power expected from a gap at the black hole magnetosphere, and compare the resulting jet luminosity to the observed radio and X-ray fluxes at $D\approx4.5$ kpc. We also evaluate expected high-frequency variability and the angular size for Very Long Baseline Interferometry (VLBI) observations. Results: For $a\sim0.3\!-\!0.9$, an IMBH with $M\sim10^3\!-\!10^5\,M_\odot$ yields $r\sim10\!-\!40\,R_g$ and $P_{\rm LT}=44$ min. Equipartition gives $B\sim10^5$ G at r, leading to $P_{\rm BZ}\sim10^{35\!-\!39}$ erg ${\rm s^{-1}}$. With radiative efficiency $\epsilon_j\sim10^{-2}\!-\!10^{-1}$, the predicted $L_{\rm jet}\sim10^{34\!-\!36}$ erg ${\rm s^{-1}}$ matches the observed $F_X\sim10^{-12}$ erg ${\rm cm^{-2}}$ ${\rm s^{-1}}$ and radio flux, variability on $\lesssim100$ s could be a smoking gun of this model. Conclusions:The IMBH precessing-jet model simultaneously explains the periodicity, energetics, and duty cycle of ASKAP J1832-0911. Only high-time-resolution X-ray timing (to check $\sim$s pulsations) and multi-frequency radio polarimetry can definitively distinguish it from magnetar or white-dwarf scenarios.",
